anime_id,mal_id,title,english_title,japanese_title,user_preferred_title,type,episodes,duration,status,source,season,season_year,studios,main_studios,genres,tags,rating,score,mean_score,scored_by,rank,popularity,popularity_rank,members,favorites,watching,completed,on_hold,dropped,plan_to_watch,start_date,end_date,broadcast_day,broadcast_time,synopsis,country_of_origin,is_licensed,hashtag,cover_image_large,cover_image_color,banner_image,trailer_site,trailer_id,main_characters,main_staff,streaming_sites,is_adult,synonyms,site_url,updated_at,next_airing_episode_at,next_episode_number,collected_at,data_source
194393,61839.0,Aishiteru Game wo Owarasetai,I Want to End this Love Game,愛してるゲームを終わらせたい,Aishiteru Game wo Owarasetai,TV,,,NOT_YET_RELEASED,MANGA,SPRING 2026,2026,Felix Film;Nikkatsu,Felix Film,Comedy;Romance,Female Protagonist;Male Protagonist;Heterosexual;Primarily Teen Cast;Coming of Age;School;Tsundere;Shounen,,,,0,0,11267,0,11267,124,621,15,94,23,10514,2026-04-14,,,,"Childhood friends Yukiya and Miku share everything…except their feelings. Ever since sixth grade, they’ve played a “love game”: they take turns saying “I love you” and whoever gets flustered first loses. Now in high school, their hearts are closer than ever—but will they finally find the courage to confess? <br><br> (Source: Crunchyroll)",JP,True,#愛してるゲームを終わらせたい,https://s4.anilist.co/file/anilistcdn/media/anime/cover/medium/bx194393-0H9yYABu6y0i.jpg,#43aef1,https://s4.anilist.co/file/anilistcdn/media/anime/banner/194393-FmUDMgF0apUJ.jpg,youtube,oGJrnyjDbsA,Yukiya Asagi;Miku Sakura;Wakana Asagi;Hinako Hanaba;Masaru Shinonome,Yuuki Doumoto (Original Creator);Azuma Tani (Director );Keiichirou Oochi (Series Composition);Yuuki Fukuchi  (Character Design);Tomokazu Sugimura (Sub Character Design),Official Site;Twitter;Crunchyroll,False,,https://anilist.co/anime/194393,1774502214,1776175200,1,2026-03-26T05:28:03.424762+00:00,anilist
190704,61501.0,Kanan-sama wa Akumade Choroi,Mistress Kanan is Devilishly Easy,カナン様はあくまでチョロい,Kanan-sama wa Akumade Choroi,TV,,,NOT_YET_RELEASED,MANGA,SPRING 2026,2026,Studio KAI;King Records,Studio KAI,Comedy;Ecchi;Fantasy;Romance,Demons;School;Tsundere;Heterosexual;Female Protagonist;Nudity;Male Protagonist;Slapstick;Female Harem;Shounen,,,,0,0,10838,0,10838,121,714,12,93,37,9982,2026-04-05,,,,"Kanan, a female demon, infiltrates a high school with the goal of devouring some delicious human souls. She sets her sights on the perfect target, a teen boy named Kyougi Youji, and goes for the kill—only to somehow end up in a relationship with him instead?! Kanan’s never been in love before, and this oddly innocent demon creates absolute chaos as the two venture into romance with a first date and beyond!<br> <br> (Source: Crunchyroll)",JP,True,#カナチョロ,https://s4.anilist.co/file/anilistcdn/media/anime/cover/medium/bx190704-Ts1VvkrNdnCZ.jpg,#3586ff,https://s4.anilist.co/file/anilistcdn/media/anime/banner/190704-bLXpyNFVZbss.jpg,youtube,y6whkkkv6kU,Youji Kyougi;Kanan Zebel;Ami;Jeanne;Lillum Zebel,nonco (Original Creator);Yasushi Muroya (Director);Hisashi Isogawa (Assistant Director);Rintarou Ikeda (Series Composition);Akari Minagawa (Character Design),Official Site;Twitter;Crunchyroll,False,Kanan-sama Is Easy as Hell!;KanaChoro;カナチョロ;Mistress Kanan is Devilishly Easy,https://anilist.co/anime/190704,1774502206,1775318400,1,2026-03-26T05:28:03.424804+00:00,anilist
179813,59393.0,Niwatori Fighter,Rooster Fighter,ニワトリ・ファイター,Niwatori Fighter,TV,,23.0,RELEASING,MANGA,SPRING 2026,2026,SANZIGEN;Sola Entertainment;Viz Media,SANZIGEN,Action;Adventure;Comedy;Supernatural,Revenge;Parody;Animals;Kaiju;Male Protagonist;Super Power;Urban;Urban Fantasy;Seinen;Surreal Comedy,,68.0,71.0,0,0,10705,0,10705,115,4170,32,75,177,6251,2026-03-14,,,,"Keiji, the neighborhood cock of the walk is more than just an ordinary rooster—he’s humanity’s greatest defender! His opponents may be ten stories tall, but nothing is bigger than his stout heart and his fearsome battle cry—<i>Kokekokko!</i> <br><br> (Source: VIZ Media, edited)",JP,True,#ニワトリファイター #RoosterFighter,https://s4.anilist.co/file/anilistcdn/media/anime/cover/medium/bx179813-WQ153lF3pDH6.jpg,#e45d43,https://s4.anilist.co/file/anilistcdn/media/anime/banner/179813-RZI6o4qilPyH.jpg,youtube,5hRrvJ08ZSs,Keiji;Piyoko;Elizabeth;Morio;Keisuke,Shuu Sakuratani (Original Creator);Daisuke Suzuki (Director);Hiroshi Seko (Series Composition);Hiroshi Seko (Script);Joseph Chou (Producer),Official Site;Twitter;Twitter;Adult Swim;Instagram;YouTube;Disney Plus;Hulu;Official Site;Instagram;Official Site;Facebook;Crunchyroll,False,ยอดไก่นักสู้กู้โลก,https://anilist.co/anime/179813,1774502218,1774760400,3,2026-03-26T05:28:03.424833+00:00,anilist
180228,59551.0,Ganbare! Nakamura-kun!!,"Go For It, Nakamura-kun!!",ガンバレ！中村くん！！,Ganbare! Nakamura-kun!!,ONA,,,NOT_YET_RELEASED,MANGA,SPRING 2026,2026,Aniplex;Drive,Drive,Comedy;Romance;Slice of Life,Boys' Love;Unrequited Love;LGBTQ+ Themes;Cute Boys Doing Cute Things;School;Parody;Primarily Teen Cast;Primarily Male Cast;Male Protagonist,,,,0,0,10240,0,10240,99,361,15,53,34,9777,2026-04-02,,,,"Nakamura is a shy boy who falls in love at first sight with one of his classmates–his dreamy high school classmate, Hirose. But there's a problem: they haven't met yet. And Nakamura is a total klutz who might bungle things before they even begin! <br><br> (Source: Seven Seas Entertainment) <br><br> <i>Note: The series streamed a week in advance on Hulu Japan starting with episode 2 released alongside episode 1.</i>",JP,True,#ガンバレ中村くん,https://s4.anilist.co/file/anilistcdn/media/anime/cover/medium/bx180228-MuZ7adbGiYVj.jpg,#f15086,https://s4.anilist.co/file/anilistcdn/media/anime/banner/180228-WAvqro5AamHj.jpg,youtube,QivWH79PkcE,Okuto Nakamura;Aiki Hirose ;Hifumi Kawamura;Sou Otogiri;Kouta Takeuchi,Shundei (Original Creator);Aoi Umeki (Director);Naoki Yoshibe (Assistant Director);Yasuko Aoki (Series Composition);Aoi Umeki (Character Design),Official Site;Twitter;Crunchyroll,False,"Go For It, Nakamura!",https://anilist.co/anime/180228,1774502234,1775057400,1,2026-03-26T05:28:03.424862+00:00,anilist
179950,59443.0,Reincarnation no Kaben,Petals of Reincarnation,リィンカーネーションの花弁,Reincarnation no Kaben,TV,,,NOT_YET_RELEASED,MANGA,SPRING 2026,2026,Mag Garden;BENTEN Film;Pony Canyon,BENTEN Film,Action;Supernatural,Shounen;Super Power;Male Protagonist;Historical,,,,0,0,10193,0,10193,88,628,5,65,20,9475,2026-04-03,,,,"Touya Senji is talentless. He's tried everything but he can't seem to excel at anything no matter how hard he tries. Then he meets Haito, a Kendo champion and... humanity's protector? She uses the Stem of Reincarnation to draw on the abilities of her past lives, but it only works when she slits her own throat. And now she wants Touya to join her?! <br><br> (Source: Mangamo, edited)",JP,True,#リィンカーネーションの花弁 #アニメリンネ,https://s4.anilist.co/file/anilistcdn/media/anime/cover/medium/bx179950-g95odyBfYEbU.jpg,#0d8686,,youtube,PmcTPE2SrE8,Touya Senji;Haito Le Buffett;John V. Neumann;Albert Einstein;Newton,Mikihisa Konishi (Original Creator);Shun Kudou (Director );Kousuke Murayama (Assistant Director);Atsuo Ishino (Series Composition);Kentarou Azuma (Action Director),Twitter;Official Site;HIDIVE,False,リンネ,https://anilist.co/anime/179950,1774502259,1775143800,1,2026-03-26T05:28:03.424894+00:00,anilist
182578,60055.0,Yozakura-san Chi no Daisakusen 2nd Season,,夜桜さんちの大作戦 第2期,Yozakura-san Chi no Daisakusen 2nd Season,TV,,,NOT_YET_RELEASED,MANGA,SPRING 2026,2026,NBCUniversal Entertainment Japan;SILVER LINK.,SILVER LINK.,Action;Comedy;Romance,Shounen;Espionage;Heterosexual;Male Protagonist;Female Protagonist;Family Life;Super Power,,,,0,0,10116,0,10116,136,506,54,109,46,9401,2026-04-12,,,,The second season of <i>Yozakura-san Chi no Daisakusen</i>.,JP,True,#夜桜さんちの大作戦 #MissionYozakuraFamily,https://s4.anilist.co/file/anilistcdn/media/anime/cover/medium/bx182578-v6DU4tsXQ3Pb.jpg,#28bbc9,,youtube,dirydQCBa6o,Taiyou Asano;Mutsumi Yozakura;Kyouichirou Yozakura;Nanao Yozakura;Shion Yozakura,Hitsuji Gondaira (Original Creator);Mirai Minato (Chief Director);Takahiro Nakatsugawa (Director);Mirai Minato (Series Composition);Mizuki Takahashi (Character Design),Official Site;Twitter,False,Mission: Yozakura Family Season 2,https://anilist.co/anime/182578,1774502208,1775980800,1,2026-03-26T05:28:03.424922+00:00,anilist
199588,62604.0,Otaku ni Yasashii Gal wa Inai!?,Gals Can't Be Kind to Otaku!?,オタクに優しいギャルはいない!?,Otaku ni Yasashii Gal wa Inai!?,TV,,,NOT_YET_RELEASED,MANGA,SPRING 2026,2026,TMS Entertainment,TMS Entertainment,Comedy;Romance,Gyaru;Otaku Culture;Heterosexual;Primarily Teen Cast;School;Seinen;Male Protagonist,,,,0,0,9868,0,9868,94,664,11,87,25,9081,2026-04-08,,,,"Meet Takuya Seo, an otaku who sits behind the popular gals in class, Ijichi and Amane. Since they're people from different ""castes,"" you wouldn't expect them to have much in common. But when their worlds collide over a borrowed eraser, Takuya slips up about his favorite anime, and Amane...is rather quick to correct him. She says she's not a fan, but her familiarity with the series suggests otherwise. Could she be...a fellow geek?! <br><br> (Source: Yen Press)",JP,True,#オタギャル,https://s4.anilist.co/file/anilistcdn/media/anime/cover/medium/bx199588-fYJalfS0gkSH.jpg,#f1c9a1,https://s4.anilist.co/file/anilistcdn/media/anime/banner/199588-I4HoR4YjnpqD.jpg,youtube,pdWQUnshA4M,Takuya Seo;Kei Amane;Kotoko Ijichi;Hibiki Ijichi;Sayu Amamiya,Norishiro-chan (Original Story);Sakana Uozumi (Original Character Design);Arata Mita (Director);Kazuhiko Inukai (Series Composition);Lion Matsuda (Character Design),Official Site;Twitter;Crunchyroll;YouTube;TikTok,False,OtaGal;オタギャル,https://anilist.co/anime/199588,1774498760,1775659500,1,2026-03-26T05:28:03.424949+00:00,anilist
190143,61443.0,Shunkashuutou Daikousha: Haru no Mai,Agents of the Four Seasons: Dance of Spring,春夏秋冬代行者 春の舞,Shunkashuutou Daikousha: Haru no Mai,TV,,,NOT_YET_RELEASED,LIGHT_NOVEL,SPRING 2026,2026,Aniplex;WIT STUDIO,WIT STUDIO,Drama;Fantasy;Romance,Heterosexual;Urban Fantasy;Mythology;Environmental;Ensemble Cast;Rehabilitation;Swordplay;Shoujo;Gods;Crime,,,,0,0,9416,0,9416,46,505,5,59,19,8828,2026-03-29,,,,"Once upon a time, there was Winter. Winter was once the only season in the world—but such an existence was too lonely to bear, and so it created Spring to love. Before long, the earth wished for more time to rest in the cycle, and Summer and Autumn were born. The ones who carry the cycle are called the Agents of the Four Seasons. Hinagiku, the Vernal Agent, disappeared from this land ten years ago, taking the season of spring with her. Now, after incredible hardship, she has returned to restore the cycle to its proper state—and, as in the myth passed down since the dawn of time, she sends her love to Winter. <br><br> (Source: Yen Press)",JP,True,#春夏秋冬代行者,https://s4.anilist.co/file/anilistcdn/media/anime/cover/medium/bx190143-IqqbkMAF0GOo.jpg,#e4785d,https://s4.anilist.co/file/anilistcdn/media/anime/banner/190143-0Ffw9Tb9Sjdo.jpg,youtube,3NdlPDtfZU4,Hinagiku Kayo;Sakura Himedaka;Rosei Kantsubaki;Itechou Kangetsu;Ruri Hazakura,Kana Akatsuki (Original Creator);Suou (Original Character Design);Ken Yamamoto (Director);Ayumu Hisao (Series Composition);Namiko Torii (Character Design),Official Site;Twitter;Crunchyroll,False,4 Seasons;Utusan Empat Musim: Tarian Musim Semi,https://anilist.co/anime/190143,1774502207,1774710000,1,2026-03-26T05:28:03.424978+00:00,anilist
199029,62485.0,"Kanojo, Okarishimasu 5th Season",Rent-a-Girlfriend Season 5,彼女、お借りします 第5期,"Kanojo, Okarishimasu 5th Season",ONA,,,NOT_YET_RELEASED,MANGA,SPRING 2026,2026,TMS Entertainment;DMM.com,TMS Entertainment,Comedy;Romance,Heterosexual;Fake Relationship;Female Harem;Male Protagonist;Primarily Adult Cast,,,,0,0,8047,0,8047,100,401,65,98,97,7386,2026-04-08,,,,"The fifth season of <i>Kanojo, Okarishimasu</i>. <br><br> <i>Note: Kanojo, Okarishimasu 5th Season was streamed 2 days in advance of the TV broadcast on DMM TV beginning April 8, 2026. Regular broadcasting began on April 11, 2025.</i>",JP,True,#彼女お借りします #かのかり,https://s4.anilist.co/file/anilistcdn/media/anime/cover/medium/bx199029-8eMkhHlD62Ik.png,#5dd6f1,,youtube,_yVyIweMYto,Kazuya Kinoshita;Chizuru Ichinose;Sumi Sakurasawa;Ruka Sarashina;Mini Yaemori,Reiji Miyajima (Original Creator);Kazuomi Koga (Director);Mitsutaka Hirota (Series Composition);Kanna Hirayama (Character Design);Minoru Akiba (Art Director),Twitter;Official Site;Crunchyroll,False,かのかり 5;KanoKari 5,https://anilist.co/anime/199029,1774502240,1775653200,1,2026-03-26T05:28:03.425017+00:00,anilist
186497,60852.0,Koori no Jouheki,The Ramparts of Ice,氷の城壁,Koori no Jouheki,TV,,,NOT_YET_RELEASED,MANGA,SPRING 2026,2026,Studio KAI;TBS;Nichion,Studio KAI,Comedy;Romance;Slice of Life,Heterosexual;Ensemble Cast;Shoujo;School,,,,0,0,7545,0,7545,52,428,3,60,18,7036,2026-04-02,,,,"Socially inept, Higawa Koyuki maintains a wall between herself and other people. She spends her time in high school alone, until she meets Amamiya Minato, a boy who keeps trying to close the distance between them for some reason?! <BR><BR> The loner Koyuki, the popular Miki, the boundary-less Minato, and the kind basketball player Youta. This is the story about four complicated and confused young people and their mixed up lives! <BR><BR> (Source: Margaret, translated)",JP,True,#氷の城壁,https://s4.anilist.co/file/anilistcdn/media/anime/cover/medium/bx186497-uwPrNPphXvjP.jpg,#e49343,https://s4.anilist.co/file/anilistcdn/media/anime/banner/186497-naXtQFMHJaR1.jpg,youtube,a7ah5by0Ffw,Koyuki Hikawa;Minato Amamiya;Miki Azumi;Youta Hino;Uppi,Koucha Agasawa (Original Creator);Mankyuu (Director);Yasuhiro Nakanishi (Series Composition);Miki Ogino (Character Design);Eriko Itou (Sub Character Design),Official Site;Twitter;Netflix,False,Parede de Gelo,https://anilist.co/anime/186497,1774502230,1775141760,1,2026-03-26T05:28:03.425044+00:00,anilist
195268,61931.0,Higeki no Genkyou to Naru Saikyou Gedou Last Boss Joou wa Tami no Tame ni Tsukushimasu.  Season 2,The Most Heretical Last Boss Queen: From Villainess to Savior Season 2,悲劇の元凶となる最強外道ラスボス女王は民の為に尽くします。Season2,Higeki no Genkyou to Naru Saikyou Gedou Last Boss Joou wa Tami no Tame ni Tsukushimasu.  Season 2,TV,,,NOT_YET_RELEASED,LIGHT_NOVEL,SPRING 2026,2026,OLM;Mainichi Broadcasting System,OLM,Comedy;Fantasy;Romance,Medieval;Heterosexual;Female Protagonist;Villainess;Family Life;Super Power;Ojou-sama;Swordplay,,,,0,0,7410,0,7410,89,438,18,69,28,6857,2026-04-07,,,,The second season of <i>Higeki no Genkyou to Naru Saikyou Gedou Last Boss Joou wa Tami no Tame ni Tsukushimasu.</i>,JP,True,#ラス為,https://s4.anilist.co/file/anilistcdn/media/anime/cover/medium/bx195268-HkEv0z9iTCJK.jpg,#e4c928,,youtube,D7q29ONkOsY,Pride Royal Ivy;Tiara Royal Ivy;Stayle Royal Ivy;Gilbert Butler;Arthur Beresford,Tenichi (Original Story);Suzunosuke (Original Character Design);Norio Nitta (Director);Hitomi Mieno (Series Composition);Hitomi Kouno (Character Design),Twitter;Official Site;HIDIVE,False,LasTame 2;ラス為 2,https://anilist.co/anime/195268,1774502258,1775566800,1,2026-03-26T05:28:03.425070+00:00,anilist
187869,61186.0,"Kamiina Botan, Yoeru Sugata wa Yuri no Hana",Botan Kamiina Fully Blossoms When Drunk,上伊那ぼたん、酔へる姿は百合の花,"Kamiina Botan, Yoeru Sugata wa Yuri no Hana",TV,,,NOT_YET_RELEASED,MANGA,SPRING 2026,2026,Soigne;Aniplex,Soigne,Comedy;Romance;Slice of Life,Yuri;Female Protagonist;Primarily Female Cast;Primarily Adult Cast;College;Seinen;Cute Girls Doing Cute Things;Food;Ensemble Cast;LGBTQ+ Themes,,,,0,0,6843,0,6843,39,385,6,41,15,6396,2026-04-11,,,,"Kamiina Botan is a 20-year-old college student. At the welcome party for the dorm she was assigned to, the dorm leader Ibuki gives her a highball to drink and she becomes tipsy, leading to her involvement with Ibuki from now on... A tipsy teasing girl's comedy! ",JP,True,#上伊那ぼたん,https://s4.anilist.co/file/anilistcdn/media/anime/cover/medium/bx187869-MdEklZp7irda.jpg,,,youtube,XX90FklAWsc,Ibuki Tonami;Botan Kamiina;Jinglan Zhang;Kanade Gujou;Yaeka Kitamori,Hey (Original Creator);Takashi Sakuma (Director);Shuntarou Tozawa (Assistant Director);Youko Yonaiyama (Series Composition);Kou Yoshinari (Character Design),Official Site;Twitter;Crunchyroll,False,,https://anilist.co/anime/187869,1774502266,1775833200,1,2026-03-26T05:28:03.425095+00:00,anilist
185211,60444.0,Yowa Yowa Sensei,Yowayowa Sensei,よわよわ先生,Yowa Yowa Sensei,TV,,,NOT_YET_RELEASED,MANGA,SPRING 2026,2026,Brain's Base;Nikkatsu,Brain's Base,Comedy;Ecchi;Romance,Heterosexual;Shounen;Teacher;School;Female Harem;Nudity,,,,0,0,5803,0,5803,67,409,6,65,27,5296,2026-04-11,,,,"High school homeroom teacher Hiyori Hiwamura is known as the “Scary Teacher,” and if you offend her, she’ll put a curse on you! Or at least that’s what everyone believes. She’s secretly a total softy who’s deeply misunderstood, and once you see her sweet side, she’ll put a different kind of spell on you... Unfortunately, one of her students, Akihito Abikura, has accidentally discovered her secret. <br><br> (Source: HIDIVE)",JP,True,#よわよわ先生,https://s4.anilist.co/file/anilistcdn/media/anime/cover/medium/bx185211-ewfgT5Cn99k0.jpg,#f1bbae,https://s4.anilist.co/file/anilistcdn/media/anime/banner/185211-2wkjFD6tz7l3.jpg,youtube,UfkutRs8RHM,Hiyori Hiwamura;Akihito Abikura;Mizuki Mukubayashi;Yuuki Yukishita;Kaya Kuguri,Kamio Fukuchi (Original Creator);Hiroshi Ishiodori (Director );Yoshifumi Fukushima (Series Composition);Naoki Aisaka (Character Design);Yoshiko Tachikawame (Art Director),Twitter;Official Site;HIDIVE,False,YowaYowa Teacher,https://anilist.co/anime/185211,1774502253,1775910600,1,2026-03-26T05:28:03.425122+00:00,anilist
188035,61230.0,Saishuu Gakushou Hibike! Euphonium - Zenpen,,最終楽章 響け！ユーフォニアム 前編,Saishuu Gakushou Hibike! Euphonium - Zenpen,MOVIE,1.0,,NOT_YET_RELEASED,OTHER,SPRING 2026,2026,Kyoto Animation;Pony Canyon;Kyoto Animation,Kyoto Animation,Drama;Music;Slice of Life,Band;Female Protagonist;Coming of Age;School Club;Classical Music;School;Primarily Teen Cast;Primarily Female Cast,,,,0,0,5547,0,5547,43,92,25,28,21,5381,2026-04-24,2026-04-24,,,"The music isn’t over yet!<br><br>  <i>“Sound! Euphonium, The Final Movie”</i> is coming in 2026!",JP,True,#anime_eupho #響けユーフォニアム,https://s4.anilist.co/file/anilistcdn/media/anime/cover/medium/bx188035-wTA4Yse8APa1.png,#5dd6e4,,youtube,DoRoAW6KbQo,Kumiko Oumae;Reina Kousaka;Hazuki Katou;Sapphire Kawashima;Mayu Kuroe,Ayano Takeda (Original Story);Nikki Asada (Original Character Design);Tatsuya Ishihara (Chief Director);Taichi Ogawa (Director);Kazumi Ikeda (Character Design),Twitter;Official Site;TikTok,False,"Sound! Euphonium, The Final Movie Part 1;Final Movement: Sound! Euphonium",https://anilist.co/anime/188035,1774502290,1776956400,1,2026-03-26T05:28:03.425149+00:00,anilist
196012,62048.0,MAO,,MAO,MAO,TV,,,NOT_YET_RELEASED,MANGA,SPRING 2026,2026,Sunrise,Sunrise,Drama;Mystery;Romance;Supernatural,Historical;Female Protagonist;Shounen;Male Protagonist,,,,0,0,5286,0,5286,40,329,6,43,16,4892,2026-04-04,,,,"Nanoka passes through a portal into the Taisho era, where exorcist Mao reluctantly rescues her from the jaws of a grotesque yokai. When Nanoka gets back to the present, she discovers she has some new, incredible abilities. She returns to the past looking for answers, only to get caught up in Mao’s investigation of a series of gruesome murders. As her questions about herself multiply, Nanoka learns that Mao is cursed by a cat demon named Byoki—and so is his sword. If anyone but Mao attempts to wield it, they are doomed. But when Mao’s life is in jeopardy, Nanoka picks up his blade and swings! <br><br>(Source: VIZ Media)",JP,True,#アニメMAO,https://s4.anilist.co/file/anilistcdn/media/anime/cover/medium/bx196012-kawFEw6XhYMh.jpg,#e4935d,,youtube,eVfpoS0rjw0,Mao;Nanoka Kiba;Uozumi;Hyakka;Yurako,Rumiko Takahashi (Original Creator);Teruo Satou (Director);Yuuko Kakihara (Series Composition);Yoshihito Hishinuma (Character Design);Hiroshi Katou (Art Director),Official Site;Twitter,False,,https://anilist.co/anime/196012,1774502267,1775313960,1,2026-03-26T05:28:03.425177+00:00,anilist
189987,61425.0,Ponkotsu Fuuki Iin to Skirt take ga Futekisetsu na JK no Hanashi,The Klutzy Class Monitor and the Girl with the Short Skirt,ポンコツ風紀委員とスカート丈が不適切なJKの話,Ponkotsu Fuuki Iin to Skirt take ga Futekisetsu na JK no Hanashi,TV,,,NOT_YET_RELEASED,MANGA,SPRING 2026,2026,Zero-G;NBCUniversal Entertainment Japan;AQUA ARIS,Zero-G,Comedy;Romance;Slice of Life,School;Male Protagonist;Gyaru;Heterosexual;Tsundere,,,,0,0,5259,0,5259,38,317,4,47,11,4880,2026-04-06,,,,"Sakuradaimon is the school's prefect. A prefect is a student who is authorized to enforce discipline. As a prefect, he's supposed to be a role model to other students, but unfortunately he's not perfect. Kohinata is one of the people who Sakuradaimon has tried to discipline into wearing appropriate school attire, but she has thusfar been disobedient.<br> <br> And so this is a story of the two interacting with one another.",JP,True,#ポンスカ #ponsuka,https://s4.anilist.co/file/anilistcdn/media/anime/cover/medium/bx189987-CkTDPfD7vu2Y.jpg,#e4c950,https://s4.anilist.co/file/anilistcdn/media/anime/banner/189987-0UGf5F7zWNvv.jpg,youtube,jrWzZGBwWBQ,Tougo Sakuradaimon;Poemu Kohinata;Yuu Izubuchi;Seiichi Tsukishima;Motoko Akina,Takuma Yokota (Original Story);Daiji Iwanaga (Director);Masahiro Yokotani (Supervisor);Masahiro Yokotani (Series Composition);You Himuro (Character Design),Official Site;Twitter;Crunchyroll,False,The Story Between a Dumb Prefect and a High School Girl with an Inappropriate Skirt Length;PonSuka,https://anilist.co/anime/189987,1774502198,1775485440,1,2026-03-26T05:28:03.425205+00:00,anilist
192808,61687.0,Jishou Akuyaku Reijou na Konyakusha no Kansatsu Kiroku.,An Observation Log of My Fiancée Who Calls Herself a Villainess,自称悪役令嬢な婚約者の観察記録。,Jishou Akuyaku Reijou na Konyakusha no Kansatsu Kiroku.,TV,,,NOT_YET_RELEASED,LIGHT_NOVEL,SPRING 2026,2026,Ashi Productions;AlphaPolis,Ashi Productions,Comedy;Fantasy;Romance;Slice of Life,Villainess;Heterosexual;Shoujo,,,,0,0,5031,0,5031,48,314,5,41,9,4662,2026-04-06,,,,"Bertia is reincarnated into her favorite otome game—not as the heroine, but as the villainess engaged to the perfect Crown Prince Cecil! Fully aware that her role is to sabotage his future romance, she’s determined to bloom as a wicked flower and wither away according to the story. But no matter how hard she tries to scheme, her “evil” plans only make her more endearing!<br> <br> (Source: Crunchyroll)",JP,True,#自称悪役令嬢,https://s4.anilist.co/file/anilistcdn/media/anime/cover/medium/bx192808-tfrX4Gn2Y1Ye.jpg,#5da1e4,,youtube,r6RkeRy4B4c,Cecil Glo Alphasta;Bertia Ibil Noches;Heronia Inderon;Joanna Curtswarren;Shawn Alphasta,Shiki (Original Story);Wan Hatipisu (Original Character Design);Junichi Yamamoto (Director);Akiko Inoue (Series Composition);Miki Matsumoto (Character Design),Twitter;Official Site;Crunchyroll,False,Observation Records of My Fiancée: The Misadventures of a Self-Proclaimed Villainess,https://anilist.co/anime/192808,1774502228,1775480400,1,2026-03-26T05:28:03.425230+00:00,anilist
200769,62825.0,Saikyou no Shokugyou wa Yuusha demo Kenja demo Naku Kanteishi (Kari) Rashii desu yo?,"The strongest job is apparently not a hero or a sage, but an appraiser (provisional)!",最強の職業は勇者でも賢者でもなく鑑定士（仮）らしいですよ？,Saikyou no Shokugyou wa Yuusha demo Kenja demo Naku Kanteishi (Kari) Rashii desu yo?,ONA,,,NOT_YET_RELEASED,LIGHT_NOVEL,SPRING 2026,2026,Studio Flad;NBCUniversal Entertainment Japan,Studio Flad,Action;Adventure;Comedy;Fantasy,Isekai,,,,0,0,5002,0,5002,65,494,8,58,20,4422,2026-04-02,,,,"Hibiki, a high school student who was suddenly transferred to another world, wanders alone in a vast grassland of a fantasy world where monsters inhabit. All he has are non-combat skills such as ""Appraisal""! From a hopeless situation, he is saved by encounters, and his all-powerful abilities blossom! An another world adventure tale of miraculous reversal cheats burst forth! <br><br> (Source: Alpha Manga) <br><br> <i>Note: Saikyou no Shokugyou wa Yuusha demo Kenja demo Naku Kanteishi (Kari) Rashii desu yo? was streamed a week in advance of the TV broadcast on dAnimestore, and ABEMA starting with episode 2. The first episode was released on April 2, 2026. Regular broadcasting began on April 4, 2026.</i>",JP,True, #アニメ鑑定士仮,https://s4.anilist.co/file/anilistcdn/media/anime/cover/medium/bx200769-8WkFkoFxc2fw.jpg,#5dbbf1,,youtube,f3QbevP2CG0,Hibiki Manabe;Emalia Steinbart;Claude;Lilian;Vene,Atekichi (Original Story);Shigaraki (Original Character Design);Makoto Hoshino (Director);Megumi Shimizu (Series Composition);Mihoko Ookawa (Character Design),Twitter;Official Site;Crunchyroll,False,"The Strongest Occupation Is Not a Hero or a Sage, but an Appraiser (Provisional)!;Kanteishikari",https://anilist.co/anime/200769,1774498756,1775055600,1,2026-03-26T05:28:03.425256+00:00,anilist
