anime_id,mal_id,title,english_title,japanese_title,user_preferred_title,type,episodes,duration,status,source,season,season_year,studios,main_studios,genres,tags,rating,score,mean_score,scored_by,rank,popularity,popularity_rank,members,favorites,watching,completed,on_hold,dropped,plan_to_watch,start_date,end_date,broadcast_day,broadcast_time,synopsis,country_of_origin,is_licensed,hashtag,cover_image_large,cover_image_color,banner_image,trailer_site,trailer_id,main_characters,main_staff,streaming_sites,is_adult,synonyms,site_url,updated_at,next_airing_episode_at,next_episode_number,collected_at,data_source
206523,,Onegai AiPri,,おねがいアイプリ,Onegai AiPri,TV,,,NOT_YET_RELEASED,OTHER,SPRING 2026,2026,OLM;Dongwoo Animation;Avex Pictures;KYORAKU;Shogakukan;Takara Tomy;TV Tokyo;Dongwoo Animation;NAS;OLM,OLM;Dongwoo Animation,Music,,,,,0,0,278,0,278,2,20,2,4,13,239,2026-04-05,,,,The latest entry in the <i>Pretty Series</i> franchise and a new chapter in the <i>AiPri</i> series. <br><br> <i>Note: Relations are provisional and will be updated when more info is announced.</i> ,JP,True,#おねがいアイプリ,https://s4.anilist.co/file/anilistcdn/media/anime/cover/medium/bx206523-2IaJCk4R7i63.jpg,#0035ff,,youtube,j5MgjyhhUBc,Inori Konomi;Aoi Yumemiya;Gumi Tomosaka;Olivia Yuuki;Nana Atami,"syn Sophia, Inc. (Original Creator);Takara Tomy (Original Creator);Hiromi Nashimoto (Original Character Design);Su-Hyeon Gwak (Chief Director);Sung-Min Nam (Chief Director)",Twitter;Official Site,False,,https://anilist.co/anime/206523,1774483807,1775349000,1,2026-03-26T05:28:03.426229+00:00,anilist
200930,63159.0,Anal Mania Otaku to Ananie Daisuki na Ojou-sama: Kiseki no Matching,,アナルマニアオタクとアナニー大好きなお嬢様～奇跡のマッチング～,Anal Mania Otaku to Ananie Daisuki na Ojou-sama: Kiseki no Matching,OVA,2.0,20.0,RELEASING,OTHER,SPRING 2026,2026,WHITE BEAR;Mediabank,,Hentai,,,,50.0,0,0,252,0,252,13,28,8,9,10,197,2026-03-20,2026-05-29,,,"Based on the CG collection by Pin-Point Quick (ピンポイントクイック). <br><br> Takuma Ota is a perverted anal maniac who secretly films the school's toilets and ranks each girl's anus. One day, his secret is discovered by the school's idol, the rich girl Shizue Yukihira...! After learning the protagonist's secret, Shizue says... <i>""W-Would you please train my anus?!""</i> The words she utters are unimaginable. How far will Shizue's anal training rank rise?! This young lady, who we thought was very cute and innocent, is trained to become an anal freak! <br><br> (Source: Mediabank, translated)",JP,True,,https://s4.anilist.co/file/anilistcdn/media/anime/cover/medium/bx200930-LilV7nMGiVKm.png,#e4bba1,,,,,,,True,,https://anilist.co/anime/200930,1774429634,1779980400,2,2026-03-26T05:28:03.426244+00:00,anilist
205772,63276.0,Candy Caries,,キャンディーカリエス,Candy Caries,TV,,,NOT_YET_RELEASED,ORIGINAL,SPRING 2026,2026,WIT STUDIO;TBS,WIT STUDIO,Comedy,Stop Motion,,,,0,0,220,0,220,1,11,2,1,14,192,2026-04-15,,,,"Ame is a child who loves sweets, and the tooth decay that lives in her mouth called Caries. Caries lives a carefree life inside Ame's mouth and even calls her ""Mama"", and Ame's body is always at Caries' mercy. <br><br> (Source: Anime News Network, edited)",JP,True,#キャンディーカリエス #candycaries,https://s4.anilist.co/file/anilistcdn/media/anime/cover/medium/bx205772-kb2YOaXFfPAB.png,#f1930d,https://s4.anilist.co/file/anilistcdn/media/anime/banner/205772-fJwBre4r2a53.jpg,youtube,wM3E9LXHmu0,Ame;Caries;Mikan;Beef;Same,Tomoki Misato (Original Creator);Tomoki Misato (Director);Kenshirou Morii (Assistant Director);Akari Saitou (Editing);Yasunori Ebina (Sound Director),Instagram;Twitter;TikTok;Official Site;YouTube,False,,https://anilist.co/anime/205772,1774490149,1776221760,1,2026-03-26T05:28:03.426272+00:00,anilist
208314,63582.0,Kyonyuu ga Futari Inai to Bokki Shinai Danna no Tame ni Tomodachi wo Tsurete Kita Tsuma,,巨乳が2人いないと勃起しない夫のために友達を連れてきた妻,Kyonyuu ga Futari Inai to Bokki Shinai Danna no Tame ni Tomodachi wo Tsurete Kita Tsuma,OVA,,16.0,NOT_YET_RELEASED,OTHER,SPRING 2026,2026,T-REX;Bunny Walker;Lune Pictures,T-REX,Hentai,Threesome;Primarily Adult Cast,,,,0,0,211,0,211,10,16,2,7,4,182,2026-04-30,,,,"Yuuto and Sae, newlyweds basking in the glow of their marriage, seemed to be enjoying blissful newlywed life—until suddenly, Yuuto couldn't get it up anymore. The reason? His sexual preferences were for big breasts and harems. After learning this, his wife Sae agonized over what to do before finally asking her friend Emi for help. Though hesitant about this wife-approved threesome, Yuuto's harem-loving fetish explodes when faced with Emi—who boasts busty curves rivaling Sae's...!? <br><br> (Source: Lune-soft, translated)",JP,True,,https://s4.anilist.co/file/anilistcdn/media/anime/cover/medium/bx208314-Lw3CFRCPkprM.png,#f1bba1,https://s4.anilist.co/file/anilistcdn/media/anime/banner/208314-fF6kanCQ77pA.jpg,,,,Omina Tachibana (Original Creator),,True,"Kyonyuu ga 2-ri Inai to Bokki Shinai Danna no Tame ni Tomodachi wo Tsurete Kita Tsuma;I Can't Get it Up Without Two Pairs of Big Breasts, So My Wife Brought Her Friend!",https://anilist.co/anime/208314,1774490149,1777474800,1,2026-03-26T05:28:03.426313+00:00,anilist
204349,63153.0,Hyakushou Kizoku 3rd Season OVA,,百姓貴族 3rd Season OVA,Hyakushou Kizoku 3rd Season OVA,OVA,2.0,5.0,NOT_YET_RELEASED,MANGA,SPRING 2026,2026,Pie in the sky,Pie in the sky,Comedy;Slice of Life,Shoujo,,,,0,0,166,0,166,2,11,3,2,10,140,2026-04-24,2026-04-24,,,2 OVAs bundled with the manga's 9th volume.,JP,True,#百姓貴族,https://s4.anilist.co/file/anilistcdn/media/anime/cover/medium/bx204349-7Gq2KOpNqQNb.png,#fef10d,,,,Hiromu Arakawa,Hiromu Arakawa (Original Creator),Official Site;Twitter,False,,https://anilist.co/anime/204349,1774502290,1776956400,1,2026-03-26T05:28:03.426332+00:00,anilist
206004,63345.0,Love wa Gal kara Hajimaru Unmei,,ラブはギャルから始まる運命,Love wa Gal kara Hajimaru Unmei,OVA,2.0,,NOT_YET_RELEASED,MANGA,SPRING 2026,2026,Queen Bee,Queen Bee,Hentai,,,,,0,0,164,0,164,7,10,4,8,4,138,2026-04-10,2026-06-05,,,"<b>Episode 1 - Episode 2 part 1</b> - <i>Ayase Gal wa Boku ni Muchuu: Okaa-san mo Maze nasai yo</i><br> Ayase Miki, a gal student on the verge of repeating a year, ignores her homeroom teacher Sakurai Makoto's warnings. Realizing the situation won't improve without involving her parents, Sakurai pays a home visit. There, he's greeted by her busty mother, Minami. Instead of listening seriously, the mother and daughter start competing, each claiming her own body is better. <br><br> <b>Episode 2 part 2</b> - <i>Totte Torarete Shirokuro Gal Shimai♥</i><br> A loser living alone gets caught stealing underwear left out to dry by his neighbors, who film him and storm into his apartment. The neighbors—a pair of black-and-white gal sisters (Yukino and Natsuno)—demand he take a photo of his dick as part of a settlement. But seeing something bigger than they expected, the two get excited and... <br><br> (Source: Mediabank, translated)",JP,True,,https://s4.anilist.co/file/anilistcdn/media/anime/cover/medium/bx206004-gwD6l2pmSvCr.png,,,,,,Nusmusbim (Original Creator),,True,,https://anilist.co/anime/206004,1774437999,1775746800,1,2026-03-26T05:28:03.426349+00:00,anilist
206003,63394.0,Chimimouryou,,痴魅悶凌,Chimimouryou,OVA,2.0,20.0,NOT_YET_RELEASED,MANGA,SPRING 2026,2026,Queen Bee,Queen Bee,Hentai,,,,,0,0,146,0,146,4,8,4,4,3,127,2026-04-17,2026-05-22,,,<i>Mesuchinpo Gari.</i>,JP,True,,https://s4.anilist.co/file/anilistcdn/media/anime/cover/medium/bx206003-ve6GXbPBCHed.png,,https://s4.anilist.co/file/anilistcdn/media/anime/banner/206003-1RrPKeK9lYmQ.jpg,,,,Sevengar (Original Creator),,True,,https://anilist.co/anime/206003,1774462894,1776351600,1,2026-03-26T05:28:03.426365+00:00,anilist
206840,63520.0,Todo no Tsumari,,とどの妻り,Todo no Tsumari,OVA,,,NOT_YET_RELEASED,ORIGINAL,SPRING 2026,2026,Nur,Nur,Hentai,,,,,0,0,143,0,143,7,11,3,7,4,118,2026-04-24,,,,"Despite all my hard work, that guy... Mother Misako had fallen asleep, face-down on the living room table. The screen of her working laptop illuminated her voluptuous form in the darkness. Her ample curves, slipping off the table and swaying, were being kneaded by the hands of her beloved son, Majime... <br><br> These weren't feelings for a mother... Every time Majime became conscious of Misako, he was tormented by anguish. The secret his aunt Reika had taught him... As a mother, a wife, a female teacher, Misako poured her heart into her daily duties. She wanted to save her. The reality that suddenly descended upon him. The moment he heard that fact, the sound of the shackles binding his boiling son's rod snapped... <br><br> (Source: Getchu, translated)",JP,True,,https://s4.anilist.co/file/anilistcdn/media/anime/cover/medium/bx206840-WSrKIJA0GFci.png,,,,,,,,True,,https://anilist.co/anime/206840,1774448768,1776956400,1,2026-03-26T05:28:03.426379+00:00,anilist
208361,63657.0,Seishidouin no Oshigoto The Animation,,性指導員のお仕事 The Animation,Seishidouin no Oshigoto The Animation,OVA,,,NOT_YET_RELEASED,OTHER,SPRING 2026,2026,Show-Ten,,Hentai,,,,,0,0,95,0,95,5,7,0,5,4,79,2026-05-29,,,,,JP,True,,https://s4.anilist.co/file/anilistcdn/media/anime/cover/medium/bx208361-4uMcLF44TJmM.png,#d69378,,,,,Malcorond (Original Creator),,True,,https://anilist.co/anime/208361,1774342948,1779980400,1,2026-03-26T05:28:03.426394+00:00,anilist
209541,63773.0,PetitCure: Precure Fairies Season 3,,ぷちきゅあ～Precure Fairies～ シーズン3,PetitCure: Precure Fairies Season 3,ONA,,,RELEASING,ORIGINAL,SPRING 2026,2026,IKIF+,IKIF+,Fantasy;Slice of Life,Fairy;Chibi;Animals;Primarily Animal Cast;No Dialogue,,,,0,0,91,0,91,1,24,0,1,5,61,2026-03-26,,,,"In Season 3, in addition to the familiar Mysterious Amusement Park and Candy Paradise, many new locations—including a lively performance stage—will make their debut!<br><br> Furthermore, joining the ranks of our active heroes like PetitCure Mofurun and PetitCure Pollun, new friends such as PetitCure Purirun and PetitCure Meroron will also be appearing!<br><br> Everything is even cuter when you're with a friend! ♪<br><br> Please look forward to more heartwarming and humorous stories that will leave you feeling cozy and healed by all the cute PetitCure. ♡<br><br>  (Source: Official Website)",JP,True,,https://s4.anilist.co/file/anilistcdn/media/anime/cover/medium/bx209541-p9YKR3vE0Fx6.jpg,#d6e4a1,,youtube,4anmA68beog,Pollun;Mofurun;Mepple;Coco;Nuts,Izumi Toudou (Original Creator);Yuuko Okumura (Director);Momoka Toyoda (Series Composition);Hiro Nagasuna (Concept Art);Nao Kanegae (Concept Art),Official Site;YouTube,False,PuchiCure 3,https://anilist.co/anime/209541,1774498823,1775079000,2,2026-03-26T05:28:03.426418+00:00,anilist
208749,63765.0,Nuki Nuki ♡ Zupposism,,ヌきヌき♡ずっぽしイズム,Nuki Nuki ♡ Zupposism,OVA,,20.0,NOT_YET_RELEASED,MANGA,SPRING 2026,2026,Queen Bee,Queen Bee,Hentai,,,,,0,0,90,0,90,5,6,0,3,2,79,2026-06-12,,,,<i>Tonari no Elf Mama</i>,JP,True,,https://s4.anilist.co/file/anilistcdn/media/anime/cover/medium/bx208749-8Tw6LuaE6oQF.png,#f1c9ae,,,,,Drachef (Original Creator),,True,,https://anilist.co/anime/208749,1774466906,1781190000,1,2026-03-26T05:28:03.426435+00:00,anilist
208264,,Muchuu no Tou,,霧中ノ塔,Muchuu no Tou,OVA,,,NOT_YET_RELEASED,OTHER,SPRING 2026,2026,Majin petit,Majin petit,Hentai,,,,,0,0,71,0,71,2,7,1,4,1,58,2026-05-29,,,,Based on the erotic doujin game by Shiganai Atelier (シガナイアトリエ).,JP,True,,https://s4.anilist.co/file/anilistcdn/media/anime/cover/medium/bx208264-suCmiuMBZfBy.png,#5dbbe4,,,,,,,True,Shrouded in Mist,https://anilist.co/anime/208264,1774433919,1779980400,1,2026-03-26T05:28:03.426449+00:00,anilist
201910,,Oshiri Dandy the Young,,おしりダンディ ザ・ヤング,Oshiri Dandy the Young,TV,,,NOT_YET_RELEASED,OTHER,SPRING 2026,2026,,,,,,,,0,0,66,0,66,0,5,2,2,15,42,2026-04-04,,,,,JP,True,,https://s4.anilist.co/file/anilistcdn/media/anime/cover/medium/bx201910-yulAeyMQbbvw.png,#50d6fe,,youtube,ClHFIN462aw,Dandy Oshiri ;Oshiri Tantei;Brown;Hehe,Robinson Haruhara (Original Story);Akihiro Kikuchi (Original Character Design),,False,,https://anilist.co/anime/201910,1774429588,0,0,2026-03-26T05:28:03.426465+00:00,anilist
198411,62495.0,Nezumi-kun no Chokki (TV),,ねずみくんのチョッキ (TV),Nezumi-kun no Chokki (TV),TV,,,NOT_YET_RELEASED,OTHER,SPRING 2026,2026,Poplar;NHK;Creadom8,Creadom8,Fantasy,,,,,0,0,53,0,53,0,7,1,2,15,28,2026-04-04,,,,,JP,True,#ねずみくんのチョッキ,https://s4.anilist.co/file/anilistcdn/media/anime/cover/medium/bx198411-FuPLk3KBEoFH.png,#c95050,,youtube,_gP6XPIBgmo,Nezumi-kun;Nemi-chan,Yoshio Nakae (Original Story);Noriko Ueno (Original Character Design);Nobuyoshi Habara (Director );Kanemori Yasuda (Character Design);Kanemori Yasuda (CG Director),Official Site;Twitter,False,Little Mouse's Red Vest,https://anilist.co/anime/198411,1774477307,1775262600,1,2026-03-26T05:28:03.426484+00:00,anilist
206950,63383.0,Kumarba Season 3,,クマーバシーズン3,Kumarba Season 3,TV,,,NOT_YET_RELEASED,OTHER,SPRING 2026,2026,Akatsuki Media Studio,Akatsuki Media Studio,Action;Comedy,Animals;Primarily Animal Cast;Kids,,,,0,0,40,0,40,0,5,2,1,13,19,2026-04-12,,,,Third season of <i>Kumarba</i>.,JP,True,,https://s4.anilist.co/file/anilistcdn/media/anime/cover/medium/bx206950-pNm7O5inBKBX.png,#e4c95d,,youtube,ZMbzOD0r_Us,Nekolun;Bagrin;Kumarba;Taburisu,Shouichirou Hiwatari (Original Creator);Tommy Hino (Director);Takashi Mizuno (Series Composition);Takashi Mizuno (Script),Twitter;Official Site,False,,https://anilist.co/anime/206950,1774429337,1775944800,1,2026-03-26T05:28:03.426503+00:00,anilist
202386,,Shou 3 Ashibe QQ Goma-chan,,小3アシベ QQゴマちゃん,Shou 3 Ashibe QQ Goma-chan,TV_SHORT,,,NOT_YET_RELEASED,MANGA,SPRING 2026,2026,DLE,DLE,Comedy;Slice of Life,,,,,0,0,40,0,40,0,3,2,1,10,24,2026-04-12,,,,,JP,True,,https://s4.anilist.co/file/anilistcdn/media/anime/cover/medium/bx202386-wjFf8ubM1XZR.png,#f1bb1a,,youtube,cZftmR93acE,Goma-chan;Ashibe Ashiya,Hiromi Morishita (Original Creator);Koutarou Yamawaki (Director );Koutarou Yamawaki (Character Design);Mayu Murayama (Art Director);Ikki Kuwahara (Sound Director),Twitter;Official Site,False,,https://anilist.co/anime/202386,1774437999,1775944800,1,2026-03-26T05:28:03.426524+00:00,anilist
178789,59193.0,Mushoku Tensei III: Isekai Ittara Honki Dasu,Mushoku Tensei: Jobless Reincarnation Season 3,無職転生Ⅲ ～異世界行ったら本気だす～,Mushoku Tensei III: Isekai Ittara Honki Dasu,TV,,,NOT_YET_RELEASED,LIGHT_NOVEL,SUMMER 2026,2026,Toho;Studio Bind;Frontier Works;KADOKAWA;EGG FIRM,Studio Bind,Adventure;Drama;Ecchi;Fantasy,Male Protagonist;Family Life;Coming of Age;Isekai;Heterosexual;Magic;Gods;Polyamorous;Medieval;Primarily Adult Cast,,,,0,0,54441,0,54441,863,2024,657,399,134,51227,2026-07-01,,,,The third season of <i>Mushoku Tensei: Isekai Ittara Honki Dasu</i>.,JP,True,#無職転生,https://s4.anilist.co/file/anilistcdn/media/anime/cover/medium/bx178789-0K4YBIVHTHQQ.jpg,#933528,,youtube,M-3YqJA6UlM,Rudeus Greyrat;Sylphiette;Eris Boreas Greyrat;Roxy Migurdia;Shizuka Nanahoshi,Rifujin na Magonote (Original Story);Sirotaka (Original Character Design);Ryousuke Shibuya (Director);Ryouta Furukawa (Character Design);Sanae Shimada (Character Design),Twitter;Official Site;Crunchyroll,False,Mushoku Tensei: Jobless Reincarnation Season 3;無職転生 ～異世界行ったら本気だす～ 第3期;Mushoku Tensei: Isekai Ittara Honki Dasu 3rd Season,https://anilist.co/anime/178789,1774502211,0,0,2026-03-26T05:28:03.426554+00:00,anilist
133007,48820.0,Mahou Shoujo Madoka☆Magica: Walpurgis no Kaiten,Puella Magi Madoka Magica the Movie -Walpurgisnacht: Rising-,劇場版 魔法少女まどか☆マギカ〈ワルプルギスの廻天〉,Mahou Shoujo Madoka☆Magica: Walpurgis no Kaiten,MOVIE,1.0,,NOT_YET_RELEASED,ORIGINAL,SUMMER 2026,2026,Shaft;Aniplex,Shaft,Mahou Shoujo,Magic;Female Protagonist;Primarily Female Cast;Philosophy;Witch;Super Power;Yuri;Urban Fantasy;Kuudere;Guns,,,,0,0,39650,189,39650,448,778,404,152,72,38244,2026-08-28,2026-08-28,,,"The 10th anniversary online event for the <i>Mahou Shoujo Madoka☆Magica</i> anime revealed that the franchise is getting a new anime film titled <i>Mahou Shoujo Madoka☆Magica: Walpurgis no Kaiten</i>. The film will be an official sequel to the <i>Mahou Shoujo Madoka☆Magica: Hangyaku no Monogatari</i> film that opened in October 2013. The tagline on the new film's visual reads, <i>""Now, let's continue the story.""</i><br><br> (Source: Anime News Network, edited)",JP,True,#魔法少女まどかマギカ,https://s4.anilist.co/file/anilistcdn/media/anime/cover/medium/bx133007-5gOUXDvzxy9S.jpg,#e4935d,https://s4.anilist.co/file/anilistcdn/media/anime/banner/133007-NkSVqsR7CTgT.jpg,youtube,B1YTdDt49lE,Madoka Kaname;Homura Akemi;Mami Tomoe;Sayaka Miki;Kyouko Sakura,Magica Quartet (Original Creator);Ume Aoki (Original Character Design);Akiyuki Shinbou (Chief Director);Yukihiro Miyamoto (Director);Junichirou Taniguchi (Character Design),Official Site;Twitter;Official Site;Twitter,False,Magical Girl Madoka Magica Movie 4;Puella Magi Madoka Magica Movie 4,https://anilist.co/anime/133007,1774502290,1787842800,1,2026-03-26T05:28:03.426581+00:00,anilist
185874,60636.0,BLEACH: Sennen Kessen-hen - Kashin-tan,BLEACH: Thousand-Year Blood War - The Calamity,BLEACH 千年血戦篇-禍進譚-,BLEACH: Sennen Kessen-hen - Kashin-tan,TV,13.0,,NOT_YET_RELEASED,MANGA,SUMMER 2026,2026,Studio Pierrot;Shueisha;TV Tokyo;Dentsu;PIERROT FILMS,PIERROT FILMS,Action;Adventure;Supernatural,Shounen;Male Protagonist;Swordplay;Gods;War;Urban Fantasy;Super Power;Memory Manipulation;Gore,,,,0,0,30963,0,30963,608,1166,551,228,37,28981,2026-07-01,,,,The fourth and final part of <i>BLEACH: Sennen Kessen-hen</i>. ,JP,True,#BLEACH_anime #BLEACH,https://s4.anilist.co/file/anilistcdn/media/anime/cover/medium/bx185874-Oxopn5t9hZj1.jpg,#50bbf1,,youtube,W99Ef2LkyOg,Ichigo Kurosaki;Orihime Inoue;Uryuu Ishida;Yasutora Sado;Ganju Shiba,Tite Kubo (Original Creator);Tomohisa Taguchi (Chief Director);Hikaru Murata (Director);Tomohisa Taguchi (Series Composition);Masaki Hiramatsu (Series Composition),Official Site;Twitter;Instagram;TikTok;YouTube,False,BLEACH: Thousand-Year Blood War Part 4;BLEACH 千年血戦篇 第4クール;BLEACH: Thousand-Year Blood War The Final Part;BLEACH TYBW,https://anilist.co/anime/185874,1774502239,0,0,2026-03-26T05:28:03.426607+00:00,anilist
187260,61126.0,Kimi ga Shinu made Koi wo Shitai,,きみが死ぬまで恋をしたい,Kimi ga Shinu made Koi wo Shitai,TV,,,NOT_YET_RELEASED,MANGA,SUMMER 2026,2026,ROLL2;infinite;KADOKAWA,ROLL2,Drama;Fantasy;Romance,War;Yuri;Primarily Female Cast;Magic;School;Primarily Teen Cast;Female Protagonist;LGBTQ+ Themes;Gore;Body Horror,,,,0,0,17987,0,17987,211,381,13,88,19,17486,2026-07-01,,,,"At the mysterious orphanage where Sheena lives, death is nothing new to its residents—girls who no longer have families of their own, who are raised as weapons of war, taught to kill and take the lives of others without batting an eye. Everyone, that is, except Sheena, who wishes for nothing more than the growing conflict around her to end. On the night of her roommate's death, Sheena meets a strange girl covered in blood, who smiles despite the turmoil surrounding them. The next day, the girl appears as a new student in Sheena's class and introduces herself as Mimi. Initially thought to be a school myth, there are now whispers in the orphanage's halls that Mimi is their secret weapon—an immortal who cannot die. When Mimi is later assigned as Sheena's new roommate, Sheena's world grows even more complicated when she begins living with someone who loves and welcomes death, when all Sheena wants to do is stop it… <br><br> (Source: Kodansha USA)",JP,True,#きみ死ぬアニメ,https://s4.anilist.co/file/anilistcdn/media/anime/cover/medium/bx187260-ZGbR8hF953lj.jpg,#86aee4,https://s4.anilist.co/file/anilistcdn/media/anime/banner/187260-HMkLPy3ZvzW1.jpg,youtube,OYIv6-LQGCY,Sheena Totsuki;Mimi Kagari;Seiran Lizzy;Ali Maud,Nachi Aono (Original Creator);Yasushi Tomoda (Director);Nao Enomoto (Assistant Director);Takudai Kakuchi (Creative Advisor);Jukki Hanada (Series Composition),Official Site;Twitter,False,I Want to Love You Till Your Dying Day;きみ死ぬ;KimiShinu,https://anilist.co/anime/187260,1774502205,0,0,2026-03-26T05:28:03.426632+00:00,anilist
103303,62856.0,Nijuuseiki Denki Mokuroku: Eureka・Evrika,Sparks of Tomorrow,二十世紀電氣目録-ユーレカ・エヴリカ-,Nijuuseiki Denki Mokuroku: Eureka・Evrika,TV,,,NOT_YET_RELEASED,OTHER,SUMMER 2026,2026,Kyoto Animation;Heart Company;Rakuonsha,Kyoto Animation,Adventure;Romance,Historical;Female Protagonist;Steampunk;Heterosexual,,,,0,0,15965,0,15965,106,273,13,56,19,15604,2026-07-01,,,,"The novel takes place in the summer of 1907, the 40th year of the Meiji era. 15-year-old Inako Momokawa lives in the Fushimi area of Kyoto, and is the second daughter of a sake brewer. Nothing she does ever comes out right, and she receives a scolding from her father every day. Her only relief is the trust she places in her prayers to the gods. One day while at Fushimi Inari shrine, she meets a freewheeling young man named Kihachi Sakamoto. He rejects the gods, and boasts of the incoming age of electricity. <br><br>  The topic of marriage suddenly comes up in Inako's household. Her father is one-sidedly making all the decisions for her, and Inako is about to give up hope. It is then that Kihachi draws out Inako's true feelings of wanting to run away from her family. The only way to stop her marriage is to find an unusual book called the ""Electricity Catalog."" The book is a prediction book about electricity that Kihachi wrote when he was a child, but his older brother Seiroku took the b",JP,True,#二十世紀電氣目録 #sparks_of_tomorrow,https://s4.anilist.co/file/anilistcdn/media/anime/cover/medium/bx103303-q3O7GVa9dfay.png,#d68678,https://s4.anilist.co/file/anilistcdn/media/anime/banner/103303-K73aVOqkCPqL.jpg,youtube,_O5ZVkdhQhc,Kihachi Sakamoto;Inako Momokawa;Yousuke Mizoe;Kengo Kuga;Noriko Momokawa,Hiro Yuuki (Original Creator);Kazumi Ikeda (Original Character Design);Minoru Oota (Director);Tatsuhiko Urahata (Series Composition);Kouhei Okamura (Character Design),Official Site;Twitter;Official Site;Official Site;Instagram;TikTok;Official Site;Bluesky;Twitter;Netflix,False,20th Century Electricity Catalogue;Twentieth Century Electrical Records;A Luz do Futuro,https://anilist.co/anime/103303,1774502240,0,0,2026-03-26T05:28:03.426660+00:00,anilist
199111,62542.0,Grand Blue Season 3,,ぐらんぶる Season 3,Grand Blue Season 3,TV,,,NOT_YET_RELEASED,MANGA,SUMMER 2026,2026,,,Comedy;Slice of Life;Sports,Foreign,,,,0,0,13780,0,13780,152,274,42,75,31,13358,2026-07-01,,,,The third season of <i>Grand Blue</i>.,JP,True,#ぐらんぶる,https://s4.anilist.co/file/anilistcdn/media/anime/cover/medium/bx199111-coc4mje1Tnsa.jpg,#f1e450,,,,Chisa Kotegawa;Iori Kitahara;Kouhei Imamura;Sayaka Kotegawa;Chief,Kenji Inoue (Original Story);Kimitake Yoshioka (Original Character Design),Twitter;Official Site,False,Grand Blue Dreaming Season 3,https://anilist.co/anime/199111,1774502227,0,0,2026-03-26T05:28:03.426679+00:00,anilist
185542,60522.0,"Gaikotsu Kishi-sama, Tadaima Isekai e Odekakechuu II",,骸骨騎士様、只今異世界へお出掛け中Ⅱ,"Gaikotsu Kishi-sama, Tadaima Isekai e Odekakechuu II",TV,,,NOT_YET_RELEASED,LIGHT_NOVEL,SUMMER 2026,2026,Aura Studio;Pony Canyon;DAX Production,Aura Studio,Action;Adventure;Comedy;Fantasy,Medieval;Skeleton;Isekai;Male Protagonist;Magic;Swordplay,,,,0,0,13115,0,13115,190,426,76,94,34,12485,2026-07-01,,,,"The second season of <i>Gaikotsu Kishi-sama, Tadaima Isekai e Odekakechuu</i>.",JP,True,#骸骨騎士様,https://s4.anilist.co/file/anilistcdn/media/anime/cover/medium/bx185542-q1cWhKf4Ereo.jpg,#1aa1e4,,youtube,tbdLpKKbjFQ,Arc ;Ponta;Ariane Glenys Maple;Chiyome;Dylan Tahg Lalatoya,Enki Hakari (Original Story);KeG (Original Character Design);Katsumi Ono (Director);Toshizou Nemoto (Series Composition);Tooru Imanishi (Character Design),Twitter;Official Site,False,Skeleton Knight in Another World Season 2,https://anilist.co/anime/185542,1774502197,0,0,2026-03-26T05:28:03.426704+00:00,anilist
196187,62076.0,Super no Ura de Yani Suu Futari,,スーパーの裏でヤニ吸うふたり,Super no Ura de Yani Suu Futari,TV,,,NOT_YET_RELEASED,MANGA,SUMMER 2026,2026,Asahi Production;Asmik Ace,Asahi Production,Comedy;Romance;Slice of Life,Seinen;Iyashikei;Konbini;Heterosexual;Work;Primarily Adult Cast;Urban,,,,0,0,12663,0,12663,145,243,6,60,17,12337,2026-07-01,,,,"At age forty-five, office worker Sasaki has had enough of the corporate grind. His only solace is smoking-and the friendly smile of supermarket cashier Yamada. When Sasaki can't find Yamada after a particularly trying day, a striking woman invites him to smoke with her. The despondent man thinks he's made a new smoking buddy in the cool, teasing Tayama, but Sasaki doesn't realize he already knows her! <br><br> (Source: Square Enix)",JP,True,#ヤニすう,https://s4.anilist.co/file/anilistcdn/media/anime/cover/medium/bx196187-cXhET893v3Ag.png,#6b1a35,https://s4.anilist.co/file/anilistcdn/media/anime/banner/196187-Z9dV6uotmKjM.jpg,youtube,X3rDbqrQgxw,Sasaki;Yamada;Suzuki,Jinushi (Original Creator),Twitter;Official Site,False,"Smoking Behind the Supermarket with You;Behind the supermarket, smoking with you.;ヤニすう;YaniSuu",https://anilist.co/anime/196187,1774502279,0,0,2026-03-26T05:28:03.426725+00:00,anilist
