anime_id,mal_id,title,english_title,japanese_title,user_preferred_title,type,episodes,duration,status,source,season,season_year,studios,main_studios,genres,tags,rating,score,mean_score,scored_by,rank,popularity,popularity_rank,members,favorites,watching,completed,on_hold,dropped,plan_to_watch,start_date,end_date,broadcast_day,broadcast_time,synopsis,country_of_origin,is_licensed,hashtag,cover_image_large,cover_image_color,banner_image,trailer_site,trailer_id,main_characters,main_staff,streaming_sites,is_adult,synonyms,site_url,updated_at,next_airing_episode_at,next_episode_number,collected_at,data_source
185506,60553.0,Nonohara Yuka no Himitsu no Haishin,,野々原柚花のヒミツのハイシン,Nonohara Yuka no Himitsu no Haishin,OVA,,16.0,RELEASING,OTHER,WINTER 2025,2025,Bunny Walker;Lune Pictures;T-REX,T-REX,Hentai,Filmmaking;Female Protagonist;Sex Toys;Masturbation;Large Breasts;Drugs;Boobjob;Nakadashi;Fellatio,,67.0,71.0,0,0,1307,0,1307,74,346,268,125,39,529,2025-02-28,,,,"Yuka spends her days in an uncomfortable classroom, eating lunch alone, and thinking only about the time she would sex stream at home. One day, she finds what appears to be a love letter in her shoe locker! When she opens it with high hopes, she finds a screenshot of her latest stream and a letter calling her... The man who called her uses the fact that her stream was exposed as a pretext to pressure her into sex streaming in front of him. Rather than being assaulted... she does as he says and does it until she climaxes, but the man assaults Yuka right after she has climaxed!?<br> <br> (Source: Lune-soft, translated)",JP,True,,https://s4.anilist.co/file/anilistcdn/media/anime/cover/medium/bx185506-e6BT2M2TFz3i.png,#f1bbae,https://s4.anilist.co/file/anilistcdn/media/anime/banner/185506-qYsK2nLRalpJ.jpg,,,Yuka Nonohara,Siokonbu (Original Creator);Ken Raika (Director);Megane Sagari (Storyboard),,True,Yuka Nonohara's Secret Livestream,https://anilist.co/anime/185506,1774502290,0,0,2026-03-26T05:28:03.409943+00:00,anilist
183602,60216.0,Kanojo Face THE ANIMATION,,彼女フェイス THE ANIMATION,Kanojo Face THE ANIMATION,OVA,,20.0,RELEASING,MANGA,WINTER 2025,2025,Pink Pineapple;Shion,Shion,Hentai,Heterosexual,,64.0,69.0,0,0,1232,0,1232,45,233,343,99,33,524,2025-01-31,,,,,JP,True,,https://s4.anilist.co/file/anilistcdn/media/anime/cover/medium/bx183602-8yGvSxmilgjW.png,#e4a178,,,,Sanae Nakagawa;Konishi,Mashiro Shirako (Original Creator);Toshihiro Watase (Director);Toshihiro Watase (Storyboard);Toshihiro Watase (Episode Director),,True,,https://anilist.co/anime/183602,1774490149,0,0,2026-03-26T05:28:03.410072+00:00,anilist
184810,60494.0,Immoral Routine The Animation,,インモラルーティーン The Animation,Immoral Routine The Animation,OVA,,30.0,RELEASING,MANGA,WINTER 2025,2025,Pink Pineapple;Seven,Seven,Hentai,Masturbation;Public Sex;School;Heterosexual;Sex Toys,,69.0,75.0,0,0,1206,0,1206,65,274,229,116,31,556,2025-03-28,,,,"<i>Routine</i><br> When Shouta saw his classmate Nao masturbating in the classroom, he couldn't help but ask her <i>""Do you wanna do that... together?""</i>, and since then, they have been masturbating together in the school building early in the mornings. Seeking some excitement in their daily routine, which had become monotonous and routine, the two decide to ""get down to it for real""...<br> <br> (Source: PinkPineapple, translated and edited)",JP,True,,https://s4.anilist.co/file/anilistcdn/media/anime/cover/medium/bx184810-BJhp0LMwWKpP.png,#c95086,,,,Shouta;Nao,Alp (Original Creator);Saishin Saide (Director),,True,,https://anilist.co/anime/184810,1774488135,0,0,2026-03-26T05:28:03.410091+00:00,anilist
183741,60470.0,Nikuen,,肉園,Nikuen,OVA,,20.0,RELEASING,MANGA,WINTER 2025,2025,Queen Bee;Mediabank,,Hentai,Netorare;Anthology;Rape;Large Breasts;Nudity;Oyakodon;Nakadashi;Gyaru;Fellatio;Group Sex,,61.0,65.0,0,0,1174,0,1174,74,304,205,113,61,491,2025-02-21,,,,"<b>Episode 1</b> - <i>Saimin Musume to Tennen Mama</i><br> A friend told Aoi that if she used a hypnosis app, she could make the person she liked fall in love with her again. However, even without relying on the app, she had found a boyfriend about a month ago and they had started dating. Today, Aoi and her boyfriend were heading to her house for a study session. When she opened the front door, her beautiful and elegant mother, Yuko, appeared from the bathroom and greeted her with a smile. However, her lower body was immersed in sexual acts with a stranger. The next day, when Aoi returned home and tried to open the door to her house, a stranger called out to her and showed her his smartphone, pretending to know her mother. The moment she saw the screen, she was hypnotized... The man took her to a room and devoured her defenseless body. After trying it out, Aoi woke up. A strange feeling... Aoi's brain's common sense was altered and she was devoted to being a masturbator. While tremblin",JP,True,,https://s4.anilist.co/file/anilistcdn/media/anime/cover/medium/bx183741-eW11ec61Vg0T.png,#f1bba1,https://s4.anilist.co/file/anilistcdn/media/anime/banner/183741-W2f9epI0gko8.jpg,,,Aoi Mibu;Yuko Mibu;Oji-san 1;Oji-san 2;Kojima,EDA (Original Creator),,True,,https://anilist.co/anime/183741,1774480842,0,0,2026-03-26T05:28:03.410114+00:00,anilist
185001,60390.0,Shiranai Koto Shiritai no? The Animation,,知らないこと知りたいの？ The Animation,Shiranai Koto Shiritai no? The Animation,OVA,,20.0,RELEASING,MANGA,WINTER 2025,2025,Pink Pineapple;Seven,Seven,Hentai,Large Breasts;Nakadashi;Fellatio,,64.0,69.0,0,0,1077,0,1077,55,230,268,79,29,471,2025-02-28,,,,"<i>Pla-Pura</i><br> When the protagonist's grandfather, who runs a plastic model shop, falls ill, he ends up taking over the business. A regular customer, busty plastic model otaku Risa, appears as a part-timer! Thanks to the strict but reliable Risa, the shop reopens safely, and one day the protagonist discovers a solvent his grandfather made himself. As the protagonist and Risa are chatting after work, he is surprised when Risa starts to get changed without any protection, and ends up spilling the solvent he has on her body! As the protagonist panics, Risa's mood changes and she becomes sexier! As her whole body throbs, the busty girl begs him, ""Please... calm me down?"" ♪<br> <br> (Source: Pinkpineapple, translated)",JP,True,,https://s4.anilist.co/file/anilistcdn/media/anime/cover/medium/bx185001-ueqGXlmN8iVe.png,#e45d6b,,,,,Midori Tokiwa (Original Creator),,True,Don't you wanna learn something new? The Animation,https://anilist.co/anime/185001,1774488135,0,0,2026-03-26T05:28:03.410154+00:00,anilist
183742,60720.0,Ajin ga Osuki nan desu ne♡,,亜人がお好きなんですね♡,Ajin ga Osuki nan desu ne♡,OVA,,20.0,RELEASING,MANGA,WINTER 2025,2025,Queen Bee;Mediabank,,Hentai,Heterosexual;Episodic;Ahegao;Anthology;Fellatio;Female Protagonist;Large Breasts;Nakadashi;Nudity;Primarily Adult Cast,,59.0,64.0,0,0,937,0,937,51,231,167,110,43,386,2025-03-28,,,,"<b>Episode 1</b><br> <br> <i>Koisuru Kuroyagi</i><br> The owner of the mansion was a strict man and always gave a cold response. One night, Maya is seen by him shaving her hair. The owner had a peculiar sexual fetish and was sexually aroused by shaving women's pubic hair. Maya had been in love with him since she came to the mansion, so she pulled up the hem of her skirt to show her pubic hair and asked the owner, who couldn't hide his excitement, to shave her, and he readily agreed. She lathered up shaving soap and worked her way from her waist to her thighs, around her mucous membrane and down to her pubic hair. Maya was so moved by the sight of herself that she wanted to continue.<br> <br> <i>Futarikiri no Orca Show: Kono Koi ni Oborete</i><br> Lucca is performing in a spectacular aqua show. Recently, she has been losing focus and making mistakes. The reason is clear - she is in love with Masaki, who supports her. In order to reciprocate her feelings, the other members lie to the two",JP,True,,https://s4.anilist.co/file/anilistcdn/media/anime/cover/medium/bx183742-WOUbrnj69mhF.png,#f1c9bb,,,,,Jun (Original Creator),Official Site,True,,https://anilist.co/anime/183742,1774459341,0,0,2026-03-26T05:28:03.410278+00:00,anilist
185779,61353.0,Hametsu no Yuuwaku,,ハメツの誘惑,Hametsu no Yuuwaku,OVA,,20.0,RELEASING,ORIGINAL,WINTER 2025,2025,Nur,Nur,Hentai,Inseki;Teacher;Public Sex;School;Cunnilingus;Masturbation;Squirting;Nudity;Trains,,56.0,63.0,0,0,684,0,684,26,162,84,79,27,332,2025-03-28,,,,,JP,True,,https://s4.anilist.co/file/anilistcdn/media/anime/cover/medium/bx185779-uzQoDrD3Sy6r.png,#0d6bbb,,,,,Hikaru Kinohara (Character Design);Noji (Director);Ten Tenteke (Producer);PON (Script),,True,,https://anilist.co/anime/185779,1774260049,0,0,2026-03-26T05:28:03.410476+00:00,anilist
184824,60642.0,Yuusha-chan no Bouken wa Owatte Shimatta!,,勇者ちゃんの冒険は終わってしまった！,Yuusha-chan no Bouken wa Owatte Shimatta!,OVA,,15.0,RELEASING,OTHER,WINTER 2025,2025,Mousou Senka,Mousou Senka,Hentai,Rape;Nudity,,52.0,58.0,0,0,504,0,504,22,131,59,57,28,229,2025-02-28,,,,,JP,True,,https://s4.anilist.co/file/anilistcdn/media/anime/cover/medium/bx184824-UcbgUai3o3xd.png,#ae5de4,,,,Yuusha-chan,Meito Hoshina (Original Creator),,True,This Hero Girl's Adventure is OVER!,https://anilist.co/anime/184824,1774260448,0,0,2026-03-26T05:28:03.410625+00:00,anilist
178052,59078.0,Princess-Session Orchestra,,プリンセッション・オーケストラ,Princess-Session Orchestra,TV,48.0,24.0,RELEASING,ORIGINAL,SPRING 2025,2025,King Records;SILVER LINK.,SILVER LINK.,Action;Mahou Shoujo;Music,Henshin;Idol;Kids;Super Power;Female Protagonist;Dancing;Primarily Female Cast;Magic;Superhero;Fairy,,64.0,67.0,0,0,4730,0,4730,70,1655,36,275,449,2315,2025-04-06,2026-03-29,,,"The anime takes place in Alicepia, which is a mysterious country that has existed since ancient times. The inhabitants of Alicepia, the Alicepians, are a fun-loving people, but one day mysterious monsters called Jamaock appeared to threaten the peace of Alicepia. The story follows a trio of ""princesses"" who never forget the song in their hearts, even when facing such danger and step up to save the day with the power of music. <br><br>  (Source: Anime News Network, Crunchyroll News, edited)",JP,True,#プリオケ,https://s4.anilist.co/file/anilistcdn/media/anime/cover/medium/bx178052-igWygf0ZG1gl.jpg,#1aa1e4,,youtube,KE2gJE29ewQ,Minamo Sorano;Kagari Shirube;Nagase Ichijou;Natsu Hinomoto;Naviiyu,Akifumi Kaneko (Original Plan);Mari Shimazaki (Original Character Design);Shin Oonuma (Director );Yuusuke Sekine (Assistant Director);Manta Aisora (Series Composition),Twitter;Official Site;YouTube;Instagram;Netflix,False,Princession Orchestra;プリオケ;PriOrche,https://anilist.co/anime/178052,1774502218,1774742400,48,2026-03-26T05:28:03.412607+00:00,anilist
186151,60651.0,Yu-Gi-Oh! CARD GAME: THE CHRONICLES (2025),Yu-Gi-Oh! CARD GAME: THE CHRONICLES (2025),Yu-Gi-Oh! CARD GAME: THE CHRONICLES (2025),Yu-Gi-Oh! CARD GAME: THE CHRONICLES (2025),ONA,,4.0,RELEASING,OTHER,SPRING 2025,2025,KONAMI animation,KONAMI animation,Action;Fantasy,Episodic;Card Battle;Advertisement;Female Protagonist;Super Robot;Real Robot;Shapeshifting;Anthropomorphism;Travel;Nekomimi,,58.0,62.0,0,0,2739,0,2739,30,847,132,110,104,1546,2025-04-21,,,,Yu-Gi-Oh! CARD GAME THE CHRONICLES is a monthly short-anime series showcasing Official Card Game-original card themes. It is an expansion of the demo reel of the same name released the previous year.,JP,True,#遊戯王 #yugioh,https://s4.anilist.co/file/anilistcdn/media/anime/cover/medium/bx186151-oUFvXQXVBMMP.png,#1a78d6,,youtube,lMZsDhwGi7o,Raye;Roze;Ecclesia;Fleurdelis;Albaz,"Kazuki Takahashi (Original Creator);Shin Yoshida (Original Story);Seiya Miyajima (Director (eps 1, 2));Yuuki Ogawa (Director (eps 3-8));Mitsutaka Echigo (Series Composition (eps 1-10))",Official Site;Official Site;YouTube,False,,https://anilist.co/anime/186151,1774498818,0,0,2026-03-26T05:28:03.412853+00:00,anilist
185646,60534.0,Koupen-chan,,コウペンちゃん,Koupen-chan,TV_SHORT,,1.0,RELEASING,ORIGINAL,SPRING 2025,2025,Lesprit;Stay Luck,Lesprit,Slice of Life,Iyashikei;Animals;Primarily Animal Cast;Episodic;Chibi;Agender;Educational;Body Horror,,68.0,73.0,0,0,2540,0,2540,58,922,58,119,140,1301,2025-04-06,,,,"The story of the series follows the everyday adventures of Koupen-chan and his friends as they enjoy the little things in life.<br><br> (Source: Crunchyroll News, edited) ",JP,True,#コウペンちゃんアニメ,https://s4.anilist.co/file/anilistcdn/media/anime/cover/medium/bx185646-2eGmsnaSHiLC.jpg,#aed643,https://s4.anilist.co/file/anilistcdn/media/anime/banner/185646-69FyAu3rfhEC.jpg,youtube,L4wurjkd0JM,Koupen-chan;Yokoshima Enaga-san;Otona no Penguin;Adelie-san;Oshite Kureru Type no Shirokuma-san,Rurutea (Original Creator);Kyou Yatate (Director);Youichi Katou (Series Composition);Hiroyuki Nemoto (Art Director);Yoshihito Harisaki (Assistant Art Director),Twitter;Official Site;YouTube,False,,https://anilist.co/anime/185646,1774502241,1774740480,52,2026-03-26T05:28:03.412994+00:00,anilist
186827,61232.0,Fuuki Iin to Fuuzoku Katsudou,,風紀委員とフーゾク活動,Fuuki Iin to Fuuzoku Katsudou,OVA,,16.0,RELEASING,OTHER,SPRING 2025,2025,Bunny Walker;T-REX,T-REX,Hentai,School;Large Breasts;Tanned Skin;Female Protagonist;Male Protagonist;Boobjob;Fellatio;Nakadashi,,70.0,75.0,0,0,1479,0,1479,88,367,285,141,48,638,2025-04-25,,,,"<i>When I transferred to a certain school... I find out I'm the only guy there!</i> Shinji is alone at the school and can't make any friends, but then his classmate Hana talks to him. Shinji is excited to have made his first new friend, but she confesses to him that she is involved in adult entertainment activities to uphold public morals... For the sake of her activities, Hana decides to engage in naughty activities with Shinji!?<br> <br> (Source: Lune-soft, translated)",JP,True,,https://s4.anilist.co/file/anilistcdn/media/anime/cover/medium/bx186827-B9FgO0n9G0IC.png,#e4aea1,https://s4.anilist.co/file/anilistcdn/media/anime/banner/186827-W5UOiG4PgXrk.jpg,,,Shinji Izumi;Hana Sakurai;Chika Kitamura,Don Amano (Original Creator);Ken Raika (Director);Tokku03 (Script);Don Amano (Character Design);Megane Sagari (Storyboard),,True,,https://anilist.co/anime/186827,1774488135,0,0,2026-03-26T05:28:03.413113+00:00,anilist
178445,61599.0,Boku no Risou no Isekai Seikatsu,,ボクの理想の異世界生活,Boku no Risou no Isekai Seikatsu,OVA,,16.0,RELEASING,OTHER,SPRING 2025,2025,Mary Jane,,Hentai,Kemonomimi;Isekai;Female Harem;Slavery;Nekomimi;Flat Chest;Bisexual;LGBTQ+ Themes,,65.0,70.0,0,0,1196,0,1196,46,370,118,124,46,538,2025-05-02,,,,"He becomes a kemonomimi boy in the new world after orgasming<br> <br> A nameless 40-year-old single man loses consciousness from masturbating too much and thinks he has lived his life to the fullest, but when he regains consciousness he sees a cute girl with a worried look on her face in front of him. Her name is Misha, and she calls the man Norun. According to Misha, he had nearly drowned in the river. The man does not understand what is happening, but what he sees reflected in the water is the image of a cute boy with animal ears. The man is reincarnated into another world and becomes a person called Norun. The inhabitants of this world have animal ears and tails, there are more females than males, and it is a polygamous society. And Misha is the girl who will become Norun's first wife. Although they are not yet married, Misha lives with Norun, and does not hesitate to take off her clothes and take a bath with Norun. As Misha washes Norun's body, his crotch begins to swell more and m",JP,True,,https://s4.anilist.co/file/anilistcdn/media/anime/cover/medium/bx178445-Vx7wQLiwH664.png,#86bbe4,,,,Norun;Misha;Chise;Lovemea;40-sai otoko,Ichiri (Original Creator),,True,,https://anilist.co/anime/178445,1774488135,1776351600,4,2026-03-26T05:28:03.413154+00:00,anilist
186058,60980.0,Kuro Gal A La Carte,,黒ギャルアラカルト,Kuro Gal A La Carte,OVA,,20.0,RELEASING,MANGA,SPRING 2025,2025,Queen Bee;Mediabank,,Hentai;Romance,Tanned Skin;Gyaru;Fellatio;Virginity;Teens' Love;Mating Press;Nakadashi,,60.0,66.0,0,0,1004,0,1004,35,238,143,101,28,494,2025-06-06,,,,"<b>Episode 1</b><br> <br> <i>Teddy Steady & Teddy Steady: One More!!</i><br> Rina Sanjou, a tanned gal, secretly has feelings for Zen Narazaki, her younger childhood friend who is uncool and boring. Zen is made to cosplay as a bear, and Rina is warmed by the sight of him in it. They've been playing dress up since they were little, and as an extension of that, she's been sucking Zen's dick. They've been doing that for a long time. But Zen says he wants to end their relationship. With a sense of despair, Rina tells him her true feelings. <i>""Because it's with you... I want to play dress up. Because it's with you... I want to have sex.""</i> And so, the two finally understand each other's feelings, and become immersed in a world of love and romance.<br> <br> <b>Episode 2</b><br> <br> <i>Oohata-san wa Risou no Gal</i><br> On his first day at his new school, Shigeharu Miyata finds his ideal gal, Juria Oohata. Everything about Juria is ideal from head to toe, and he's happy just to be allowed",JP,True,,https://s4.anilist.co/file/anilistcdn/media/anime/cover/medium/bx186058-knK1uJxYFkVy.png,#f1ae5d,,,,,BUTA (Original Creator),,True,,https://anilist.co/anime/186058,1774346101,0,0,2026-03-26T05:28:03.413252+00:00,anilist
184470,61092.0,Himitsu no AiPri: Ring-hen,,ひみつのアイプリ リング編,Himitsu no AiPri: Ring-hen,TV,51.0,24.0,RELEASING,OTHER,SPRING 2025,2025,OLM;Dongwoo Animation;TV Tokyo;Nihon Ad Systems;Dongwoo Animation;Shogakukan;OLM;KYORAKU;Avex Pictures;Takara Tomy,OLM;Dongwoo Animation,Music;Slice of Life,Idol;Yuri;Virtual World;School;Kids;Female Protagonist;Primarily Female Cast;Ensemble Cast;Boarding School;Henshin,,58.0,69.0,0,0,903,0,903,19,340,14,29,61,459,2025-04-06,2026-03-29,,,"It's a new semester! Himari and Mitsuki have become second-year students of Paradise Private Academy! Their school lives become more and more lively with the introduction of new underclassmen full of individuality and personality. <br><br> In the AiPri-Verse, new AiPri are appearing one after another! Everyone tries their hand at a brand new, never-before-seen Buzzrium Change! In the midst of all this, the mysterious Princess Ring Clover and her butler, Shimitsuu, are holding an Aipri contest. They say the winner will become an admired ""Eternal Aipri."" Himari and Mitsuki are all ready and full of fighting spirit! But it appears Princess Ring holds a very large secret... <br><br> As their friends increase, so does the mysteries of the ring. The Ring arc finally begins! <br><br> (Source: Offiical Website, translated)",JP,True,,https://s4.anilist.co/file/anilistcdn/media/anime/cover/medium/bx184470-m2izEvBeO49C.jpg,#f15df1,,youtube,aM7Q-sCzy8A,Himari Aozora;Mitsuki Hoshikawa;Tsumugi Suzukaze;Chii Mamiya;Ring Clover,"syn Sophia, Inc. (Original Creator);Takara Tomy (Original Creator);Hiromi Nashimoto (Original Character Design);Junichi Fujisaku (Director);Kentarou Yamaguchi (Director)",Official Site;Twitter;YouTube;Instagram;TikTok,False,ひみつのアイプリ 2期;Himitsu no AiPri 2nd Season,https://anilist.co/anime/184470,1774480842,1774744200,51,2026-03-26T05:28:03.413359+00:00,anilist
185166,61166.0,"Akogare no Onna Joushi ga, Aibeya Shucchou no Tonari no Bed de Zetsurin Otoko ni Netorarete Iru",,憧れの女上司が、相部屋出張の隣のベッドで絶倫男に寝取られている,"Akogare no Onna Joushi ga, Aibeya Shucchou no Tonari no Bed de Zetsurin Otoko ni Netorarete Iru",OVA,,22.0,RELEASING,LIGHT_NOVEL,SPRING 2025,2025,Mary Jane,,Hentai,Netorare,,54.0,59.0,0,0,764,0,764,36,200,128,85,40,311,2025-04-04,,,,,JP,True,,https://s4.anilist.co/file/anilistcdn/media/anime/cover/medium/bx185166-nRoGrSNTd13z.png,#e4bb43,,,,Yui,Kaede Aikawa (Original Story),,True,,https://anilist.co/anime/185166,1774488135,0,0,2026-03-26T05:28:03.413451+00:00,anilist
186308,61165.0,Amai Ijiwaru,,甘いイジワル,Amai Ijiwaru,OVA,,24.0,RELEASING,ORIGINAL,SPRING 2025,2025,Nur,Nur,Hentai,,,56.0,66.0,0,0,554,0,554,19,143,61,56,23,271,2025-04-25,,,,,JP,True,,https://s4.anilist.co/file/anilistcdn/media/anime/cover/medium/bx186308-REUfR4DxBB18.png,#f1e4c9,,,,,,,True,,https://anilist.co/anime/186308,1774173301,0,0,2026-03-26T05:28:03.413580+00:00,anilist
188933,61539.0,Princess Burst!: Kiken-bi no Tanetsuke Haramase Shuuchi Battle!,,プリンセスバースト！～危険日の種付け孕ませ羞恥バトル！～,Princess Burst!: Kiken-bi no Tanetsuke Haramase Shuuchi Battle!,OVA,,,RELEASING,VIDEO_GAME,SPRING 2025,2025,Majin petit,,Hentai,Nudity;Rape;Wrestling,,51.0,57.0,0,0,512,0,512,19,150,63,57,27,215,2025-06-27,,,,"Based on the erotic doujin game by Dekisui-sen Lilyon (溺水船リリオン).<br> <br> Yuki Sakurano is on a winning streak as an illegal fighter in underground arenas. One day, the legendary fighter named King comes into her life to scout her as a fighter. Little did Yuki know that this event would drastically change her life in very different ways than she was expecting.<br> <br> (Source: Steam)",JP,True,,https://s4.anilist.co/file/anilistcdn/media/anime/cover/medium/bx188933-akAyf4m11e0y.png,#e4785d,,,,Yuki Sakurano;King,Shiroyabu (Original Character Design),,True,,https://anilist.co/anime/188933,1774437999,0,0,2026-03-26T05:28:03.413625+00:00,anilist
186307,60857.0,Notto Sexaroid Eurie!,,のっと・せくさろいど・エウリィ！,Notto Sexaroid Eurie!,OVA,,15.0,RELEASING,VIDEO_GAME,SPRING 2025,2025,Majin petit,Majin petit,Hentai,Artificial Intelligence;Rape;Female Protagonist;Anal Sex;Double Penetration,,52.0,59.0,0,0,461,0,461,13,128,53,57,22,201,2025-04-25,,,,Based on the erotic doujin game by Moguhachi (もぐハチ).,JP,True,,https://s4.anilist.co/file/anilistcdn/media/anime/cover/medium/bx186307-gFvI6OyQpql0.png,#d6781a,,,,Eurie,Tokku03 (Script);HB (Animation Director);Qeggy (Character Design),,True,,https://anilist.co/anime/186307,1774488135,0,0,2026-03-26T05:28:03.413668+00:00,anilist
187304,61164.0,Inshoku-Ou Demar,,淫触王デマール,Inshoku-Ou Demar,OVA,,30.0,RELEASING,ORIGINAL,SPRING 2025,2025,Pink Pineapple;Seven,Seven,Hentai,Tentacles;Rape;Monster Boy;Double Penetration;Fellatio,,53.0,63.0,0,0,353,0,353,14,107,36,41,18,151,2025-05-30,,,,"Rosalia is a beautiful adventurer who once hunted demons alongside heroes. After retiring from the front lines, she ran an orphanage in a remote area, living a quiet life while taking in orphaned children. But one day, she found an insect in the orphanage... It was a split body of Demar, the King of Lust, a powerful enemy she had defeated during her time as an adventurer. <i>""You can't be... you're still looking for me...""</i> Rosalia stood alone, trying to ward off the demonic clutches of revenge, but countless tentacles attacked her ripe body――!?<br> <br> (Source: PinkPineapple, translated)",JP,True,,https://s4.anilist.co/file/anilistcdn/media/anime/cover/medium/bx187304-CwTKRUiG6kRd.png,#fea128,,,,Rosalia;Demar,Ao Ishii (Director),,True,Roi des tentacules obscènes Demar,https://anilist.co/anime/187304,1774173048,0,0,2026-03-26T05:28:03.413805+00:00,anilist
185718,60596.0,Sai-Kyo-Oh! Zukan: The Ultimate Tournament,,最強王図鑑 ～The Ultimate Tournament～,Sai-Kyo-Oh! Zukan: The Ultimate Tournament,TV_SHORT,51.0,11.0,RELEASING,OTHER,SPRING 2025,2025,OLM,OLM,Action,Ensemble Cast;Animals;Dinosaurs;Dragons;Full CGI;Educational,,,60.0,0,0,186,0,186,4,68,5,10,35,68,2025-04-06,2026-03-29,,,Sequel to <i>Sai-Kyo-Oh! Zukan: The Ultimate Battles.</i>,JP,True,#最強王,https://s4.anilist.co/file/anilistcdn/media/anime/cover/medium/bx185718-luZZKvM7pOZ2.png,#1aaed6,,youtube,lf2aU1au_Ho,Mr. Most,Kunihiko Yuyama (Chief Director);Makoto Satou (Director);Shinji Satou (Series Composition);Toonz Imai (Character Design);Kisuke Koizumi (Sound Director),Twitter;Official Site;YouTube,False,,https://anilist.co/anime/185718,1774491626,1774736160,51,2026-03-26T05:28:03.414033+00:00,anilist
191452,61583.0,Immoral Game Master THE ANIMATION,,淫モラル・ゲームマスター THE ANIMATION,Immoral Game Master THE ANIMATION,OVA,,20.0,RELEASING,MANGA,SUMMER 2025,2025,Pink Pineapple;Seven,Seven,Adventure;Fantasy;Hentai,Virtual World;Anal Sex;Rape;Large Breasts;Prostitution;Tentacles;School;Cervix Penetration,,60.0,65.0,0,0,976,0,976,44,281,145,94,34,422,2025-07-25,,,,"A young boy, Mario, is asked by his father, who works for a video game company, to become the GM. Although he is not keen, as a result of his analysis, he realizes that he can experience the same stimulation he received in the game in real life, and as an experiment, he sets his sights on a quiet girl named Koharu Takashina. Koharu wishes to become “a useful and gorgeous character,” which is the opposite of reality. However, the class she is given is that of a prostitute! After being raped by a rough man, her womb starts tingling, even though she is still a virgin in real life...<br> <br> (Source: PinkPineapple, translated)",JP,True,,https://s4.anilist.co/file/anilistcdn/media/anime/cover/medium/bx191452-5303uC2Sntze.png,#e4a150,,,,Mario Kuga;Koharu Takashina;Saya Natsume,Yuu Ichinomiya (Original Creator);Saishin Saide (Director),,True,,https://anilist.co/anime/191452,1774430159,0,0,2026-03-26T05:28:03.416919+00:00,anilist
