anime_id,mal_id,title,english_title,japanese_title,user_preferred_title,type,episodes,duration,status,source,season,season_year,studios,main_studios,genres,tags,rating,score,mean_score,scored_by,rank,popularity,popularity_rank,members,favorites,watching,completed,on_hold,dropped,plan_to_watch,start_date,end_date,broadcast_day,broadcast_time,synopsis,country_of_origin,is_licensed,hashtag,cover_image_large,cover_image_color,banner_image,trailer_site,trailer_id,main_characters,main_staff,streaming_sites,is_adult,synonyms,site_url,updated_at,next_airing_episode_at,next_episode_number,collected_at,data_source
170110,56906.0,"Isekai de Cheat Skill wo Te ni Shita Ore wa, Genjitsu Sekai wo mo Musou Suru: Level Up wa Jinsei wo Kaeta",,異世界でチート能力を手にした俺は、現実世界をも無双する ～レベルアップは人生を変えた～,"Isekai de Cheat Skill wo Te ni Shita Ore wa, Genjitsu Sekai wo mo Musou Suru: Level Up wa Jinsei wo Kaeta",SPECIAL,1.0,,NOT_YET_RELEASED,LIGHT_NOVEL,WINTER 2026,2026,Millepensee;TMS Entertainment;UNLIMITED PRODUCE by TMS;KADOKAWA,Millepensee,Action;Adventure;Fantasy;Romance,Isekai;Female Harem;Male Protagonist;Heterosexual,,,,0,0,16252,0,16252,300,1381,338,175,91,14267,2026-03-30,2026-03-30,,,"New anime project for <i>Isekai de Cheat Skill wo Te ni Shita Ore wa, Genjitsu Sekai wo mo Musou Suru: Level Up wa Jinsei wo Kaeta</i>.<br><br>  <i>Note: Title and relation are subject to change.</i>",JP,True,#いせれべ,https://s4.anilist.co/file/anilistcdn/media/anime/cover/medium/bx170110-MzWm7RaFxAnu.png,#bb43e4,,youtube,SRYZgp2VliQ,Yuuya Tenjou;Kaori Houjou;Lexia Von Alceria,Shin Itagaki (Director);Miku (Original Story);Rein Kuwashima (Original Character Design);Hiromi Kimura (Character Design),Twitter;Official Site,False,"I Got a Cheat Skill in Another World and Became Unrivaled in The Real World, Too (New Anime)",https://anilist.co/anime/170110,1774502262,1774796400,1,2026-03-26T05:28:03.422321+00:00,anilist
195518,62000.0,Akuyaku Reijou wa Ringoku no Outaishi ni Dekiai Sareru,The Villainess Is Adored by the Prince of the Neighbor Kingdom,悪役令嬢は隣国の王太子に溺愛される,Akuyaku Reijou wa Ringoku no Outaishi ni Dekiai Sareru,TV,12.0,24.0,RELEASING,LIGHT_NOVEL,WINTER 2026,2026,Studio DEEN;Sotsu;KADOKAWA,Studio DEEN,Fantasy;Romance,Shoujo;Villainess;Isekai;Heterosexual;Female Protagonist;Magic,,57.0,58.0,0,0,15707,0,15707,220,7953,124,240,1337,6053,2026-01-11,2026-03-29,,,"Tiararose Lapis Clamentile is set to marry Hartknights, crown prince of Lapis Lazuli—until she suddenly remembers her past life and realizes she’s been reincarnated into her favorite game, The Ring of Lapis Lazuli, as the doomed villainess! But just as she’s about to lose hope, the crown prince of Aquasteed proposes instead. Could this unexpected turn finally lead to a happy ending of her own?<br> <br> (Source: Crunchyroll)",JP,True,#あくできアニメ,https://s4.anilist.co/file/anilistcdn/media/anime/cover/medium/bx195518-XXcYHi6tXM6v.jpg,#5d86e4,https://s4.anilist.co/file/anilistcdn/media/anime/banner/195518-IpfwJgnWa6nD.jpg,youtube,3wNyyhzLqA0,Tiararose Lapis Clementille;Aquasteed Marineforest;Hartknights Lapis-Lazuli Lacmouth;Akari;Pearl,Puni-chan (Original Story);Naruse Akeno (Original Character Design);Takayuki Hamana (Director);Yoshimi Narita (Series Composition);Majiro (Character Design),Official Site;Crunchyroll;Twitter,False,The Villainess Is Being Doted on by the Crown Prince of the Neighboring Country;ท่านหญิงนางร้ายถูกเจ้าชายรัชทายาท ของอาณาจักรข้างเคียงหลงรัก,https://anilist.co/anime/195518,1774502224,1774792800,12,2026-03-26T05:28:03.422380+00:00,anilist
187941,61207.0,Tensei Shitara Dragon no Tamago Datta,Reincarnated as a Dragon Hatchling,転生したらドラゴンの卵だった,Tensei Shitara Dragon no Tamago Datta,TV,12.0,24.0,RELEASING,LIGHT_NOVEL,WINTER 2026,2026,GA-CREW;Felix Film;Hakuhodo DY Music & Pictures;NBCUniversal Entertainment Japan;Pony Canyon;BS11;AT-X;Bushiroad Move;INSPION EDGE;MAGNET,GA-CREW;Felix Film,Action;Adventure;Fantasy,Dragons;Male Protagonist;Creature Taming;Isekai;Animals;Female Protagonist;Rural;Amnesia;Magic;Medieval,,61.0,62.0,0,0,15496,0,15496,308,10067,115,177,535,4602,2026-01-10,2026-03-28,,,"Our hero needs to come out of his shell... literally! Reborn in another world inside a dragon egg, he doesn’t have the amazing magic or mighty physical strength of your typical isekai’d adventurer just yet. He’ll need to break free and grow from a weak hatchling and into a fearsome beast if he wants to escape the deep, dark forest unscathed. What battles and adventures await him in this unique take on the isekai phenomenon? <br><br> (Source: HIDIVE)",JP,True,#ドラたま,https://s4.anilist.co/file/anilistcdn/media/anime/cover/medium/bx187941-ykmc8WRedPpw.jpg,#f1930d,https://s4.anilist.co/file/anilistcdn/media/anime/banner/187941-wdkhGnf4LUH0.jpg,youtube,VPLmZd3ByAM,Myria Milleania;Irushia;Marielle;Kuro Tokage;Kami no Koe,Nekoko (Original Story);Naji Yanagita (Original Character Design);Yuuta Takamura (Director );Nobuyoshi Arai (Assistant Director);Tatsuhiko Urahata (Series Composition),Official Site;Twitter;HIDIVE,False,DoraTama,https://anilist.co/anime/187941,1774502217,1774701000,12,2026-03-26T05:28:03.422409+00:00,anilist
183660,60223.0,Kaya-chan wa Kowakunai,Kaya-chan Isn't Scary,カヤちゃんはコワくない,Kaya-chan wa Kowakunai,TV,12.0,24.0,RELEASING,MANGA,WINTER 2026,2026,KADOKAWA;East Fish Studio;TV Tokyo;Docomo Anime Store;Pony Canyon;DAXEL;AT-X;WOWOW,East Fish Studio,Comedy;Horror;Slice of Life,Seinen;Female Protagonist;Primarily Child Cast;School;Ghost;Super Power;Episodic;Exorcism;Pregnancy;Urban Fantasy,,69.0,70.0,0,0,15128,0,15128,199,7798,93,225,685,6327,2026-01-11,2026-03-29,,,"Kaya-chan attends Hanamugi Kindergarten, and she has an incredibly strong sixth sense. She secretly beats up the ghosts that stalk her friends and family, but in turn, she’s treated like a troublemaker since nobody understands her strange behavior. Everything changes when her teacher, Chie, discovers her secret. Kaya-chan's fists will go flying at any sinister spirits that show up!<br> <br> (Source: Crunchyroll)",JP,True,#カヤコワ #カヤちゃんはコワくない,https://s4.anilist.co/file/anilistcdn/media/anime/cover/medium/bx183660-B6o9cMfSfScX.jpg,#f15d35,https://s4.anilist.co/file/anilistcdn/media/anime/banner/183660-RmcBY27wn8A4.jpg,youtube,un9g38-wbHw,Kaya Satou;Chie Hasumi;Namu Ebisumori;Osamu Mobu;Akira-sensei,Tarou Yuri (Original Creator);Hiroshi Ikehata (Director );Shigeru Murakoshi (Series Composition);Hiroyuki Moriguchi (Character Design);Ayumi Satou (Art Director),Twitter;Official Site;Crunchyroll;Bilibili TV;YouTube,False,カヤコワ;KayaKowa;คายะจังไม่กลัวหรอกนะ,https://anilist.co/anime/183660,1774502222,1774773000,12,2026-03-26T05:28:03.422440+00:00,anilist
181443,59853.0,DARK MOON: Kuro no Tsuki - Tsuki no Saidan,DARK MOON: THE BLOOD ALTAR,DARK MOON　-黒の月: 月の祭壇-,DARK MOON: Kuro no Tsuki - Tsuki no Saidan,TV,12.0,24.0,RELEASING,OTHER,WINTER 2026,2026,Aniplex;TROYCA;HYBE JAPAN;Crunchyroll;LINE Digital Frontier,TROYCA,Supernatural,Vampire;Female Protagonist;Male Harem;Super Power;School;Werewolf;Ensemble Cast;Primarily Male Cast;Idol;Gore,,62.0,63.0,0,0,11922,0,11922,234,5584,107,217,829,5185,2026-01-10,2026-03-28,,,"In the seaside city of Riverfield stands Decelis Academy, home to seven mysterious boys sharing the same secret: They’re vampires, hiding their murky pasts. When Sooha, a female student who hates vampires, transfers to the academy, the boys find themselves irresistibly drawn to her. As strange events shake the city, old sins and buried secrets resurface, and their world begins to fracture.<br> <br> (Source: Crunchyroll)",JP,True,#DARKMOON #黒の月 #DARKMOON_TBA,https://s4.anilist.co/file/anilistcdn/media/anime/cover/medium/bx181443-Df41Nlf7xjgI.jpg,#d6281a,https://s4.anilist.co/file/anilistcdn/media/anime/banner/181443-Euz60QKDzsLs.jpg,youtube,uPlPWMb-GO0,Su-Ha;Jino;Heli;Shion;Jaan,HYBE (Original Plan);Shouko Shiga (Director );Touko Machida (Series Composition);Masami Inomata (Character Design);Takatoshi Hamano (Sound Director),Twitter;Official Site;Crunchyroll;Bilibili TV,False,DARK MOON: 달의 제단;DARK MOON: Darui Jedan;DARK MOON: THE BLOOD ALTAR with ENHYPEN;DARK MOON: แท่นบูชาพระจันทร์,https://anilist.co/anime/181443,1774502228,1774623600,12,2026-03-26T05:28:03.422654+00:00,anilist
187989,61217.0,Yuusha no Kuzu,Scum of the Brave,勇者のクズ,Yuusha no Kuzu,TV,24.0,23.0,RELEASING,OTHER,WINTER 2026,2026,OLM;Yostar;Nippon Television Network;KADOKAWA;OLM,OLM,Action;Comedy;Drama;Fantasy;Sci-Fi,Urban Fantasy;Male Protagonist;Drugs;Mafia;Gore;CGI;Chibi;Crime;Anti-Hero;Super Power,,61.0,63.0,0,0,11387,0,11387,115,5621,39,200,952,4575,2026-01-11,,,,"In the mid-21st century, Tokyo's mafia can turn into ether-enhanced Demon Lords, and Braves hunt them down. Yashiro, the Grim Reaper, reluctantly takes a new apprentice named Aki Jogamine, a high school girl training to become a Brave. He soon finds himself dragged into one troublesome case after another. The supernatural story of a scumbag master and his self-proclaimed apprentice begins!<br><br>(Source: Crunchyroll)",JP,True,#勇者のクズ,https://s4.anilist.co/file/anilistcdn/media/anime/cover/medium/bx187989-IjVYJxi0bEcr.jpg,#d6a178,https://s4.anilist.co/file/anilistcdn/media/anime/banner/187989-ELfQpRahhT3L.jpg,youtube,Lh-0y-O7GIg,Yashiro;Aki Jougamine;Yukine Indou;Sara Pendragon;Joe,Rocket  Shoukai (Original Creator);Nakashima723 (Original Illustration);Shinji Ushiro (Director );Youichi Katou (Series Composition);Rika Murakami (Character Design),Official Site;Twitter;YouTube;TikTok;Crunchyroll;YouTube;YouTube,False,ผู้กล้าสวะ;Pahlawan Sampah,https://anilist.co/anime/187989,1774502290,1774713360,12,2026-03-26T05:28:03.422717+00:00,anilist
176370,58524.0,"Hime-sama, ""Goumon"" no Jikan desu 2nd Season","'Tis Time for ""Torture,"" Princess Season 2",姫様“拷問”の時間です 第2期,"Hime-sama, ""Goumon"" no Jikan desu 2nd Season",TV,12.0,24.0,RELEASING,MANGA,WINTER 2026,2026,Shogakukan-Shueisha Productions;PINE JAM,PINE JAM,Comedy;Fantasy,Female Protagonist;Cute Girls Doing Cute Things;Food;Primarily Female Cast;Prison;Monster Girl;Demons;Iyashikei;Anachronism;Torture,,74.0,76.0,0,0,10499,0,10499,144,4837,65,130,150,5317,2026-01-12,2026-03-30,,,"As the war between the Imperial Army and Hellhorde rages on, the Princess, despite being armed with her mythical sword Excalibur, is captured and imprisoned. What kind of torture does she face at the hands of the chief demon interrogator? Fluffy fresh-baked toast! Hot, steaming ramen! Oh, the humanity! Can the Princess withstand these tormenting treats and keep her kingdom’s secrets safe? <br><br> (Source: Crunchyroll)",JP,True,#姫様拷問の時間です,https://s4.anilist.co/file/anilistcdn/media/anime/cover/medium/bx176370-hz2H4TUeyGgt.png,#e4ae50,https://s4.anilist.co/file/anilistcdn/media/anime/banner/176370-rTxiCqbzG0DQ.jpg,youtube,cC-6G5daQBo,Hime;Ex;Tortura Torture;Youki;Inki,Robinson Haruhara (Original Story);Hirakei (Original Character Design);Youko Kanamori (Director);Keiichirou Oochi (Series Composition);Toshiya Kouno (Character Design),Twitter;Official Site;Crunchyroll;iQ;YouTube,False,"ひめごう2;HimeGou 2;องค์หญิงได้เวลา ""ทรมาน"" แล้วค่ะ ซีซัน 2",https://anilist.co/anime/176370,1774502198,1774881000,12,2026-03-26T05:28:03.422777+00:00,anilist
198374,62432.0,Jingai Kyoushitsu no Ningengirai Kyoushi,A Misanthrope Teaches a Class for Demi-Humans,人外教室の人間嫌い教師,Jingai Kyoushitsu no Ningengirai Kyoushi,TV,13.0,24.0,RELEASING,LIGHT_NOVEL,WINTER 2026,2026,KADOKAWA;Asread;ABC Animation;Pony Canyon;AT-X;ANYCOLOR Inc.,Asread,Comedy;Drama;Fantasy;Romance;Slice of Life,Kemonomimi;Teacher;School;Cute Girls Doing Cute Things;Monster Girl;Tsundere;Female Harem;Dissociative Identities,,59.0,61.0,0,0,10441,0,10441,133,5425,52,193,854,3917,2026-01-11,2026-04-05,,,"After a traumatic incident ends his teaching career, Rei Hitoma is certain he hates humans. Yet when he sees a job for “a teacher who truly cares for their students,” he’s compelled to apply. Before he knows it, he’s hired—only to find out his students are demi-humans. What begins as a job becomes a journey for healing for both a teacher who’s lost faith in humanity and students who dream of it.<br> <br> (Source: Crunchyroll)",JP,True,#人外教室,https://s4.anilist.co/file/anilistcdn/media/anime/cover/medium/bx198374-ROZU3qJGX4uS.jpg,#4386ff,https://s4.anilist.co/file/anilistcdn/media/anime/banner/198374-cnzGgIW2KzHr.jpg,youtube,rb0okw_1ExM,Rei Hitoma;Sui Usami;Tobari Haneda;Kyouka Minazuki;Isaki Oogami,Natsume Kurusu (Original Story);Sai Izumi (Original Character Design);Akira Iwanaga (Director);Katsuhiko Takayama (Series Composition);Maiko Okada (Character Design),Official Site;Twitter;Crunchyroll,False,ห้องเรียนต่างสายพันธุ์ ของอาจารย์ผู้เกลียดมนุษย์,https://anilist.co/anime/198374,1774502227,1774710000,12,2026-03-26T05:28:03.422805+00:00,anilist
185753,60602.0,MF Ghost 3rd Season,MF GHOST Season 3,MFゴースト 3rd Season,MF Ghost 3rd Season,ONA,13.0,24.0,RELEASING,MANGA,WINTER 2026,2026,Felix Film;Avex Pictures;Kodansha;Animax Broadcast Japan;Crunchyroll;Sammy;JIN,Felix Film,Sports,Cars;Primarily Adult Cast;Primarily Male Cast;Male Protagonist;Heterosexual;CGI,,75.0,77.0,0,0,10151,0,10151,208,6302,114,83,112,3540,2026-01-01,2026-03-26,,,"The third season of <i>MF Ghost</i>. <br><br> <i>Note: Each episode streams 3 days early on Prime Video. The original TV broadcast started on January 4, 2026.</i>",JP,True,#MFゴースト ,https://s4.anilist.co/file/anilistcdn/media/anime/cover/medium/bx185753-fKim5yXjaE9I.png,#35aee4,,youtube,HJuYJpMJdGs,Kanata Rivington;Ren Saionji;Ogata;Michael Beckenbauer;Sena Moroboshi,Shuuichi Shigeno (Original Creator);Kazushi Suzuki (Original Work Assistance);Naoki Takuma (Original Work Assistance);Kouhei Ueda (Original Work Assistance);Toshihito Naka (Director),Official Site;Twitter;YouTube;TikTok;Crunchyroll;YouTube,False,,https://anilist.co/anime/185753,1774498751,1774535400,13,2026-03-26T05:28:03.422837+00:00,anilist
189137,61325.0,"Douse, Koishite Shimaunda. Season 2","Anyway, I'm Falling in Love with You. Season 2",どうせ、恋してしまうんだ。Season 2,"Douse, Koishite Shimaunda. Season 2",TV,12.0,24.0,RELEASING,MANGA,WINTER 2026,2026,TBS;TYPHOON GRAPHICS;Kodansha;Crunchyroll;Universal Music;BS11;arma bianca;TYPHOON GRAPHICS;Pia;Nikkatsu;Happinet Media Marketing,TYPHOON GRAPHICS,Drama;Romance,LGBTQ+ Themes;Shoujo;Female Protagonist;Heterosexual,,60.0,63.0,0,0,4827,0,4827,71,1941,49,71,166,2600,2026-01-09,2026-03-27,,,"The second season of <i>Douse, Koishite Shimaunda. </i>",JP,True,#どうせ恋してしまうんだ #恋しま,https://s4.anilist.co/file/anilistcdn/media/anime/cover/medium/bx189137-cCXaEiX0bJb4.jpg,#5daee4,,youtube,ZBBQeTbUs5I,Mizuho Nishino;Kizuki Hazawa;Shin Kashiwagi;Airu Izumi;Shuugo Hoshikawa,Haruka Mitsui (Original Creator);Junichi Yamamoto (Director);Yuu Murai (Series Composition);Rickey Watkins (ADR Mixer (English));Zachary Davis (ADR Engineer (English)),Twitter;Official Site;Crunchyroll;YouTube,False,恋しま 2;Koishima 2;ทำไงได้ ก็คนมันรักไปแล้ว ซีซัน 2,https://anilist.co/anime/189137,1774502280,1774542480,12,2026-03-26T05:28:03.423048+00:00,anilist
187062,61084.0,Hikuidori,Oedo Fire Slayer -The Legend of Phoenix-,火喰鳥,Hikuidori,TV,12.0,24.0,RELEASING,OTHER,WINTER 2026,2026,SynergySP;AMUSE CREATIVE STUDIO;CBC TV;Akita Shoten;SynergySP,SynergySP,Action;Drama,Firefighters;Full CGI;Historical,,42.0,42.0,0,0,3864,0,3864,40,1035,12,64,537,2216,2026-01-11,2026-04-05,,,"The fire extinguishing samurai who stopped the great fire was called ""The fire-eating bird"". Matsunaga Gengo, once known as the ""Fire-eating Bird"", was the best fire-fighting samurai in Edo. He had resigned from the fire brigade for a reason but suddenly received an invitation to serve in the Shinjo clan.<br><br>   The Shinjo clan's fire-fighting team had no money and no personnel and was looked down upon by those around them. With the encouragement of his wife, Miyuki, Gengo decides to rebuild the collapsed fire-fighting clan as its chairman. Gengo and his friends, all of whom have their own peculiarities, struggle to ""save any life"", despite being ridiculed as ""ragged steeplejacks""(= the 'Boro-Tobi-Gumi'.), In Edo, a mysterious series of suspicious fires called ""foxfires"" continue. <br><br> An entertaining action drama opens, with the firefighters scrambling to save lives in the face of the approaching disaster! <br><br> (Source: Amuse Creative Studio)",JP,True,,https://s4.anilist.co/file/anilistcdn/media/anime/cover/medium/bx187062-JuXPEjrLQSeO.png,#d65d1a,,youtube,bB6qXk2YOYE,Gengo Matsunaga;Seijurou Kaji;Shinnosuke Torigoe;Torajirou;Hikoya,You Oizumi (Theme Song Performance (ED));You Oizumi (Theme Song Lyrics (ED));Yasuharu Takanashi (Music);Hajime Kamegaki (Chief Director);Kouji Tamaki (Theme Song Composition (ED)),Official Site;Twitter;Crunchyroll;YouTube,False,วิหคกินเพลิง: หน่วยพิทักษ์เพลิงแห่งเอโดะ,https://anilist.co/anime/187062,1774488135,1774794600,11,2026-03-26T05:28:03.423108+00:00,anilist
202957,63042.0,Meitantei Precure!,Star Detective Precure!,名探偵プリキュア！,Meitantei Precure!,TV,51.0,24.0,RELEASING,ORIGINAL,WINTER 2026,2026,Toei Animation,Toei Animation,Mahou Shoujo;Mystery,Female Protagonist;Henshin;Detective;Kids;Primarily Female Cast;Primarily Child Cast;Urban Fantasy;Urban;Primarily Teen Cast;Fairy,,72.0,76.0,0,0,3485,0,3485,63,2471,18,40,74,882,2026-02-01,,,," The 23rd installment of the long-running <i>Precure</i> series.<br> <br> Anna Akechi is a second-year junior high student living in Makoto Mirai Town. On her 14th birthday, she has a chance encounter with a fairy named Pochitan, and a magical pendant caused her to travel back in time from 2027 to 1999! In the Makoto Mirai Town 28 years in the past, Anna meets Mikuru Kobayashi, a girl her age who wants to become a great detective.<br> <br> Meanwhile, people in town are in trouble as their prized possessions are being stolen from under their noses - the cause being a group of Phantom Thieves. To stop them, Anna and Mikuru turn into Precures! Maybe if they solve these mysteries, Anna can find her way back to her own time?<br> <br> (Source: Official Website, translated)",JP,True,#名探偵プリキュア #たんプリ,https://s4.anilist.co/file/anilistcdn/media/anime/cover/medium/bx202957-fxZGgJTvwXzP.jpg,#d6ae1a,https://s4.anilist.co/file/anilistcdn/media/anime/banner/202957-B9U0hNv2Dqap.jpg,youtube,qjozo1fh7OI,Anna Akechi;Mikuru Kobayashi;Cure Eclair;Luluka Moria;Jett,Izumi Toudou (Original Creator);Kouji Kawasaki (Director);Isao Murayama (Series Composition);Akane Yano (Character Design);Minori Imai (Art Design),Official Site;Crunchyroll;YouTube;Twitter,False,TanPre (たんプリ),https://anilist.co/anime/202957,1774502246,1774740600,9,2026-03-26T05:28:03.423163+00:00,anilist
189258,61333.0,Ao no Miburo: Serizawa Ansatsu-hen,Blue Miburo Season 2,青のミブロ 芹沢暗殺編,Ao no Miburo: Serizawa Ansatsu-hen,TV,14.0,24.0,RELEASING,MANGA,WINTER 2026,2026,Maho Film;YTV,Maho Film,Drama,Historical;Samurai;Primarily Male Cast;Male Protagonist;Swordplay;Shounen,,60.0,65.0,0,0,2850,0,2850,37,1238,36,52,80,1444,2025-12-20,2026-03-28,,,The second season of <i>Ao no Miburo</i>.,JP,True,#青のミブロ,https://s4.anilist.co/file/anilistcdn/media/anime/cover/medium/bx189258-qhtrra5ebBm6.jpg,#50bbe4,,youtube,7hWWDxF0hyo,Nio Chirinu;Hajime Saitou;Tarou Tanaka;Toshizo Hijikata;Souji Okita,Tsuyoshi Yasuda (Original Creator);Kumiko Habara (Director );Kenta Ihara (Series Composition);Miyako Nishida (Character Design);Yuuko Ooba (Character Design),Official Site;Twitter;OceanVeil;Crunchyroll,False,Ao no Miburo Season 2,https://anilist.co/anime/189258,1774502290,1774686600,14,2026-03-26T05:28:03.423269+00:00,anilist
188034,61227.0,Girls und Panzer: Motto Love Love Sakusen desu!,,ガールズ＆パンツァー もっとらぶらぶ作戦です！,Girls und Panzer: Motto Love Love Sakusen desu!,MOVIE,4.0,72.0,RELEASING,MANGA,WINTER 2026,2026,P.A.WORKS;Actas;Bandai Namco Filmworks;Hakuhodo DY Music & Pictures;Bandai Namco Music Live;KADOKAWA;Movic;Actas;qooop,P.A.WORKS;Actas,Comedy,Female Protagonist;Parody;School;Ensemble Cast;School Club;Cute Girls Doing Cute Things;Primarily Female Cast;Yuri,,67.0,79.0,0,0,2751,0,2751,37,460,99,46,28,2118,2025-12-26,2026-04-10,,,Four part adaptation of the <i>Girls und Panzer: Motto Love Love Sakusen desu!</i> manga. <br><br> (Source: Natalie Comics),JP,True,#ガルパンらぶらぶ #garupan,https://s4.anilist.co/file/anilistcdn/media/anime/cover/medium/bx188034-hlwafdUZhjwD.png,#d6ae78,,youtube,T6C9C9ynlQo,Miho Nishizumi;Saori Takebe;Hana Isuzu;Yukari Akiyama;Mako Reizei,Marco Nii (Original Creator);Fumikane Shimada (Original Character Design);Isao Sugimoto (Original Character Design);Masami Shimoda (Director);Takahiko Usui (Assistant Director),Twitter;Official Site,False,Girls & Panzer - Motto Love Love Sakusen desu!,https://anilist.co/anime/188034,1774502265,1775746800,4,2026-03-26T05:28:03.423325+00:00,anilist
199446,61969.0,"Saioshi no Gikei Mederu Tame, Nagaikishimasu!",I'll Live a Long Life to Dote on My Favorite Stepbrother!,最推しの義兄を愛でるため、長生きします！,"Saioshi no Gikei Mederu Tame, Nagaikishimasu!",TV_SHORT,,4.0,RELEASING,OTHER,WINTER 2026,2026,Imageworks Studio;Imagica Infos,Imageworks Studio;Imagica Infos,Fantasy;Romance,Boys' Love;Adoption;Male Protagonist;Inseki;Flash;Cute Boys Doing Cute Things;LGBTQ+ Themes;Age Regression;Family Life;Primarily Male Cast,,47.0,50.0,0,0,1754,0,1754,32,634,32,48,192,848,2026-01-03,,,,"The story of Saioshi no Gikei Mederutame, Nagaikishimasu! follows the struggle of a player to protect his favorite character, who gets reincarnated as his older brother-in-law in a simulation raising game - however, the player is reincarnated as the younger brother who was meant to die. <br><br> (Source: ANN)",JP,True,,https://s4.anilist.co/file/anilistcdn/media/anime/cover/medium/bx199446-2jYnGrTItjyu.jpg,#4393c9,,youtube,kH6Yrpboous,Alba;Orsis;Hals;Floro;Bruno,Kazuaki (Original Character Design);Shouta Aoi (Theme Song Performance (ED));Maki Takuma (Sound Effects);Kazuya Takahashi (Production Generalization);Taeko Miura (Sound Director),Twitter;Official Site;OceanVeil,False,I’ll Live A Long Life to Adore My Absolute Fave—Currently My Stepbrother,https://anilist.co/anime/199446,1774502240,0,0,2026-03-26T05:28:03.423401+00:00,anilist
200556,62804.0,High School! Kimengumi (2026),High School! Kimengumi (2026),ハイスクール！奇面組 (2026),High School! Kimengumi (2026),TV,12.0,23.0,RELEASING,MANGA,WINTER 2026,2026,Seven;Fuji TV;Aniplex;Shueisha;Dentsu;Tohan;Seven;Bit grooove promotion;Slow Curve;Fuji Creative Corporation,Seven,Comedy;Romance,Shounen;Surreal Comedy,,46.0,48.0,0,0,1535,0,1535,14,531,12,41,251,700,2026-01-09,2026-03-27,,,"The wildly eccentric group, the Kimengumi, returns in the Reiwa era with their ultra-high-energy youth comedy!",JP,True,#ハイスクール奇面組,https://s4.anilist.co/file/anilistcdn/media/anime/cover/medium/bx200556-TezRfCQCFLbA.png,#00feff,https://s4.anilist.co/file/anilistcdn/media/anime/banner/200556-vp7XJGhTNK6j.jpg,youtube,pbiQh6dD1Ks,Rei Ichidou;Gou Reietsu;Kiyoshi Shusse;Jin Daima;Dai Monohoshi,Motoei Shinzawa (Original Creator);Kazuaki Seki (Director);Shigeru Murakoshi (Series Composition);Yuka Abe (Character Design);Min-Seok Kim (Color Design),Twitter;Official Site;TikTok;Amazon Prime Video,False,,https://anilist.co/anime/200556,1774498807,1774621800,12,2026-03-26T05:28:03.423452+00:00,anilist
206425,,Sousou no Frieren: ●● no Mahou Part 3,,葬送のフリーレン ～●●の魔法～ 3クール,Sousou no Frieren: ●● no Mahou Part 3,ONA,,1.0,RELEASING,ORIGINAL,WINTER 2026,2026,TOHO animation STUDIO;Toho,TOHO animation STUDIO,Comedy;Fantasy,Medieval;Chibi,,64.0,74.0,0,0,1499,0,1499,17,686,76,39,27,671,2026-01-19,,,,"A third batch of the <i>●● no Mahou</i> shorts released alongside the airing of the TV anime's second season, starting with #18. Posted on the official YouTube account of TOHO animation, Frieren Twitter, and Frieren TikTok account.<br><br>  <b>Includes:</b><br> • Mita Mono wo Kousoku Suru Mahou (見た者を拘束する魔法), released Jan 19, 2026. <br> • Doushin ni Kaeru Mahou (童心に還る魔法), released Feb 2, 2026.<br> • Kokoro to Karada ga Irekawaru Mahou (心と体が入れ替わる魔法), released Feb 17, 2026.<br> • Osentaku no Mahou  (お洗濯の魔法), released Mar 2, 2026.<br>",JP,True,#フリーレン #frieren,https://s4.anilist.co/file/anilistcdn/media/anime/cover/medium/b206425-WOwXsfDbHZwb.jpg,#d6d678,,youtube,WTUkzIG8ZeE,Frieren;Fern;Stark;Wirbel;Serie,Kanehito Yamada (Original Story);Tsukasa Abe (Original Character Design);Mebachi (Character Design);Evan Call (Music),YouTube;Official Site;TikTok;Twitter,False,Sousou no Frieren 2nd Season Mini Anime;Frieren: Beyond Journey’s End Season 2 Mini Anime;Sousou no Frieren: Marumaru no Mahou,https://anilist.co/anime/206425,1774477307,0,0,2026-03-26T05:28:03.423476+00:00,anilist
