anime_id,mal_id,title,english_title,japanese_title,user_preferred_title,type,episodes,duration,status,source,season,season_year,studios,main_studios,genres,tags,rating,score,mean_score,scored_by,rank,popularity,popularity_rank,members,favorites,watching,completed,on_hold,dropped,plan_to_watch,start_date,end_date,broadcast_day,broadcast_time,synopsis,country_of_origin,is_licensed,hashtag,cover_image_large,cover_image_color,banner_image,trailer_site,trailer_id,main_characters,main_staff,streaming_sites,is_adult,synonyms,site_url,updated_at,next_airing_episode_at,next_episode_number,collected_at,data_source
198117,62378.0,GANGLION,,ガングリオン,GANGLION,TV_SHORT,,3.0,RELEASING,MANGA,FALL 2025,2025,studio maf;Yoshimoto Broad Entertainment;AT-X;LDH JAPAN;BS Yoshimoto,studio maf,,Office;Superhero;Urban;Work;Tokusatsu;Henshin;Satire,,54.0,58.0,0,0,2503,0,2503,32,1096,18,44,156,1189,2025-10-03,,,,"Set in the early 2000's, the story of Ganglion follows the everyday adventures of Kenji Isobe, a professional henchman for the Ganglion Corporation, which plots world domination with evil schemes such as “Operation: Tokyo Cedar Pollen” and “Operation: Mount Fuji Detonation”. Kenji's workplace is a battlefield, where every day he has to deal with workplace drama, unreasonable bosses and crushing defeat at the hands of the hero HOPEMAN. <br><br> (Source: Crunchyroll)",JP,True,#ガングリオン,https://s4.anilist.co/file/anilistcdn/media/anime/cover/medium/bx198117-ms0mzmuyOw8n.png,#e45d50,,youtube,ShJvaDqFgiA,Shadow Taisa;Kenji Isobe;HOPEMAN;Setsuko Isobe;Yumiko,Hisaya Shiraiwa (Original Story);Takashi Itsuki (Original Character Design);Ayumu Watanabe (Director);Ryousuke Tanaka (Assistant Director);Tomoaki Shiono (Series Composition),Official Site;Twitter,False,,https://anilist.co/anime/198117,1766290981,0,0,2025-12-21T04:29:02.859808+00:00,anilist
187166,61107.0,Ganso! Bandori-chan,GANSO! BanG Dream Chan,元祖！バンドリちゃん,Ganso! Bandori-chan,ONA,52.0,1.0,RELEASING,OTHER,FALL 2025,2025,AtoriE;Bushiroad,AtoriE,Comedy;Music,Chibi;Primarily Teen Cast;Band;Episodic;Primarily Female Cast;Ensemble Cast;Female Protagonist;School;Urban;Cute Girls Doing Cute Things,,65.0,73.0,0,0,1579,0,1579,14,1003,11,10,38,517,2025-10-02,,,,"After taking the girls' band world by storm, ""BanG Dream Chan"" is back!? <br><br> Get ready for a huge reunion with all your favorite pop and cute band members in the fun-filled girls' band comedy! <br><br> Come on, BanG Dream Chan! We are all BanG Dream Chan! <br><br> (Source: BanG Dream! GBP Twitter account) <br><br> <i>Note: Relations are provisional and subject to change.</i>",JP,True,#元祖バンドリちゃん #GansoBDC,https://s4.anilist.co/file/anilistcdn/media/anime/cover/medium/bx187166-ASfp7wErGrxQ.png,#e4e45d,,youtube,7WsRmVZspYI,Kasumi Toyama;Arisa Ichigaya;Rimi Ushigome;Tae Hanazono;Saaya Yamabuki,Bushiroad  (Original Creator);Kou Nakamura (Original Story);Hitowa (Original Character Design);Kenshirou Morii (Director);Seiya Miyajima (Director),Official Site;YouTube,False,,https://anilist.co/anime/187166,1766290988,1766667600,13,2025-12-21T04:29:02.859974+00:00,anilist
193923,61770.0,Kono Hon wo Nusumu Mono wa,,この本を盗む者は,Kono Hon wo Nusumu Mono wa,MOVIE,1.0,85.0,NOT_YET_RELEASED,OTHER,FALL 2025,2025,KADOKAWA;Kagokan,Kagokan,Adventure;Fantasy;Mystery,Female Protagonist,,,,0,0,1486,0,1486,6,32,5,8,8,1433,2025-12-26,2025-12-26,,,"Descended from a long line of book collectors, high school student Mifuyu is surrounded by books in every aspect of her life. Her great-grandfather established the famous Mikura Hall, a library in the heart of town, and even the townspeople are all avid readers. There’s just one problem—Mifuyu hates books! But when a thief in Mikura Hall triggers an ancient curse, she’s left with no choice but to reclaim the stolen books herself…by entering the very stories she despises! With the help of the mysterious Mashiro, will she be able to restore her great-grandfather’s collection and save her town from a magical doom? <br><br> (Source: Yen Press)",JP,True,#この本を盗む者は,https://s4.anilist.co/file/anilistcdn/media/anime/cover/medium/bx193923-BJPyMB55Q4WC.jpg,#f1a143,,youtube,sgxNwKuNIWk,Mifuyu Mikura;Mashiro;Hirune Mikura;Keiko Yosano;Takafumi Haruta,Nowaki Fukamidori (Original Creator);Daiki Fukuoka (Director);Keiko Kurosawa (Character Design);Hiroaki Kaguchi (Color Design);Eriko Murata (Color Design),Twitter;Official Site,False,Whoever Steals This Book,https://anilist.co/anime/193923,1766290967,1766674800,1,2025-12-21T04:29:02.859999+00:00,anilist
196230,62066.0,Monster Strike: Deadverse Reloaded,,モンスターストライク　デッドバースリローデッド,Monster Strike: Deadverse Reloaded,TV,10.0,24.0,RELEASING,VIDEO_GAME,FALL 2025,2025,Yumeta Company,Yumeta Company,Action;Fantasy,,,,44.0,0,0,1174,0,1174,19,319,4,24,48,779,2025-10-21,2025-12-23,,,"Rinne is a girl who cannot see other people's faces. Born into a family whose job it is to exorcise supernatural beings, she sets out on her first mission, but encounters an enemy of a different nature than she expected, and finds herself in peril.<br><br>After being saved by a mysterious man named Jugemu, Rinne learns that all worlds, including the one she lives in, known as ""Strike Worlds,"" are under threat.<br><br>As she travels through a number of ending worlds with Jugemu, the girl forms a bond with him...",JP,True,#モンスト #モンストアニメ #デドリロ,https://s4.anilist.co/file/anilistcdn/media/anime/cover/medium/bx196230-I74EkzFm3FYK.png,#50a1e4,,youtube,DNjBwSRXZvw,Jugemu;Rinne;Yakumo;Neo,Masao Ookubo (Director);Noriyuki Nakamura (Assistant Director);Jin Haganeya (Series Composition);Hayato Kazano (Series Composition);Kazumi Inadome (Character Design),Twitter;YouTube;Official Site;TikTok,False,,https://anilist.co/anime/196230,1766290974,1766498400,10,2025-12-21T04:29:02.860054+00:00,anilist
187860,61184.0,Nohara Hiroshi: Hiru Meshi no Ryuugi,Style of Hiroshi Nohara's Lunch,野原ひろし 昼メシの流儀,Nohara Hiroshi: Hiru Meshi no Ryuugi,TV,12.0,24.0,RELEASING,MANGA,FALL 2025,2025,DLE;Shin-Ei Animation;Futabasha;TV Asahi;ADK Emotions;DLE;BS Asahi;Bandai Namco Filmworks,DLE,Comedy;Slice of Life,Food;Male Protagonist;Work;Restaurant;Primarily Adult Cast;Episodic;Iyashikei;Cute Boys Doing Cute Things;Office;Travel,,55.0,61.0,0,0,1170,0,1170,20,461,62,22,106,519,2025-10-03,,,,"Hiroshi Nohara, Japan's ultimate family man, is obsessed with lunch in order to work hard in the afternoon! The official spin-off gourmet manga of the popular ""Crayon Shin-chan""! <br><br> (Source: Comic Action, translated)",JP,True,,https://s4.anilist.co/file/anilistcdn/media/anime/cover/medium/bx187860-R1IHWJGSL4EB.jpg,#f1505d,,,,Hiroshi Nohara;Kawaguchi;Haruka Shisugi;Akitake Takagiri;Yoshirin Hatogaya,Yoshito Usui (Original Creator);Tsukasa Nishiyama (Director);Hayashi Mori (Script);Hayashi Mori (Series Composition);Youichi Tsukahara (Original Creator),Official Site;Twitter;iQ,False,Style of Hiroshi Nohara's Lunch;สไตล์อาหารกลางวันของโนะฮาระ ฮิโรชิ,https://anilist.co/anime/187860,1766290985,0,0,2025-12-21T04:29:02.860081+00:00,anilist
196750,62328.0,Sister Breeder,,シスターブリーダー,Sister Breeder,OVA,,20.0,RELEASING,MANGA,FALL 2025,2025,Bunny Walker;Lune Pictures;T-REX,T-REX,Hentai,Inseki;Incest;Nakadashi;Anal Sex;Sex Toys;Heterosexual;Fellatio,,69.0,75.0,0,0,995,0,995,70,326,176,93,22,378,2025-09-26,,,,"<b>Episode 1 - 3</b> - <i>Sister Breeder</i><br> Shouta is very affectionate towards his sisters Rena and Aina, they grew up as close siblings. Day by day, he becomes more affectionate towards Aina... and eventually he even sneaks into her room at night!? Rena tries to stop Shouta, but ends up receiving his affection in Aina's place. Due to her hidden feelings for Shouta and the pleasure of experiencing things for the first time, the once innocent Rena is steadily being trained by Shouta...!? <br><br> <b>Episode 4</b> - <i>Akuma de Kanojo wa Boku no Tenshi</i><br> This is a forbidden love. Timid teacher Makoto tries to suppress his feelings for his student Mano. But one day, Makoto finds out Mano's secret, and with an angelic smile, she starts making devilish demands! Mano seduces him with various types of play. However, in order to melt away Makoto's hesitation, she provokes him into serving her...!? A pure love story of a devilish angel! <br><br> (Source: Lune-soft, translated and ed",JP,True,,https://s4.anilist.co/file/anilistcdn/media/anime/cover/medium/bx196750-qwkwqdNMXIwD.png,#bb35e4,https://s4.anilist.co/file/anilistcdn/media/anime/banner/196750-cmc0IEyZbqOj.jpg,,,Rena Oomiya;Aina Oomiya;Shouta Oomiya,Hiromitsu Takeda (Original Creator);Hiromitsu Takeda (Character Design);Ken Raika (Director);Megane Sagari (Storyboard);Tokku03 (Script),,True,,https://anilist.co/anime/196750,1766290977,1772118000,3,2025-12-21T04:29:02.860129+00:00,anilist
196722,62315.0,Reika wa Karei na Boku no Joou THE ANIMATION,,レイカは華麗な僕の女王 THE ANIMATION,Reika wa Karei na Boku no Joou THE ANIMATION,OVA,,20.0,RELEASING,MANGA,FALL 2025,2025,Seven;Pink Pineapple,Seven,Hentai,Nakadashi;Feet;Maids;Femdom;Ashikoki,,68.0,77.0,0,0,722,0,722,43,217,94,58,20,333,2025-10-24,,,,"<i>""They say that ejaculating after three days of holding back feels like heaven""</i>, says the gorgeous maid Reika, who is tasked with not only taking care of her master Reiji's daily routine, but also managing his ejaculations!? Reika teases Reiji's genitals from the morning, teasing him until he reaches the brink of orgasm♪ After her teasing attack, what extraordinary service will Reika provide after the promised three days...?! <br><br> (Source: PinkPineapple, translated)",JP,True,,https://s4.anilist.co/file/anilistcdn/media/anime/cover/medium/bx196722-mpsggThw5jFv.png,#5093e4,,,,Reiji Shinonome;Reika;Hasumi Asagiri,Gustav (Original Creator);Junji Tanaka (Storyboard);Satoru Matsuura (Director);Satoru Matsuura (Animation Director);Hitoshide Saitou (Character Design),,True,,https://anilist.co/anime/196722,1766273106,0,0,2025-12-21T04:29:02.860200+00:00,anilist
193294,61736.0,Toritsukare Otoko,,トリツカレ男,Toritsukare Otoko,MOVIE,1.0,,RELEASING,OTHER,FALL 2025,2025,Bandai Namco Pictures;Shin-Ei Animation,Shin-Ei Animation,Music,,,,63.0,0,0,689,0,689,3,33,10,6,16,624,2025-11-07,2025-01-01,,,"The story centers on a young man named Giuseppe, who is called ""Toristukare Otoko"" by the townspeople because once he gets absorbed in something, he cannot look at anything else. One day, he falls in love at first sight with a girl selling balloons named Pechka. He goes crazy and tries to get closer to Pechka, but she has a sadness in her heart and... For the sake of his beloved Pechka, Giuseppe and his partner, the mouse Cielo, secretly solve her worries by using the many tricks he has been obsessed with.<br><br>  (Source: Crunchyroll News, edited)",JP,True,#映画トリツカレ男,https://s4.anilist.co/file/anilistcdn/media/anime/cover/medium/bx193294-cWRDRpwqGYDA.jpg,#e45da1,,youtube,Q7T1jmDMMVQ,Giuseppe;Pechka,Shinji Ishii (Original Creator);Wataru Takahashi (Director);Masatsugu Arakawa (Character Design);Kentarou Akiyama (Art Director);Izumi Hirose (Color Design),Official Site;Twitter;Instagram;TikTok,False,,https://anilist.co/anime/193294,1766049754,0,0,2025-12-21T04:29:02.860258+00:00,anilist
194353,62316.0,Choro Mesu Days,,ちょろ・めす・でいず,Choro Mesu Days,OVA,,,RELEASING,MANGA,FALL 2025,2025,Mary Jane,,Hentai,Large Breasts;Incest;Boobjob;Inseki;Fellatio;Masturbation;Nakadashi;POV;Male Protagonist;Female Protagonist,,62.0,70.0,0,0,600,0,600,32,178,89,55,13,265,2025-10-17,,,,"<i>Dekapai Gimai, Shuurai</i><br> His stepsister's overwhelming breasts cause him to lose all sense of reason! Takashi's parents remarried and he ended up living with his stepsister. He thought it would be awkward to live with a girl, even though she was his stepsister, but he was surprised when he saw her. Her name was Alice, a beautiful girl from Northern Europe. While Takashi was happy to have a beautiful stepsister, her overly large breasts made him feel uneasy. However, seeing Alice trying to fit in with the family, Takashi suppressed his wicked feelings and treated her as his stepbrother. However, one day, when he saw Alice naked, Takashi's wall of reason collapsed. <br><br> (Source: Getchu, translated)",JP,True,,https://s4.anilist.co/file/anilistcdn/media/anime/cover/medium/bx194353-DYQodQxpFuXD.png,#e4c9a1,,,,,Esuke Toono (Original Creator),,True,,https://anilist.co/anime/194353,1766280266,0,0,2025-12-21T04:29:02.860307+00:00,anilist
198048,62380.0,Natsuzuma,,夏妻,Natsuzuma,OVA,,16.0,RELEASING,OTHER,FALL 2025,2025,T-REX;An♥Tekinus;Lune Pictures,T-REX,Hentai,MILF;Large Breasts;Threesome;Cheating;Blackmail;Netorare;Fellatio;Facial;Nakadashi;Handjob,,62.0,70.0,0,0,561,0,561,27,166,116,40,14,225,2025-10-31,,,,"A summer trip to the beach that she couldn't go to with her husband. Yumiko was excited and looking forward to this day. But when her husband can't come, she heads to the beach alone with her young son. Just as she's feeling down, two young men approach her. That night, Yumiko is invited to the room of the men who hit on her that day. She puts her son to bed and heads to the room where the two young men are waiting, with secret hope in her heart. A forbidden summer begins, as she is consumed by carnal desires despite being tormented by guilt... <br><br> (Source: Lune-soft, translated)",JP,True,,https://s4.anilist.co/file/anilistcdn/media/anime/cover/medium/bx198048-ChBdGvIIDqrk.png,#e45d5d,https://s4.anilist.co/file/anilistcdn/media/anime/banner/198048-920igrfThmom.jpg,,,Yumiko Seto,Kurosu Gatari (Original Creator),,True,A Midsummer NTR Dream,https://anilist.co/anime/198048,1766275511,0,0,2025-12-21T04:29:02.860327+00:00,anilist
196547,62145.0,H na Gishi Series The Animation,,Hな義姉シリーズ The Animation,H na Gishi Series The Animation,OVA,,20.0,RELEASING,OTHER,FALL 2025,2025,Show-Ten,,Hentai,Inseki,,56.0,66.0,0,0,469,0,469,16,150,38,43,13,225,2025-10-31,,,,,JP,True,,https://s4.anilist.co/file/anilistcdn/media/anime/cover/medium/bx196547-hXnKykN7Ky4Z.png,#e4ae50,,,,,Hijiri☆Tsukasa (Original Creator),,True,,https://anilist.co/anime/196547,1766262469,0,0,2025-12-21T04:29:02.860370+00:00,anilist
199794,62643.0,Anila to Cocora,,アニラとココラ,Anila to Cocora,TV_SHORT,13.0,2.0,RELEASING,ORIGINAL,FALL 2025,2025,Kachidoki Studio;MMDGP,Kachidoki Studio,Comedy;Slice of Life,Kemonomimi;Cute Boys Doing Cute Things;Animals;Episodic,,,44.0,0,0,406,0,406,6,148,3,9,36,210,2025-10-03,2025-12-26,,,"The anime centers on sea otter brothers Anira and Kokora, who live at a certain aquarium. Anira is the older brother who is cool, but also has a naive side. The younger brother Kokora is a passionate otter who adores his older brother.  <br><br> (Source: Anime News Network)",JP,True,,https://s4.anilist.co/file/anilistcdn/media/anime/cover/medium/bx199794-DjnzEzfFG559.jpg,,,youtube,6Nix6ivcGLI,Cocora;Anira,Hiroshi Namiki (Director);Nosharu Imai (Character Design);Yuu Saitou (Sound Director);Yuuichirou Nakanishi (Sound Effects);Yuuichirou Nakanishi (Music),,False,Anira to Cocola;Anira to Kokora,https://anilist.co/anime/199794,1766291028,1766682900,13,2025-12-21T04:29:02.860393+00:00,anilist
200228,62689.0,Oshikake! Bakunyuu Gal Harem Seikatsu,,おしかけ！爆乳ギャルハーレム性活,Oshikake! Bakunyuu Gal Harem Seikatsu,OVA,,16.0,RELEASING,OTHER,FALL 2025,2025,T-REX;Bunny Walker;Lune Pictures,T-REX,Hentai,Gyaru;Female Harem;Nakadashi;Group Sex;Boobjob;Fellatio;Femdom;Cunnilingus;Mating Press;Tanned Skin,,58.0,72.0,0,0,397,0,397,20,96,54,31,7,209,2025-11-28,,,,"A salaryman who was fired from his job and has no girlfriend is caught by some gals! He is treated like a molester just for looking at them, and the gals force their way into his house, demanding that he let them stay there, and have sex with him to kill time! This man, who has no experience with women, is toyed with by the gals who know no shyness! Whether in the living room, the bath, or in bed, the girls' ""inspection"" never stops! <br><br> (Source: Lune-soft, translated)",JP,True,,https://s4.anilist.co/file/anilistcdn/media/anime/cover/medium/bx200228-r8Bm5BulKKOS.jpg,#f143a1,https://s4.anilist.co/file/anilistcdn/media/anime/banner/200228-fta41j00DAv7.jpg,,,,Hishigata Tomaru (Original Creator),,True,Gyaru Harem Invasion,https://anilist.co/anime/200228,1766291028,0,0,2025-12-21T04:29:02.860414+00:00,anilist
196540,62314.0,Seikon no Aria,,聖痕のアリア,Seikon no Aria,OVA,,,RELEASING,VIDEO_GAME,FALL 2025,2025,Majin petit,Majin petit,Hentai,,,53.0,64.0,0,0,347,0,347,13,89,30,32,10,186,2025-10-31,,,,"Based on the erotic doujin game by Ishikorodou (イシコロドウ).<br> <br> Due to the succubus curse, the ""Succubus Disease"" has spread. This disease causes people to lose control of their lust and transform into monster. The only way to confront the Disease is let the infected cum again and again! The main character, Aria, was attacked by an ""Succubus Infected"" in her childhood but was saved in the nick of time by a former Exorcist Nun. Ten years later, determined to rescue people, the grown-up Aria decides to become the Exorcist Nun, stepping forward to confront the spreading Succubus Disease.<br> <br> (Source: Steam)",JP,True,,https://s4.anilist.co/file/anilistcdn/media/anime/cover/medium/bx196540-bgmJs8Kou7zD.png,#e4ae93,,,,,Yuuki Ookami (Original Creator),,True,Stigma-ARIA,https://anilist.co/anime/196540,1766280266,1769698800,2,2025-12-21T04:29:02.860430+00:00,anilist
195360,62339.0,Honey Blonde 2,,ハニーブロンド2,Honey Blonde 2,OVA,,20.0,RELEASING,MANGA,FALL 2025,2025,Queen Bee;Mediabank,,Hentai,,,55.0,67.0,0,0,328,0,328,14,101,32,33,16,146,2025-10-24,,,,"Erina, a breastfeeding girl, is in love with Masaki, and Masaki can't live without Erina's breast milk. They both pass the entrance exams to college, and head straight to a love hotel in the middle of the day. After six months of abstinence, Masaki, who loves breast milk, goes crazy for Erina's breasts. The two perverts with strong sexual habits repeatedly seek each other and reach climax.<br> <br> (Source: Mediabank, translated)",JP,True,,https://s4.anilist.co/file/anilistcdn/media/anime/cover/medium/bx195360-PAlYR0UnuGdV.png,#938628,,,,Eleanor Mercer,Fukudahda (Original Creator),,True,,https://anilist.co/anime/195360,1766259204,1772118000,3,2025-12-21T04:29:02.860448+00:00,anilist
194389,62005.0,Koala Enikki,Koala's Diary,コアラ絵日記,Koala Enikki,ONA,,2.0,RELEASING,MANGA,FALL 2025,2025,studio MOTHER;KADOKAWA,studio MOTHER,Slice of Life,Anthropomorphism;Primarily Animal Cast;No Dialogue;Iyashikei;Episodic;Animals,,,56.0,0,0,323,0,323,2,154,3,5,42,119,2025-10-02,,,,"The manga is about Koala who writes about daily life, whether it's good or bad, happy or sad, Koala treats every day as a precious day. Koala believes that today is a good day, and tomorrow will be a good day too. <br><br> (Source: Anime News Network)",JP,True,,https://s4.anilist.co/file/anilistcdn/media/anime/cover/medium/bx194389-DAbj4TOj5GB9.png,#e47843,,youtube,jnSt-yJxigA,Koala-san,Yuami (Original Creator);Takao Kato (Director );Chiharu Hara (Character Design);Kan Sano (Theme Song Performance);Punipunidenki (Theme Song Performance),Twitter;Official Site;YouTube;Instagram;YouTube,False,Koala's Diary,https://anilist.co/anime/194389,1766290959,1766660400,13,2025-12-21T04:29:02.860471+00:00,anilist
196116,62353.0,Nagachichi Nagai-san THE ANIMATION,,ながちち永井さん THE ANIMATION,Nagachichi Nagai-san THE ANIMATION,OVA,,20.0,RELEASING,OTHER,FALL 2025,2025,Pink Pineapple;Seven,Seven,Hentai,,,,61.0,0,0,321,0,321,15,86,23,20,10,182,2025-11-28,,,,Based on the CG collection by Santa Tsuji (津路参汰).,JP,True,,https://s4.anilist.co/file/anilistcdn/media/anime/cover/medium/bx196116-3bli0EwyZlBM.png,#ffc9bb,,,,Nagai-san,Santa Tsuji (Original Creator);Kazuhiro Ohara (Director);Kazuhiro Ohara (Character Design);Kazuhiro Ohara (Key Animation);Kazuhiro Ohara (Storyboard),,True,Nagachichi Nagai-san Diet Struggle Day,https://anilist.co/anime/196116,1766267009,1769698800,3,2025-12-21T04:29:02.860489+00:00,anilist
188529,61254.0,Ugoku! Neko Mukashi Banashi,Cat Tales,うごく！ねこむかしばなし,Ugoku! Neko Mukashi Banashi,ONA,,3.0,RELEASING,MANGA,FALL 2025,2025,Kodansha;Studio Comet;KADOKAWA,Studio Comet,Comedy,Kids;Animals;Fairy Tale;Primarily Animal Cast;Episodic;Chibi,,,58.0,0,0,284,0,284,5,142,0,6,25,111,2025-10-15,,,,"What if cats appeared in that story…? When beloved old tales and fairy stories are joined by cats, a surreal and heartwarming new adventure begins…!? Tabby cats, orange cats, calico cats, and white cats— a delightful mix of feline friends woven into timeless stories is sure to soothe the hearts of all humanity! A charming cat comedy is about to unfold! <br><br> (Source: AniOne Asia)",JP,True,,https://s4.anilist.co/file/anilistcdn/media/anime/cover/medium/bx188529-6o9byjahRpEx.jpg,#e46b5d,,youtube,n-jg8syMe08,Kijitora;Chatora;Shironeko;Mikeneko,Pandania (Original Creator);Kazumi Nonaka (Director);Kenichi Yamashita (Series Composition);Narumi Shimoji (Character Design);haku. (Theme Song Performance (ED)),Twitter;YouTube;Official Site;YouTube,False,Move! Cat Folktales,https://anilist.co/anime/188529,1766291028,1766574000,11,2025-12-21T04:29:02.860531+00:00,anilist
198926,62522.0,Chou Futsuu Mahou Shoujo Asumi Toruverse,,超普通マホウ少女アスミトルバース,Chou Futsuu Mahou Shoujo Asumi Toruverse,TV_SHORT,13.0,4.0,RELEASING,ORIGINAL,FALL 2025,2025,Frontier Works;Super Normal Studio,Super Normal Studio,Comedy;Fantasy;Mahou Shoujo,,,,46.0,0,0,270,0,270,4,68,2,8,16,176,2025-10-02,,,,Fifth season of the <i>Chou Futsuu</i> series.,JP,True,#超普通マホウ少女アスミトルバース,https://s4.anilist.co/file/anilistcdn/media/anime/cover/medium/bx198926-J5Ml6dqNGze9.png,#e46b5d,,youtube,RTiWEXeniic,,Masaya Murai (Director);Hiroo Nakamichi (Character Design);Arisa Noto (Theme Song Performance);Kaori Ishihara (Theme Song Performance);Seiji Miura (Insert Song Lyrics),Facebook;Official Site;YouTube,False,,https://anilist.co/anime/198926,1766276155,1766667240,13,2025-12-21T04:29:02.860551+00:00,anilist
188928,62406.0,Natsu to Hako,,夏と箱,Natsu to Hako,OVA,,,NOT_YET_RELEASED,MANGA,FALL 2025,2025,Mary Jane,,Hentai,,,,,0,0,242,0,242,12,22,1,8,7,204,2025-12-05,,,,"Summer! Closed Room!! Intimacy!!! Secret Time Begins <br><br> Yoshi is walking along a mountain path with a bug net and cage in hand when he notices an unfamiliar girl in a phone booth. The girl notices Yoshi looking in the direction and calls out to him. The girl's name is Sachi, and she seems to be having trouble getting through on the phone. Yoshi can't leave her alone and enters the booth. But then the bug net gets stuck in the door, preventing him from getting out. To escape the heat, Yoshi takes off his clothes. Sachi hesitates, but she can't stand the heat and takes off her clothes. Yoshi, seeing Sachi's figure, becomes sexually aware. An insect flies out of the insect cage Yoshi is holding. Sachi panics and embraces Yoshi. Yoshi is struck by the softness of Sachi's body. <br><br> (Source: Getchu, translated)",JP,True,,https://s4.anilist.co/file/anilistcdn/media/anime/cover/medium/bx188928-qzOaoEWGmpIA.png,#e4865d,,,,,doumou (Original Creator),,True,,https://anilist.co/anime/188928,1766280266,1770303600,2,2025-12-21T04:29:02.860566+00:00,anilist
199812,62682.0,Sawaranaide Kotesashi-kun Mini Anime Gekijou,Hands off: Sawaranaide Kotesashi-kun! Mini Anime,さわらないで小手指くんミニアニメ劇場,Sawaranaide Kotesashi-kun Mini Anime Gekijou,TV_SHORT,12.0,12.0,RELEASING,MANGA,FALL 2025,2025,WWWave;Front Wing,Front Wing,Comedy;Ecchi;Romance;Sports,,,,50.0,0,0,211,0,211,4,78,8,6,16,103,2025-10-06,2025-12-22,,,A weekly mini anime shown with each episode of <i>Sawaranaide Kotesashi-kun</i>.,JP,True,,https://s4.anilist.co/file/anilistcdn/media/anime/cover/medium/bx199812-88EBKcwBqQjG.png,#ffe4a1,,,,Kouyou Kotesashi;Miyuki Hongou;Aroma Kusunoki;Aoba Kitahara;Izumi Sumiyoshi,Takuya Shinjou (Original Creator);Akari Arimiya (Director);Akari Arimiya (Character Design);Akari Arimiya (Sound Director),Twitter;Official Site;OceanVeil,False,さわらないで小手指くんスピンオフミニアニメ;Sawaranaide Kotesashi-kun Spin-off Mini Anime,https://anilist.co/anime/199812,1766255550,1766333160,12,2025-12-21T04:29:02.860590+00:00,anilist
198046,62369.0,Do S na Pet,,ドＳなペット,Do S na Pet,OVA,,,RELEASING,ORIGINAL,FALL 2025,2025,Nur,Nur,Hentai,,,,62.0,0,0,210,0,210,13,46,11,11,8,134,2025-11-28,,,,,JP,True,,https://s4.anilist.co/file/anilistcdn/media/anime/cover/medium/bx198046-M34Xlo7MyCLL.png,#d678ae,,,,,,,True,,https://anilist.co/anime/198046,1766291028,1772118000,2,2025-12-21T04:29:02.860604+00:00,anilist
