anime_id,mal_id,title,english_title,japanese_title,user_preferred_title,type,episodes,duration,status,source,season,season_year,studios,main_studios,genres,tags,rating,score,mean_score,scored_by,rank,popularity,popularity_rank,members,favorites,watching,completed,on_hold,dropped,plan_to_watch,start_date,end_date,broadcast_day,broadcast_time,synopsis,country_of_origin,is_licensed,hashtag,cover_image_large,cover_image_color,banner_image,trailer_site,trailer_id,main_characters,main_staff,streaming_sites,is_adult,synonyms,site_url,updated_at,next_airing_episode_at,next_episode_number,collected_at,data_source
198921,62504.0,Sylvanian Families: Freya no Wonder Days,,シルバニアファミリー フレアのワンダーデイズ,Sylvanian Families: Freya no Wonder Days,TV_SHORT,12.0,12.0,RELEASING,OTHER,FALL 2025,2025,LandQ studios;Epoch,LandQ studios,Fantasy;Slice of Life,,,,40.0,0,0,63,0,63,0,7,4,0,13,39,2025-10-02,,,,,JP,True,#シルバニアファミリー,https://s4.anilist.co/file/anilistcdn/media/anime/cover/medium/bx198921-NMVQx7KSCnTd.png,#4378e4,,,,Freya Chocolate;Crème Chocolate;Ralph Walnut;Lyra Persian;Theo Biscuit,Epoch Sha (Original Creator);Masaaki Kawahara (Director);Hirotoshi Kobayashi (Series Composition);Maika Narita (CG Director);Takumi Kodama (Sound Director),Twitter;Instagram;Official Site;YouTube;TikTok;Facebook,False,,https://anilist.co/anime/198921,1766999918,0,0,2026-01-02T04:32:20.671442+00:00,anilist
204628,62548.0,Oshi ga Buka ni Narimashita,,推しが部下になりました,Oshi ga Buka ni Narimashita,ONA,30.0,2.0,FINISHED,MANGA,FALL 2025,2025,,,Romance,Office Lady;Office;Idol;Josei,,,60.0,0,0,57,0,57,1,6,3,0,1,47,2025-10-31,2025-10-31,,,"Sayaka Tsuneda, age 29, works at an advertising agency when one day a suit-wearing angel descends before her very own eyes?! The idol that gave her life worth meaning is now her co-worker and she's in charge of his training... Is this a dream?! Sayaka struggles to handle her own feelings as the two of them grow closer and closer. How will this awkward fan girl's love story end?! <br><br> (Source: MangaPlaza)",JP,True,#推し部下 #推しが部下になりました,https://s4.anilist.co/file/anilistcdn/media/anime/cover/medium/bx204628-KMFuMxHux58O.png,#f1bb50,,youtube,ao6oWIQCzwA,Riku Kirikawa,Kogetaokoge (Original Character Design);Ryo (Original Story),Twitter;Official Site;YouTube,False,"My Pop-star Co-worker, My Bias Became My Subordinate ;Oshibuka",https://anilist.co/anime/204628,1767306978,0,0,2026-01-02T04:32:20.671461+00:00,anilist
199931,62662.0,Dokodemo Makibao: World Tour,,どこでもマキバオー ～ワールドツアー～,Dokodemo Makibao: World Tour,ONA,,4.0,RELEASING,MANGA,FALL 2025,2025,KDDI;DLE,DLE,Comedy;Sports,,,,40.0,0,0,39,0,39,2,10,0,1,11,17,2025-10-08,,,,Second season of <i>Dokodemo Makibao </i>,JP,True,#マキバオー,https://s4.anilist.co/file/anilistcdn/media/anime/cover/medium/bx199931-EhQ6yMCbEvik.png,#fff100,,youtube,Q5cECzU3p7g,,Tsunomaru (Original Creator);Ryou Ono (Director);Ryou Ono (Series Composition);Kyouhei  Matsuno  (Music);Naotoshi Nakajima (Script),TikTok;Instagram;Official Site;YouTube;Twitter,False,,https://anilist.co/anime/199931,1767140984,1767736800,14,2026-01-02T04:32:20.671479+00:00,anilist
204696,,Little Twin Stars: Hajimari no Monogatari,,リトルツインスターズはじまりの物語,Little Twin Stars: Hajimari no Monogatari,ONA,1.0,9.0,FINISHED,,FALL 2025,2025,Sanrio;Nippon Animation,Nippon Animation,Fantasy,,,,67.0,0,0,37,0,37,2,0,11,0,2,24,2025-12-24,2025-12-24,,,The short is part of Sanrio's celebration of the <i>Little Twin Stars</i> characters' 50th anniversary. <br><br> (Source: AnimeNewsNetwork),JP,True,,https://s4.anilist.co/file/anilistcdn/media/anime/cover/medium/bx204696-Yet85OH1PeCF.png,#50c9fe,,youtube,i6CyZqu7q3Q,Kiki;Lala,Jun Takagi (Director);Norifumi Nakamura (Art Director);Takashi Oohira (Color Design);Monet Kurita (Director of Photography);Akira Ikuzawa (Editing),Twitter;YouTube;Official Site,False,,https://anilist.co/anime/204696,1767306978,0,0,2026-01-02T04:32:20.671500+00:00,anilist
203146,63013.0,Atashin'chi NEXT 2,,あたしンちNEXT 第2期,Atashin'chi NEXT 2,ONA,5.0,10.0,RELEASING,MANGA,FALL 2025,2025,Shin-Ei Animation,Shin-Ei Animation,Comedy,,,,45.0,0,0,30,0,30,0,10,0,2,5,13,2025-11-20,2026-03-20,,,Second season of <i>Atashin'chi Next</i>.,JP,True,#あたしンちNEXT,https://s4.anilist.co/file/anilistcdn/media/anime/cover/medium/bx203146-6Zx7wl6hOEFH.png,#ffbb00,,youtube,M0nJGcs1SUk,Midori Imaji;Mikan Tachibana;Yuzuhiko Tachibana,Eiko Kera (Original Creator);Tetsuo Yasumi (Chief Director);Kazumi Nonaka (Director);Masae Ootake (Character Design),YouTube;Twitter;Official Site,False,,https://anilist.co/anime/203146,1767033830,1768858200,3,2026-01-02T04:32:20.671519+00:00,anilist
200375,62658.0,Inpuru-kun no Sonzai Shinai Oshigoto,,インプる君の存在しないお仕事,Inpuru-kun no Sonzai Shinai Oshigoto,ONA,,3.0,RELEASING,OTHER,FALL 2025,2025,,,Comedy,,,,35.0,0,0,26,0,26,1,7,0,0,9,10,2025-09-01,,,,The anime is based on temp agency Improve's mascot Inpuru-kun. It centers on Inpuru-kun taking on absurd temp jobs.,JP,True,#インプる君,https://s4.anilist.co/file/anilistcdn/media/anime/cover/medium/b200375-RxdzZA1qFTiZ.png,#28f1e4,,youtube,plcwdL2jsvA,,Keisuke Matsumoto (Director);Nobuyuki Owari (Executive Producer),YouTube;Twitter;Official Site,False,,https://anilist.co/anime/200375,1767310640,0,0,2026-01-02T04:32:20.671535+00:00,anilist
204621,62561.0,Koikeya SDGs Gekijou Suss to Tina Season 6,Koikeya SDGs Theater Suss & Tina Season 6,湖池屋SDGs劇場 サスとテナ シーズン６ ,Koikeya SDGs Gekijou Suss to Tina Season 6,TV_SHORT,13.0,3.0,FINISHED,ORIGINAL,FALL 2025,2025,Garage Film,Garage Film,Action;Comedy,,,,50.0,0,0,5,0,5,1,0,3,0,1,1,2025-10-01,2025-12-24,,,Sixth season of <i>Koikeya SDGs Gekijou Suss to Tina</i>.,JP,True,,https://s4.anilist.co/file/anilistcdn/media/anime/cover/medium/b204621-8E7G89mDKBgr.png,#50a1f1,,,,,,YouTube;Official Site,False,,https://anilist.co/anime/204621,1767085243,0,0,2026-01-02T04:32:20.671549+00:00,anilist
172463,57658.0,Jujutsu Kaisen: Shimetsu Kaiyuu - Zenpen,JUJUTSU KAISEN Season 3: The Culling Game Part 1,呪術廻戦 死滅回游 前編,Jujutsu Kaisen: Shimetsu Kaiyuu - Zenpen,TV,,,NOT_YET_RELEASED,MANGA,WINTER 2026,2026,Toho;MAPPA;Shueisha,MAPPA,Action;Drama;Supernatural,Exorcism;Battle Royale;Urban Fantasy;Shounen;Curses;Super Power;Gore;Death Game;Survival;Urban,,,,0,0,91417,0,91417,1203,7173,1416,723,121,81984,2026-01-09,,,,"The third season of <i>Jujutsu Kaisen</i>.<br><br> After the Shibuya Incident, a deadly jujutsu battle known as the Culling Game orchestrated by Noritoshi Kamo erupts across ten colonies in Japan.<br><br> Haunted by guilt over the mass killings in Shibuya and wary of Sukuna’s interest in Fushiguro, Itadori chooses not to return to Jujutsu High. Instead, he teams up with Choso to exorcise the countless cursed spirits unleashed by Noritoshi Kamo. Amid this chaos, the Jujutsu Headquarters revokes Yuji Itadori’s suspended death sentence and appoints special-grade sorcerer Yuta Okkotsu as his executioner. <br><br> Newly awakened modern sorcerers and resurrected ancient ones,  now fighting as players in the Culling Game, collide with conflicting motives, driving the world once more toward an age ruled by jujutsu.<br><br> (Source: TOHO Animation)",JP,True,#呪術廻戦 #死滅回游,https://s4.anilist.co/file/anilistcdn/media/anime/cover/medium/bx172463-pNl29lVrhwZ2.jpg,#a14328,,youtube,ruX3rIj3--w,Yuuji Itadori;Megumi Fushiguro;Yuuta Okkotsu;Chousou;Yuki Tsukumo,Gege Akutami (Original Creator);Shouta Goshozono (Director );Yousuke Takada (Assistant Director);Takeru Satou (Assistant Director);Hiroshi Seko (Series Composition),Twitter;Official Site;Twitter;Crunchyroll,False,Jujutsu Kaisen 3rd Season;呪術廻戦 第3期;JJK3,https://anilist.co/anime/172463,1767328149,1767885960,1,2026-01-02T04:32:20.671582+00:00,anilist
182255,59978.0,Sousou no Frieren 2nd Season,Frieren: Beyond Journey’s End Season 2,葬送のフリーレン 第２期,Sousou no Frieren 2nd Season,TV,,,NOT_YET_RELEASED,MANGA,WINTER 2026,2026,Toho;MADHOUSE,MADHOUSE,Adventure;Drama;Fantasy,Medieval;Travel;Elf;Female Protagonist;Iyashikei;Magic;Philosophy;Found Family;Shounen;Episodic,,,,0,0,88363,0,88363,1259,5754,673,481,79,81376,2026-01-16,,,,The second season of <i>Sousou no Frieren</i>.,JP,True,#フリーレン2期 #フリーレン #frieren,https://s4.anilist.co/file/anilistcdn/media/anime/cover/medium/bx182255-butzrqd4I0aC.jpg,#5dc9f1,https://s4.anilist.co/file/anilistcdn/media/anime/banner/182255-eGmzBcmadFsK.jpg,youtube,EOMVXqH9DSg,Frieren;Fern;Stark;Heiter;Himmel,Kanehito Yamada (Original Story);Tsukasa Abe (Original Character Design);Tomoya Kitagawa (Director);Daiki Harashina (Assistant Director);Keiichirou Saitou (Direction Assistance),Official Site;TikTok;Twitter;Crunchyroll,False,,https://anilist.co/anime/182255,1767328180,1768572000,1,2026-01-02T04:32:20.671608+00:00,anilist
166613,55825.0,Jigokuraku 2nd Season,Hell’s Paradise Season 2,地獄楽 第二期,Jigokuraku 2nd Season,TV,,,NOT_YET_RELEASED,MANGA,WINTER 2026,2026,MAPPA;Twin Engine,MAPPA,Action;Adventure;Mystery;Supernatural,Ninja;Body Horror;Gore;Samurai;Survival;Ensemble Cast;Shounen;Amnesia;Swordplay;Super Power,,,,0,0,73701,0,73701,762,5317,456,557,104,67267,2026-01-11,,,,The second season of <i>Jigokuraku</i>.,JP,True,#地獄楽アニメ,https://s4.anilist.co/file/anilistcdn/media/anime/cover/medium/bx166613-uHB8q3D4qbon.jpg,#e49328,https://s4.anilist.co/file/anilistcdn/media/anime/banner/166613-drS86exJlIjG.jpg,youtube,JLe_NUnAZVs,Gabimaru;Sagiri;Touma;Nurugai;Gantetsusai Tamiya,Yuuji Kaku (Original Creator);Kaori Makita (Director);Akira Kindaichi (Series Composition);Kouji Hisaki (Character Design);Junichi Higashi (Art Director),Official Site;Twitter;Instagram;TikTok;Crunchyroll,False,Hell’s Paradise: Jigokuraku Season 2;สุขาวดีอเวจี;Адский рай,https://anilist.co/anime/166613,1767328178,1768142640,1,2026-01-02T04:32:20.671636+00:00,anilist
182587,60058.0,[Oshi no Ko] 3rd Season,【OSHI NO KO】Season 3,【推しの子】第3期,[Oshi no Ko] 3rd Season,TV,,,NOT_YET_RELEASED,MANGA,WINTER 2026,2026,Shueisha;KADOKAWA;Doga Kobo,Doga Kobo,Drama;Mystery;Psychological;Supernatural,Idol;Acting;Revenge;Heterosexual;Anti-Hero;Twins;Male Protagonist;Female Protagonist;Tsundere;Urban Fantasy,,,,0,0,52577,0,52577,604,3248,238,310,126,48655,2026-01-14,,,,"The third season of <i>[Oshi no Ko]</i>. <br><br> The story enters a new stage. <br><br> It's been six months since ""POP IN 2"" was released. Thanks to MEM-Cho's hard work, B-Komachi is about to get their major break. Aqua is a multi-talented entertainer, and Akane's career as a talented actress is going smoothly. Meanwhile, Kana lost the cheerfulness she once had. To track down the truth behind Ai and Goro's deaths, Ruby keeps rising in the entertainment world... <br><br> Using lies as a weapon. <br><br> (Source: Crunchyroll) ",JP,True,#推しの子,https://s4.anilist.co/file/anilistcdn/media/anime/cover/medium/bx182587-fsU8LOjmd7oj.jpg,#e45df1,https://s4.anilist.co/file/anilistcdn/media/anime/banner/182587-SLNmuinewbUF.jpg,youtube,JGYY6Pui5Kc,Ruby Hoshino;Aquamarine Hoshino;Kana Arima;Akane Kurokawa;MEM-cho,Aka Akasaka (Original Story);Mengo Yokoyari (Original Character Design);Daisuke Hiramaki (Director);Jin Tanaka (Series Composition);Kanna Hirayama (Character Design),Twitter;Twitter;Official Site;Crunchyroll;YouTube,False,[OSHI NO KO] Season 3,https://anilist.co/anime/182587,1767328153,1768399200,1,2026-01-02T04:32:20.671666+00:00,anilist
179062,59229.0,Enen no Shouboutai: San no Shou Part 2,Fire Force Season 3 Part 2,炎炎ノ消防隊 参ノ章 第2クール,Enen no Shouboutai: San no Shou Part 2,TV,,,NOT_YET_RELEASED,MANGA,WINTER 2026,2026,Kodansha;bilibili;DMM music;DMM pictures;David Production,David Production,Action;Drama;Sci-Fi;Supernatural,Shounen;Male Protagonist;Primarily Adult Cast;Urban Fantasy;Nun;Demons;Firefighters;Gods;Religion;Urban,,,,0,0,37657,0,37657,385,3169,523,341,105,33519,2026-01-10,,,,"The second cour of <i>Enen no Shouboutai: San no Shou</i>.  As chaos spreads, Shinra and Company 8 fight to stop a final, world-ending blaze.  (Source: Crunchyroll News)",JP,True,#炎炎ノ消防隊,https://s4.anilist.co/file/anilistcdn/media/anime/cover/medium/bx179062-pbzYE1miZq61.png,#febb28,https://s4.anilist.co/file/anilistcdn/media/anime/banner/179062-ZnxW4uWEsV3H.jpg,youtube,voLZJvdwUEE,Shinra Kusakabe;Akitaru Oubi;Maki Oze;Takehisa Hinawa;Arthur Boyle,Atsushi Ookubo (Original Creator);Tatsuma Minamikawa (Director);Sei Tsuguta (Series Composition);Hideyuki Morioka (Character Design);Mika Yamamoto (Sub Character Design),Official Site;Twitter;Crunchyroll,False,Enen no Shouboutai 3rd Season Part 2;หน่วยผจญคนไฟลุก ภาค 3,https://anilist.co/anime/179062,1767328175,1767977580,1,2026-01-02T04:32:20.671693+00:00,anilist
133007,48820.0,Mahou Shoujo Madoka☆Magica: Walpurgis no Kaiten,Puella Magi Madoka Magica the Movie -Walpurgisnacht: Rising-,劇場版 魔法少女まどか☆マギカ〈ワルプルギスの廻天〉,Mahou Shoujo Madoka☆Magica: Walpurgis no Kaiten,MOVIE,1.0,,NOT_YET_RELEASED,ORIGINAL,WINTER 2026,2026,Shaft;Aniplex,Shaft,Mahou Shoujo,Magic;Female Protagonist;Primarily Female Cast;Philosophy;Witch;Super Power;Yuri;Urban Fantasy;Kuudere;Guns,,,,0,0,36289,205,36289,382,623,363,129,67,35107,2026-02-01,2026-02-01,,,"The 10th anniversary online event for the <i>Mahou Shoujo Madoka☆Magica</i> anime revealed that the franchise is getting a new anime film titled <i>Mahou Shoujo Madoka☆Magica: Walpurgis no Kaiten</i>. The film will be an official sequel to the <i>Mahou Shoujo Madoka☆Magica: Hangyaku no Monogatari</i> film that opened in October 2013. The tagline on the new film's visual reads, <i>""Now, let's continue the story.""</i><br><br> (Source: Anime News Network, edited)",JP,True,#魔法少女まどかマギカ,https://s4.anilist.co/file/anilistcdn/media/anime/cover/medium/bx133007-5gOUXDvzxy9S.jpg,#e4935d,https://s4.anilist.co/file/anilistcdn/media/anime/banner/133007-NkSVqsR7CTgT.jpg,youtube,B1YTdDt49lE,Madoka Kaname;Homura Akemi;Mami Tomoe;Sayaka Miki;Kyouko Sakura,Magica Quartet (Original Creator);Ume Aoki (Original Character Design);Akiyuki Shinbou (Chief Director);Yukihiro Miyamoto (Director);Junichirou Taniguchi (Character Design),Official Site;Twitter;Official Site;Twitter,False,Magical Girl Madoka Magica Movie 4;Puella Magi Madoka Magica Movie 4,https://anilist.co/anime/133007,1767328203,0,0,2026-01-02T04:32:20.671721+00:00,anilist
166617,55830.0,Fate/strange Fake,Fate/strange Fake,Fate/strange Fake,Fate/strange Fake,TV,,25.0,NOT_YET_RELEASED,LIGHT_NOVEL,WINTER 2026,2026,Aniplex;A-1 Pictures;BS11;Contents Seed;Notes;TOKYO MX,A-1 Pictures,Action;Adventure;Fantasy;Mystery;Supernatural,Conspiracy;Magic;Urban Fantasy;Battle Royale;Urban;Foreign;Ensemble Cast;Police;Swordplay;Religion,,,,0,0,33873,0,33873,404,7144,636,1588,141,24364,2026-01-03,,,,"In a Holy Grail War, Mages (Masters) and their Heroic Spirits (Servants) fight for the control of the Holy Grail—an omnipotent wish-granting device said to fulfill any desire. Years have passed since the end of the Fifth Holy Grail War in Japan. Now, signs portend the emergence of a new Holy Grail in the western American city of Snowfield. Sure enough, Masters and Servants begin to gather... <br><br>  A missing Servant class...<br> Impossible Servant summonings...<br> A nation shrouded in secrecy...<br> And a city created as a battleground.<br> <br> In the face of such irregularities, the Holy Grail War is twisted and driven into the depth of madness. Let the curtain rise on a masquerade of humans and heroes, made to dance upon the stage of a false Holy Grail. <i>This is a Holy Grail War covered in lies.</i> <br><br> (Source: Official Site, Aniplex USA, edited) <br><br> <i>Notes:</i><br> •  <i>Special premiere of Episode 1 in its English Dub occurred in Los Angeles at the Fate 20th Ann",JP,True,#strangefake,https://s4.anilist.co/file/anilistcdn/media/anime/cover/medium/bx166617-34fpC9y47tTx.png,#1a1af1,https://s4.anilist.co/file/anilistcdn/media/anime/banner/166617-P4w3p0H4lE1O.jpg,youtube,k1G8EvZg_BY,Ayaka Sajyou;Richard I;Gilgamesh;Enkidu;Wolf,Type-Moon (Original Story);Ryougo Narita (Original Story);Shizuki Morii (Original Character Design);Mineji Sakamoto (Original Character Design Assistance);Shun Enokido (Director),Official Site;Twitter;Twitter;Official Site;Facebook;Crunchyroll,False,Судьба/Странная подделка,https://anilist.co/anime/166617,1767328189,1767450600,1,2026-01-02T04:32:20.671752+00:00,anilist
190327,61469.0,JoJo no Kimyou na Bouken: Steel Ball Run,STEEL BALL RUN JoJo's Bizarre Adventure,ジョジョの奇妙な冒険 スティール・ボール・ラン,JoJo no Kimyou na Bouken: Steel Ball Run,ONA,,,NOT_YET_RELEASED,MANGA,WINTER 2026,2026,Warner Bros. Japan;David Production,David Production,Action;Adventure;Drama;Mystery;Supernatural,Travel;Super Power;Seinen;Cowboys;Historical;Male Protagonist;Disability;Foreign;Conspiracy;Primarily Adult Cast,,,,0,0,32740,0,32740,840,880,124,134,54,31548,2026-03-19,,,,"The seventh story arc of the long-running <i>JoJo's Bizarre Adventure</i> series.<br><br>  It’s 1890, in America, the Steel Ball Run — the first horse racing championship across the North American continent — was about to begin. Spanning around 4,000 miles, the race offered 50 million dollars as the winning prize. <br><br> Johnny Joestar, once being hailed as a genius jockey, is now paralysed and lost in despair. <br><br> He finds hope in the mysterious phenomena caused by Gyro Zeppeli, an outlaw aiming to win the race, and determines to participate in the Steel Ball Run Race.<br><br>  Each having their own goal in mind, the two form an alliance and set foot upon the gruelling adventure and race.<br><br>  (Source: STEEL BALL RUN: JoJo no Kimyou na Bouken Site)<br><br>  <i>Note: The first episode aired with a runtime of 47 minutes.</i>",JP,True,#jojo_anime,https://s4.anilist.co/file/anilistcdn/media/anime/cover/medium/bx190327-fIfMy1LTkdGP.jpg,#5daee4,https://s4.anilist.co/file/anilistcdn/media/anime/banner/190327-bXr8tFZUdxOw.jpg,youtube,b51C8AbRDGU,Gyro Zeppeli;Johnny Joestar;Diego Brando;Lucy Steel;Steven Steel,Hirohiko Araki (Original Creator);Yasuhiro Kimura (Director);Hideya Takahashi (Director);Toshiyuki Katou (Chief Director);Yasuko Kobayashi (Series Composition),Official Site;Twitter;Instagram;Netflix,False,JoJo's Bizarre Adventure: Part 7–Steel Ball Run;SBR,https://anilist.co/anime/190327,1767328223,1773903600,1,2026-01-02T04:32:20.671779+00:00,anilist
167152,56009.0,Yuusha Kei ni Shosu: Choubatsu Yuusha 9004-tai Keimu Kiroku,Sentenced to Be a Hero,勇者刑に処す　懲罰勇者9004隊刑務記録,Yuusha Kei ni Shosu: Choubatsu Yuusha 9004-tai Keimu Kiroku,TV,12.0,,NOT_YET_RELEASED,LIGHT_NOVEL,WINTER 2026,2026,Studio KAI;KADOKAWA,Studio KAI,Action;Comedy;Drama;Fantasy,Male Protagonist;Gods;Crime;Demons;Prison,,,,0,0,26239,0,26239,252,3026,16,156,23,23018,2026-01-03,2026-03-26,,,"""Hero"" is the worst punishment in the world. <br><br> For those convicted of heinous crimes, they are sentenced to become a “Hero"" and forced to enter the mandatory military service in the war against the Demon Lords. These convicts are not even allowed to die—if killed, they will be resurrected to fight another day. <br><br> Hero Xylo Forbartz, former head of the Order of the Holy Knights, leads a penal unit of deplorables fighting on the front lines. It’s in these direst of circumstances that he meets Teoritta, one of the world’s the strongest weapons. <br><br> <i>""When every last enemy has been defeated, you are to shower me with praise and pat my head.""</i> <br><br> In order to survive and to take revenge on those who wronged him, he makes a pact with the goddess and launches headfirst into a maelstrom of war and intrigue.<br><br>  (Source: KADOKAWA Anime) <br><br> <i>Note: Initially scheduled to air in October, 2025 </i>",JP,True,#勇者刑 #勇者刑に処す #yushakei,https://s4.anilist.co/file/anilistcdn/media/anime/cover/medium/bx167152-u0cBZkqDowHP.jpg,#f1935d,https://s4.anilist.co/file/anilistcdn/media/anime/banner/167152-6QxZG8Dmf1EL.jpg,youtube,GcRs1JC7xeg,Xylo Forbartz;Teoritta;Venetim Leopool;Patausche Kivia;Dotta Luzulas,Rocket  Shoukai (Original Story);Hitomi Shizuki (Original Illustration);Hiroyuki Takashima (Director);Yoshiki Nakakouji (Assistant Director);Kenta Ihara (Series Composition),Twitter;Official Site;Crunchyroll;iQ;Bilibili TV;YouTube,False,,https://anilist.co/anime/167152,1767328202,1767445200,1,2026-01-02T04:32:20.671808+00:00,anilist
182206,59971.0,Tensei Shitara Slime Datta Ken - Soukai no Namida-hen,That Time I Got Reincarnated as a Slime the Movie: Tears of the Azure Sea,劇場版 転生したらスライムだった件 蒼海の涙編,Tensei Shitara Slime Datta Ken - Soukai no Namida-hen,MOVIE,1.0,,NOT_YET_RELEASED,ORIGINAL,WINTER 2026,2026,8-bit;Bandai Namco Pictures,8-bit,Action;Adventure;Comedy;Fantasy,Agender;Isekai;Medieval;Demons;Male Protagonist;Shounen;Femboy,,,,0,0,25196,285,25196,254,1236,167,247,60,23486,2026-02-27,2026-02-27,,,"The second movie in the <i>Tensei Shitara Slime Datta Ken</i> series.<br><br> After concluding the opening ceremony of the Demon Kingdom Federation Tempest, Rimuru and his companions are invited by the Celestial Emperor Hermesia of the great elven nation – the Magi Dynasty Salion – to visit her private resort island. As the group enjoys their brief vacation, a mysterious woman named Yura appears. A new incident unfolds against the backdrop of the boundless azure sea.<br><br>  (Source: Crunchyroll)<br><br> <i>Note: Relations are provisional and subject to change.</i>",JP,True,#転スラ #tensura,https://s4.anilist.co/file/anilistcdn/media/anime/cover/medium/bx182206-LcitQfDLsdnC.png,#35a1e4,,youtube,gB-_X8aPQzU,Rimuru Tempest;Shion;Veldora Tempest;Ranga;Milim Nava,Fuse (Original Story);Taiki Kawakami (Original Story);Mitz Vah (Original Character Design);Hitoshi Fujima (Music);Takahiro Kishida (Monster Design),Twitter;Official Site,False,Tensura Movie 2;That Time I Got Reincarnated as a Slime the Movie: Tears of the Blue Sea,https://anilist.co/anime/182206,1767328241,1772118000,1,2026-01-02T04:32:20.671836+00:00,anilist
176276,58505.0,Mato Seihei no Slave 2,Chained Soldier Season 2,魔都精兵のスレイブ2,Mato Seihei no Slave 2,TV,,,NOT_YET_RELEASED,MANGA,WINTER 2026,2026,Pony Canyon;Passione;Hayabusa Film,Passione;Hayabusa Film,Action;Adventure;Drama;Ecchi;Fantasy;Romance,Slavery;Female Harem;Heterosexual;Super Power;Male Protagonist;Shounen;Femdom;Primarily Female Cast;Urban Fantasy;Isekai,,,,0,0,19836,0,19836,295,1614,58,186,73,17905,2026-01-08,,,,The second season of <i>Mato Seihei no Slave.</i>,JP,True,#魔都精兵のスレイブ #まとスレ,https://s4.anilist.co/file/anilistcdn/media/anime/cover/medium/bx176276-rtF8mYd2OWw2.png,#f1505d,,youtube,IDgkCjcNxtU,Yuuki Wakura;Tenka Izumo;Kyouka Uzen;Shushu Suruga;Aoba Wakura,Takahiro (Original Story);Youhei Takemura (Original Character Design);Masafumi Tamura (Director);Yasuhiro Nakanishi (Series Composition);Keiya Nakano (Character Design),Official Site;Twitter;HIDIVE,False,Mabotai 2;魔都精兵のスレイブ 第２期;Mato Seihei no Slave 2nd Season,https://anilist.co/anime/176276,1767328208,1767880800,1,2026-01-02T04:32:20.671863+00:00,anilist
182317,59985.0,Boku no Kokoro no Yabai Yatsu Movie,,僕の心のヤバイやつ 劇場版,Boku no Kokoro no Yabai Yatsu Movie,MOVIE,1.0,,NOT_YET_RELEASED,MANGA,WINTER 2026,2026,Shin-Ei Animation;TV Asahi,Shin-Ei Animation,Comedy;Romance;Slice of Life,Heterosexual;Coming of Age;School;Female Protagonist;Male Protagonist;Primarily Teen Cast;Tsundere;Food;Shounen;Chuunibyou,,,,0,0,17400,0,17400,221,662,96,141,54,16447,2026-02-13,2026-02-13,,,A re-edit of both anime seasons featuring newly added footage and will depict the story of Ichikawa and Yamada after the events of the TV series.,JP,True,#僕ヤバ,https://s4.anilist.co/file/anilistcdn/media/anime/cover/medium/bx182317-zzpOnAECrM2o.png,#ae5de4,,youtube,uBugJy4ao2A,Anna Yamada;Kyoutarou Ichikawa,Norio Sakurai (Original Creator);Hiroaki Akagi (Chief Director);Chen Dali (Director);Masato Katsumata (Character Design);Masaki Mayuzumi (Art Director),Official Site;Twitter;TikTok,False,The Dangers in My Heart The Movie;BokuYaba,https://anilist.co/anime/182317,1767328186,1770908400,1,2026-01-02T04:32:20.671888+00:00,anilist
163144,54863.0,TRIGUN STARGAZE,TRIGUN STARGAZE,TRIGUN STARGAZE,TRIGUN STARGAZE,TV,,,NOT_YET_RELEASED,MANGA,WINTER 2026,2026,Toho;Orange,Orange,Action;Comedy;Drama;Sci-Fi,Dystopian;Full CGI;CGI;Shounen;Desert;Steampunk;Male Protagonist,,,,0,0,17265,0,17265,139,1132,71,88,56,15918,2026-01-10,,,,Sequel season to <i>TRIGUN STAMPEDE</i>.,JP,True,#TRIGUN #TRIGUNSTARGAZE,https://s4.anilist.co/file/anilistcdn/media/anime/cover/medium/bx163144-XdVwFRxPGY6j.jpg,#e4bb50,,youtube,JBYLkW--zmI,Vash the Stampede;Meryl Stryfe;Milly Thompson;Nicholas D. Wolfwood;Legato Bluesummers,Yasuhiro Nightow (Original Creator);OxyTakehiko (Original Story);Masako Satou (Director);Kazuyuki Fudeyasu (Series Composition);Kiyotaka Oshiyama (Character Design),Official Site;Twitter;Crunchyroll,False,トライガン スタンピード 完結編;TRIGUN STAMPEDE: Kanketsu-hen,https://anilist.co/anime/163144,1767328186,1768053600,1,2026-01-02T04:32:20.671914+00:00,anilist
