anime_id,title,english_title,japanese_title,type,episodes,duration,status,source,season,studios,producers,genres,rating,score,scored_by,rank,popularity,members,favorites,watching,completed,on_hold,dropped,plan_to_watch,start_date,end_date,broadcast_day,broadcast_time,synopsis,trailer_url,image_url,approved,explicit_genres,themes,demographics
1535,Death Note,Death Note,デスノート,TV,37.0,23,Finished Airing,Manga,fall 2006,Madhouse,VAP;Nippon Television Network;Shueisha;D.N. Dream Partners,Supernatural;Suspense,R - 17+ (violence & profanity),8.62,2978536.0,97.0,2,0,184750,0,0,0,0,0,2006-10-04,2007-06-27,Wednesdays,00:56,"Brutal murders, petty thefts, and senseless violence pollute the human world. In contrast, the realm of death gods is a humdrum, unchanging gambling den. The ingenious 17-year-old Japanese student Light Yagami and sadistic god of death Ryuk share one belief: their worlds are rotten.  For his own amusement, Ryuk drops his Death Note into the human world. Light stumbles upon it, deeming the first of its rules ridiculous: the human whose name is written in this note shall die. However, the temptation is too great, and Light experiments by writing a felon's name, which disturbingly enacts his first murder.  Aware of the terrifying godlike power that has fallen into his hands, Light—under the alias Kira—follows his wicked sense of justice with the ultimate goal of cleansing the world of all evil-doers. The meticulous mastermind detective L is already on his trail, but as Light's brilliance rivals L's, the grand chase for Kira turns into an intense battle of wits that can only end when one of them is dead.  [Written by MAL Rewrite]",,https://myanimelist.net/images/anime/1079/138100l.jpg,True,,Psychological,Shounen
1575,Code Geass: Hangyaku no Lelouch,Code Geass: Lelouch of the Rebellion,コードギアス 反逆のルルーシュ,TV,25.0,24,Finished Airing,Original,fall 2006,Sunrise,Bandai Visual;Mainichi Broadcasting System;Bandai;Sony Music Entertainment;Bandai Namco Entertainment;Hakuhodo DY Media Partners,Award Winning;Drama;Sci-Fi,R - 17+ (violence & profanity),8.71,1510524.0,58.0,22,0,116448,0,0,0,0,0,2006-10-06,2007-07-29,Fridays,01:25,"In the year 2010, the Holy Empire of Britannia is establishing itself as a dominant military nation, starting with the conquest of Japan. Renamed to Area 11 after its swift defeat, Japan has seen significant resistance against these tyrants in an attempt to regain independence.  Lelouch Lamperouge, a Britannian student, unfortunately finds himself caught in a crossfire between the Britannian and the Area 11 rebel armed forces. He is able to escape, however, thanks to the timely appearance of a mysterious girl named C.C., who bestows upon him Geass, the ""Power of Kings."" Realizing the vast potential of his newfound ""power of absolute obedience,"" Lelouch embarks upon a perilous journey as the masked vigilante known as Zero, leading a merciless onslaught against Britannia in order to get revenge once and for all.  [Written by MAL Rewrite]",,https://myanimelist.net/images/anime/1032/135088l.jpg,True,,Mecha;Military;School;Super Power,
1482,D.Gray-man,D.Gray-man,ディー・グレイマン,TV,103.0,23,Finished Airing,Manga,fall 2006,TMS Entertainment,TV Tokyo;Aniplex;Dentsu;Half H.P Studio;Sony Music Entertainment,Action;Adventure;Fantasy,PG-13 - Teens 13 or older,8.0,296530.0,723.0,318,0,13902,0,0,0,0,0,2006-10-03,2008-09-30,Tuesdays,18:00,"Losing a loved one is so painful that one may sometimes wish to be able to resurrect them—a weakness that the enigmatic Millennium Earl exploits. To make his mechanical weapons known as ""Akuma,"" he uses the souls of the dead that are called back. Once a soul is placed in an Akuma, it is trapped forever, and the only way to save them is to exorcise them from their vessel using the Anti-Akuma weapon, ""Innocence.""   After spending three years as the disciple of General Cross, Allen Walker is sent to the Black Order—an organization comprised of those willing to fight Akuma and the Millennium Earl—to become an official Exorcist. With an arm as his Innocence and a cursed eye that can see the suffering souls within an Akuma, it's up to Allen and his fellow Exorcists to stop the Millennium Earl's ultimate plot: one that can lead to the destruction of the world.  [Written by MAL Rewrite]",,https://myanimelist.net/images/anime/13/75194l.jpg,True,,Urban Fantasy,Shounen
1943,Paprika,Paprika,パプリカ,Movie,1.0,1,Finished Airing,Novel,None None,Madhouse,Sony Pictures Entertainment;Chaos Union,Avant Garde;Award Winning;Mystery;Sci-Fi;Suspense,R+ - Mild Nudity,8.04,304660.0,667.0,408,605942,5455,12695,391848,4725,2364,194310,2006-11-25,,,,"The world of dreams can be an incredible window into the psyche, showing one's deepest desires, aspirations, and repressed memories. One hopeful tech lab has been developing the ""DC Mini,"" a device with the power to delve into the dreams of others. Atsuko Chiba and Kosaku Tokita have been tirelessly working to develop this technology with the hopes of using it to deeply explore patients' minds and help cure them of their psychological disorders.  However, having access to the deepest corners of a person's mind comes with a tremendous responsibility. In the wrong hands, the DC Mini could be used as a form of psychological terrorism and cause mental breakdowns in the minds of targets. When this technology is stolen and people around them start acting strangely, Atsuko and Kosaku know they have a serious problem on their hands. Enlisting the help of Officer Konakawa, who has been receiving this experimental therapy, they search both the real and dream worlds for their mental terrorist.  [Written by MAL Rewrite]",,https://myanimelist.net/images/anime/1929/93629l.jpg,True,,Adult Cast;Psychological,
1604,Katekyou Hitman Reborn!,Reborn!,家庭教師ヒットマンREBORN!,TV,203.0,24,Finished Airing,Manga,fall 2006,Artland,TV Tokyo;Dentsu;Marvelous Entertainment;Pony Canyon;d-rights,Action;Comedy,PG-13 - Teens 13 or older,8.12,269387.0,531.0,428,0,16291,0,0,0,0,0,2006-10-07,2010-09-25,Saturdays,10:30,"There is no putting it lightly—Tsunayoshi Sawada is just no good. He is clumsy, talentless, and desperately in love with the school idol Kyouko Sasagawa, a girl so completely out of his league. Dubbed ""Loser Tsuna"" by his classmates, he seems to be the very personification of failure in the guise of a middle-schooler.  Tsuna's boring life takes an extraordinary twist when he encounters the mysterious Reborn, who happens to be a hitman... and shockingly, a baby! Sent from the strongest Mafia family in Italy, Reborn is assigned the daunting mission of preparing the dull middle schooler to succeed the ninth boss of the notorious Vongola family, who is on the brink of retirement. The dull boy has a grueling road ahead, but with the help of his new criminal affiliates and his peculiar home tutor, perhaps even Loser Tsuna can achieve greatness.  [Written by MAL Rewrite]",,https://myanimelist.net/images/anime/1531/142751l.jpg,True,,Organized Crime;Super Power,Shounen
1519,Black Lagoon: The Second Barrage,Black Lagoon: The Second Barrage,BLACK LAGOON The Second Barrage,TV,12.0,23,Finished Airing,Manga,fall 2006,Madhouse,Geneon Entertainment;Arts Pro,Action,R - 17+ (violence & profanity),8.17,339910.0,481.0,434,571390,3357,15744,450929,8636,4419,91662,2006-10-03,2006-12-19,Tuesdays,01:59,"Rokurou ""Rock"" Okajima has joined the Lagoon Company, a pirate mercenary group which operates out of Roanapur, Thailand. Despite his initial protests, this filthy slum of depraved souls and merciless criminals now serves as the former salaryman's home. Stranded, with nothing left of his past life but the clothes on his back and his inner morality, Rock is forced to perform jobs alongside the other members of the Lagoon crew. Berated for his lack of spine as he wades through the underbelly of society, he must decide whether to continue on amidst the gunfire and ruthlessness or risk everything he has in an attempt to be free. Whether he chooses the comfort of a familiar land or the freedom of being an outlaw, his decision will have lasting consequences on the crew who gave him a home.  [Written by MAL Rewrite]",,https://myanimelist.net/images/anime/1701/152849l.jpg,True,,Adult Cast;Organized Crime,Seinen
1559,Shijou Saikyou no Deshi Kenichi,KenIchi: The Mightiest Disciple,史上最強の弟子 ケンイチ,TV,50.0,24,Finished Airing,Manga,fall 2006,TMS Entertainment,TV Tokyo;Tokyo Movie Shinsha;Shogakukan,Action;Comedy,PG-13 - Teens 13 or older,8.03,165007.0,675.0,864,322710,3722,19314,212693,10379,9325,70999,2006-10-08,2007-09-30,Sundays,00:55,"Whenever he is not getting pummeled in the karate club after school, high schooler Kenichi Shirahama can be found with his head buried in one of the many self-help books he carries with him every day. One day, on the way to school, Kenichi accidentally frightens the new student in his class, leading her to throw him down onto the ground. After apologizing for her violent reflexes, she introduces herself as Miu Furinji and asks Kenichi to be her friend.  Later that day, after karate club practice, Kenichi is given an ultimatum by one of the other club members: they will fight next week and the loser has to quit the club permanently. While lamenting his imminent defeat in the upcoming fight, Kenichi witnesses Miu fend off three thugs easily. Fed up with being perpetually bullied by those more powerful than him, he asks Miu for tips on how to become a better fighter. She directs Kenichi to her grandfather's dojo, Ryouzanpaku, where several skilled—albeit strange—masters of extreme martial arts have gathered to hone their abilities. Miu promises that Kenichi will become significantly stronger, but only if he manages to stay alive.  With those ominous words looming in his mind and the appearance of a criminal martial arts gang known as ""Ragnarok"" threatening the safety of those around him, Kenichi takes the first step on his journey to become a world-class fighter and a defender of the defenseless.  [Written by MAL Rewrite]",,https://myanimelist.net/images/anime/9/75515l.jpg,True,,Martial Arts;School,Shounen
1686,Bleach Movie 1: Memories of Nobody,Bleach the Movie: Memories of Nobody,劇場版 BLEACH MEMORIES OF NOBODY,Movie,1.0,1,Finished Airing,Manga,None None,Studio Pierrot,TV Tokyo;Dentsu;Shueisha,Action;Adventure;Supernatural,PG-13 - Teens 13 or older,7.44,183139.0,2332.0,921,0,685,0,0,0,0,0,2006-12-16,,,,"When a life ends, its soul departs to its final resting place known as the Soul Society. However, if a soul is left to wander in the human world for too long, it ends up turning into a corrupted ""Hollow"" that feeds on other souls. In such cases, spirits called ""Soul Reapers"" are needed to eliminate the Hollows and guide the lost souls to the Soul Society.  Ichigo Kurosaki and Rukia Kuchiki are two Soul Reapers who are used to dealing with Hollows that appear in Karakura Town. But when they encounter the hostile ""Blanks""—souls devoid of memories and immune to the ""soul burial"" used by Reapers—they are thrown for a loop. Senna, a fellow Reaper that neither Ichigo or Rukia are familiar with, comes to their rescue and manages to fend off the Blanks. The mystery deepens when a mirage of the human world suddenly appears over Soul Society. What could be the reason behind the strange phenomena, and how is it connected to Senna, who avoids any questions about her identity?  [Written by MAL Rewrite]",,https://myanimelist.net/images/anime/1834/134488l.jpg,True,,,Shounen
1530,Kanon (2006),Kanon,カノン (2006),TV,24.0,24,Finished Airing,Visual novel,fall 2006,Kyoto Animation,Pony Canyon;TBS;Movic,Drama;Romance;Supernatural,PG-13 - Teens 13 or older,7.94,142401.0,800.0,954,289457,4515,10532,177660,8331,7642,85292,2006-10-06,2007-03-16,Fridays,01:00,"As a young child, Aizawa Yuuichi had often visited his cousin in the city; however, something drastic happened to keep him away for seven long years. Now, Yuuichi returns, his memories of those days are simply gone.  Settling into the wintry town, Yuuichi comes across several young girls, all of whom are connected to his past. As he befriends them and continues to interact with them, the long forgotten memories from his childhood begin to resurface...  [Written by MAL Rewrite]",,https://myanimelist.net/images/anime/1362/128746l.jpg,True,,,
1571,Ghost Hunt,Ghost Hunt,ゴーストハント,TV,25.0,24,Finished Airing,Manga,fall 2006,J.C.Staff,TV Tokyo;Avex Entertainment;Marvelous Entertainment;Delfi Sound,Horror;Mystery;Supernatural,PG-13 - Teens 13 or older,7.74,104009.0,1272.0,1159,0,3121,0,0,0,0,0,2006-10-04,2007-03-28,Wednesdays,01:00,"While at school, Mai Taniyama and her friends like to exchange ghost stories. Apparently, there is an abandoned school building on their campus that is the center of many ghost stories. During the story, they are interrupted by a mysterious male figure. The person turns out to be Kazuya Shibuya, a 17-year-old who is president of the Shibuya Psychic Research Company. He was called by the principal to investigate the stories surrounding the abandoned school building.  The next day, on the way to school, Mai passes the school building in question. While examining a strange camera she spotted inside, she gets surprised by Kazuya's assistant. Unknowingly interfering with the investigation, Mai breaks the camera and Kazuya's assistant gets injured.  Kazuya forcefully hires Mai in order to pay for the camera and replace his injured assistant. From that point on, Mai begins to learn about the paranormal world and the profession of ghost hunting.  [Written by MAL Rewrite]",,https://myanimelist.net/images/anime/11/73908l.jpg,True,,,Shoujo
1536,Busou Renkin,Buso Renkin,武装錬金,TV,26.0,24,Finished Airing,Manga,fall 2006,Xebec,Yomiko Advertising;Shueisha;Imagine;Geneon Entertainment,Action;Supernatural,PG-13 - Teens 13 or older,7.28,82677.0,3120.0,1520,0,885,0,0,0,0,0,2006-10-05,2007-03-29,Thursdays,01:00,"Disguising themselves as humans, homunculi inhabit the world to prey on the unsuspecting population. Created long ago by alchemists from Europe, homunculi are difficult to eliminate without weapons known as Kurogane. Each Kurogane is uniquely shaped according to its wielder's instincts, taking the form of special abilities called Busou Renkin.  While walking home from school one day, Kazuki Mutou spots a defenseless girl under attack by a homunculus. But as he attempts to intervene, the girl ends up saving Kazuki’s life instead, shattering his ignorant worldview. The girl introduces herself as Tokiko Tsumura, and Kazuki soon learns that she has accidentally implanted a Kurogane inside of him. Now unintentionally dragged into the fight against homunculi, Kazuki must forgo his former life of leisure in order to protect the ones he holds dear.  [Written by MAL Rewrite]",,https://myanimelist.net/images/anime/6/75566l.jpg,True,,School,Shounen
1562,Yamato Nadeshiko Shichihenge♥,The Wallflower,ヤマトナデシコ七変化♥,TV,25.0,24,Finished Airing,Manga,fall 2006,Nippon Animation,,Comedy,PG-13 - Teens 13 or older,7.71,85058.0,1342.0,1588,0,2431,0,0,0,0,0,2006-10-04,2007-03-28,Wednesdays,01:30,"Ever since her crush rejected her by insulting her appearance, Sunako Nakahara has been a shut-in with a hatred for beauty, embracing all things morbid and occult-related. She is sent to live in her aunt's mansion which, to her dismay, she'll share with four exceedingly handsome boys her age. Furthermore, her flighty aunt has made a deal with these boys that in exchange for living there rent-free, they are to turn Sunako into a proper lady by the time she returns from a trip around the world.  Thus begins Sunako's hectic life with abrasive Kyohei Takano, ladies' man Ranmaru Morii, calm Takenaga Oda, and friendly Yukinojo Toyama. As she interacts with them she finds them less obnoxious, and she may not be as much of an outcast as she thought.  [Written by MAL Rewrite]",,https://myanimelist.net/images/anime/11/7701l.jpg,True,,Reverse Harem,Shoujo
1594,Jigoku Shoujo Futakomori,Hell Girl: Two Mirrors,地獄少女 二籠,TV,26.0,25,Finished Airing,Original,fall 2006,Studio Deen,Aniplex;SKY Perfect Well Think,Horror;Mystery;Supernatural;Suspense,R - 17+ (violence & profanity),7.87,71065.0,954.0,1590,0,696,0,0,0,0,0,2006-10-07,2007-04-07,Saturdays,19:30,"Ai Enma and her companions continue to offer their service of revenge against those who have wronged others, and the price is as steep as ever—for damning the offender to hell, the person exacting vengeance is sent to the abyss as well. As they cast soul after soul into the darkness, a new sinister force is watching them: a little girl named Kikuri.  While Ai continues her duties, she meets a boy named Takuma Kurebayashi, known as the ""Devil's Child"" because of the horrific events that occur around him. Unfortunately, Takuma's reputation leads the townspeople to use him as a scapegoat for those who have been ferried off to hell. When things quickly spiral out of control, Ai must find a way to bring an end to this senseless violence, as it poses a threat to her very existence.  [Written by MAL Rewrite]",,https://myanimelist.net/images/anime/5/86975l.jpg,True,,Psychological,
1565,Pokemon Diamond & Pearl,Pokémon: Diamond and Pearl,ポケットモンスター ダイヤモンド&パール,TV,191.0,23,Finished Airing,Game,fall 2006,OLM,TV Tokyo;SoftX;Nintendo;Shogakukan Productions,Action;Adventure;Comedy;Fantasy,PG - Children,7.32,98340.0,2924.0,1649,0,554,0,0,0,0,0,2006-09-28,2010-09-09,Thursdays,19:00,"Following the end of Satoshi's Hoenn journey, he travels to the Sinnoh region for his next adventure en route to becoming a Pokémon Master. Immediately upon arrival, Team Rocket makes another attempt to snatch Pikachu, only for it to fail once again. However, Pikachu has fallen deep into a forest and it's up to Satoshi to find him! Along the way, he reunites with Takeshi—a Pokémon breeder with whom he has traveled through many regions—and meets his soon-to-be rival, Shinji, a power-hungry trainer who cares little for his Pokémons' feelings.  Still in search for Pikachu, Satoshi notices a powerful electric attack in the distance and heads toward it to find Pikachu with Team Rocket and Hikari—a novice trainer aiming to be the top Pokémon coordinator. After foiling Team Rocket's plans, Satoshi reunites with Pikachu and Hikari joins the group. And thus, Satoshi and his friends begin their journey through the exciting land of Sinnoh.  [Written by MAL Rewrite]",,https://myanimelist.net/images/anime/1425/142699l.jpg,True,,,Kids
2154,Tekkon Kinkreet,Tekkonkinkreet,鉄コン筋クリート,Movie,1.0,1,Finished Airing,Manga,None None,Studio 4°C,Aniplex;Tokyo MX;Beyond C.,Action;Adventure;Award Winning;Supernatural;Suspense,R - 17+ (violence & profanity),7.93,47708.0,829.0,2047,0,1571,0,0,0,0,0,2006-12-23,,,,"The streets of Treasure Town are said to belong to ""The Cats."" They know everything that goes on in the city, and no one can stir up trouble without going through them first. In reality, The Cats are a pair of orphan boys called Black and White, who aren’t afraid of anything or anyone.   But their rule of the streets is challenged when the Yakuza come to town and start making changes. The wild Black and the carefree White have no one to rely on but themselves to get their Treasure Town back to the way it was. But their bond is tested as they quickly realize going back to how things were may no longer be an option.  [Written by MAL Rewrite]",,https://myanimelist.net/images/anime/12/8520l.jpg,True,,Psychological,Seinen
1606,Kekkaishi,Kekkaishi,結界師,TV,52.0,24,Finished Airing,Manga,fall 2006,Sunrise,Yomiuri Telecasting;Tohokushinsha Film Corporation;Zet,Action;Adventure;Supernatural,PG-13 - Teens 13 or older,7.59,52359.0,1733.0,2121,0,649,0,0,0,0,0,2006-10-16,2008-02-05,Mondays,19:00,"Yoshimura Sumimura comes from a long line of ""Kekkaishi,"" individuals who have supernatural abilities and are able to destroy evil creatures called Ayakashi that venture into the human realm from time to time. The Ayakashi are demons that look to feast on the power emanating from the land of Karasumori, which also happens to be where Yoshimura's high school is located. Now, Yoshimura must fight to protect his beloved school and hometown. Although, if it were up to him, he would rather be baking cakes than fighting off the ugly characters that show up at night.  Thankfully, Yoshimura isn't the only one helping to keep the baddies at bay. His childhood friend and neighbor, Tokine Yukimura, joins him in this righteous battle. Despite the fact that they are from rival clans, these two make a fantastic team. And teamwork is something vital to fighting the evil that is closing in, as the Ayakashi attack in waves, looking to claim the land as their own, and a shadowy organization looks on, ready to pounce when the time is right...",,https://myanimelist.net/images/anime/7/75191l.jpg,True,,Mythology,Shounen
1498,Black Blood Brothers,Black Blood Brothers,ブラック・ブラッド・ブラザーズ,TV,12.0,24,Finished Airing,Light novel,fall 2006,Group TAC;Studio Live,Toshiba Entertainment;Happinet Pictures;Omnibus Promotion,Action;Comedy;Fantasy,R - 17+ (violence & profanity),7.08,56965.0,4249.0,2242,0,412,0,0,0,0,0,2006-09-08,2006-11-24,Fridays,23:30,"Black Bloods and Red Bloods, vampires and humans. Despite their differences, these two races once fought together in a crusade against a formidable foe. A decade later, the vampire war hero Jirou Mochizuki, known as the ""Silver Blade,"" travels with his younger brother Kotarou to the Special Zone—a safe haven where vampires and humans live in harmony.  However, their journey is suddenly faced with danger when a conflict erupts between vampire migrants and human forces from the Special Zone. With the rise of a developing conspiracy from an old enemy, Jirou will need the help of his new ally, Mimiko ""Compromiser"" Katsuragi, as well as the power of his ancient bloodline to protect what he treasures the most.  [Written by MAL Rewrite]",,https://myanimelist.net/images/anime/5/13804l.jpg,True,,Urban Fantasy;Vampire,
1589,Bartender,Bartender,バーテンダー,TV,11.0,23,Finished Airing,Manga,fall 2006,Palm Studio,Pony Canyon;Fuji TV;Sony Music Entertainment;Fujipacific Music;Fuji Creative;Omnibus Promotion,Drama;Gourmet,PG-13 - Teens 13 or older,7.32,32199.0,2890.0,2258,0,545,0,0,0,0,0,2006-10-15,2006-12-31,Sundays,01:45,"Hidden in the backstreets of the Ginza district is Eden Hall, a lone bar operated by Ryuu Sasakura, the prodigy bartender who is said to mix the most incredible cocktails anyone has ever tasted. However, not just anyone can find Eden Hall; rather, it is Eden Hall that must find those who need it. Customers of varying backgrounds, each plagued with their own troubles, wander into this bar. Nevertheless, Ryuu always knows the ideal cocktail to console and guide each distraught soul.  [Written by MAL Rewrite]",,https://myanimelist.net/images/anime/13/67397l.jpg,True,,Adult Cast;Workplace,Seinen
1546,Negima!?,Negima!? Magister Negi Magi,ネギま!?,TV,26.0,23,Finished Airing,Manga,fall 2006,Shaft;GANSIS,TV Tokyo,Comedy;Fantasy;Romance,PG-13 - Teens 13 or older,6.92,38552.0,4986.0,2340,0,275,0,0,0,0,0,2006-10-04,2007-03-28,Wednesdays,17:30,"A remake of the Negima anime with its own original story.  Wizard Negi Springfield may be a boy, but he has a man-sized job to do! Fresh from the Academy of Magic, Negi continues his training as an instructor at Mahora Academy in Japan. But before he can get his Masters in magic, the 31 schoolgirls of Class 3-A are gonna keep him up all night cramming for a final exam in will power. Temptation aside, Negi has more on his syllabus than flirting and spells. Darkness is closing in, and Negi is gonna need help from his lovely student bodies to drive the ghouls from their school. These girls want to prove that they're the best in class, and extra credit is available to the cuties that aren't afraid of after-hours phantom fighting!  (Source: DVD case)",,https://myanimelist.net/images/anime/8/73997l.jpg,True,,Harem;School,Shounen
1579,Kiniro no Corda: Primo Passo,La corda d'oro: primo passo,金色のコルダ ～primo passo～,TV,25.0,24,Finished Airing,Visual novel,fall 2006,Yumeta Company,Aniplex;Hakusensha;Koei;TYO,Romance,PG-13 - Teens 13 or older,7.4,50414.0,2507.0,2346,0,868,0,0,0,0,0,2006-10-02,2007-03-26,Mondays,01:00,"Seiso Academy is a prestigious high school that sorts students into two majors: General Studies, characterized by distinct grey uniforms, and Music Studies, characterized by pristine white uniforms. While rushing to class one morning, General Studies student Kahoko Hino has a chance encounter with Lili, a small fairy searching for someone with the ability to see her. Lili flies away, and Kahoko, puzzled by their meeting, continues on her way.  Later that day, the participants of a school-wide music competition are announced, and all of them are, unsurprisingly, Music Studies students—at least until Kahoko's name is read out. Immediately tracking down Lili, the small fairy gifts Kahoko a magical violin and convinces her to participate in the competition.  Kiniro no Corda: Primo Passo follows Kahoko's endeavors alongside Lili, as the young student must now face the challenges of competition and go head-to-head against her competitors while navigating a new world of classical music.  [Written by MAL Rewrite]",,https://myanimelist.net/images/anime/1565/153275l.jpg,True,,Music;Reverse Harem;School,Josei
