anime_id,title,english_title,japanese_title,type,episodes,duration,status,source,season,studios,producers,genres,rating,score,scored_by,rank,popularity,members,favorites,watching,completed,on_hold,dropped,plan_to_watch,start_date,end_date,broadcast_day,broadcast_time,synopsis,trailer_url,image_url,approved,explicit_genres,themes,demographics
50360,Mushoku Tensei: Isekai Ittara Honki Dasu - Eris no Goblin Toubatsu,Mushoku Tensei: Jobless Reincarnation - Eris the Goblin Slayer,無職転生 ～異世界行ったら本気だす～ エリスのゴブリン討伐,Special,1.0,23,Finished Airing,Light novel,None None,Studio Bind,Frontier Works;TOHO animation;Hakuhodo DY Music & Pictures;BS11;Egg Firm;Kadokawa;GREE Entertainment,Adventure;Drama;Fantasy,R - 17+ (violence & profanity),7.79,115372.0,1140.0,1316,209941,637,4034,168089,793,563,36462,2022-03-16,,,,"During their stay in the capital of Milishion, the adventurers of Dead End decide to split up for a day to run their errands. While Rudeus Greyrat has his plans derailed by a troublesome scene, the party's swordswoman, Eris Boreas Greyrat, finds herself with nothing to do. Deciding to embark on an adventure to slay goblins, Eris crosses paths with a cocky but talented mage named Cliff Grimoire. Though Eris refuses his company, Cliff stubbornly ignores her wishes and dares her to explore the perilous forest surrounding the city. Accepting his challenge, Eris ventures into the forest with the mage, where the two encounter something far more repulsive than mere goblins.  [Written by MAL Rewrite]",,https://myanimelist.net/images/anime/1094/120148l.jpg,True,,Isekai;Reincarnation,
48997,Fantasy Bishoujo Juniku Ojisan to,Life with an Ordinary Guy who Reincarnated into a Total Fantasy Knockout,異世界美少女受肉おじさんと,TV,12.0,23,Finished Airing,Web manga,winter 2022,OLM,TV Tokyo;bilibili;Cygames;Bit grooove promotion;Bushiroad Move;Music Brains,Adventure;Comedy;Fantasy,PG-13 - Teens 13 or older,7.12,93584.0,4017.0,1340,205598,874,24103,116266,6433,12362,46434,2022-01-12,2022-03-30,Wednesdays,00:00,"Since their days as students, Tsukasa Jinguuji has had incredible luck with women due to his good looks; Hinata Tachibana has had almost none, overshadowed by Jinguuji's brilliance. However, while Jinguuji has never shown interest in the opposite sex, Tachibana is always desperate for a girlfriend. Despite their polar differences, they continue to be best friends even in their thirties as salarymen.   One night, the two are returning home from a mixer where Jinguuji was the center of attention as usual. In his drunken rambles, a frustrated Tachibana inadvertently wishes to become a beautiful girl with irresistible charm. As if the heavens were listening, a goddess suddenly shows herself before Jinguuji and Tachibana, transporting them to another world to defeat the Demon Lord and simultaneously granting Tachibana's desire.  Tachibana—now in the body of an impossibly perfect woman—has become so attractive that even Jinguuji is captivated. Moreover, Tachibana grows aware of Jinguuji's stunning appearance, finally understanding his popularity. Before they fall in love with each other, the duo must complete their mission or risk remaining prisoners to their infatuations forever.  [Written by MAL Rewrite]",,https://myanimelist.net/images/anime/1430/120065l.jpg,True,,Isekai;Magical Sex Shift;Parody,
49909,Kotarou wa Hitorigurashi,Kotaro Lives Alone,コタローは1人暮らし,ONA,10.0,26,Finished Airing,Manga,None None,LIDENFILMS,,Slice of Life,PG-13 - Teens 13 or older,8.15,108251.0,497.0,1363,0,2302,0,0,0,0,0,2022-03-10,,,,"One day, manga author Shin Karino is greeted by four-year-old Kotarou Satou, his new next-door neighbor, who gifts him a box of tissues. In Karino's eyes, Kotarou is an odd kid: he speaks in an extremely formal manner, and he lives alone in his apartment—no parents or relatives in sight. But Kotarou neither seems to mind, nor wants to rely on people.  Feeling sympathetic toward Kotarou's circumstances, Karino decides to follow Kotarou to a bathhouse in case something might happen to him and there he comes to understand the little boy is not so different from him. Little by little, Karino—along with the other residents of the apartment complex—grows fond of Kotarou and his antics. At the same time, Kotarou himself might have found something akin to a family in his unique neighbors.  [Written by MAL Rewrite]",,https://myanimelist.net/images/anime/1862/121020l.jpg,True,,Childcare,Seinen
44516,Koroshi Ai,Love of Kill,殺し愛,TV,12.0,23,Finished Airing,Manga,winter 2022,Platinum Vision,Toy's Factory;Crunchyroll;Kadokawa Media House;Kadokawa;Bit Promotion;Bit grooove promotion;A3,Action;Romance,R - 17+ (violence & profanity),6.9,71498.0,5118.0,1409,195107,1025,22149,86484,6383,14409,65682,2022-01-13,2022-03-31,Thursdays,00:00,"Novice bounty hunter Chateau Dankworth never expected to encounter someone capable of overpowering her in combat. Even less so that the mysterious man would take an immediate interest in her—to the point of aiding her missions. However, Chateau makes it clear that she has no plans of entertaining any personal involvement with him.  Chateau's company is soon tasked with eliminating Song Ryang-ha—an expert assassin and a former member of a powerful Asian organization. Coincidentally, Ryang-ha is the man that has been pursuing her. Despite his background, Chateau reluctantly agrees to meet with Ryang-ha as part of a deal: in exchange for going out with him, he will provide her with the locations of current targets, dead or alive.  But when the past begins to haunt both killers, their arrangement may need to come to an end, as their entanglement puts their lives at grave risk.  [Written by MAL Rewrite]",,https://myanimelist.net/images/anime/1485/119329l.jpg,True,,Adult Cast;Organized Crime,Josei
48239,Leadale no Daichi nite,In the Land of Leadale,リアデイルの大地にて,TV,12.0,23,Finished Airing,Light novel,winter 2022,Maho Film,Lantis;Crunchyroll;Kadokawa Media House;Sun TV;Kadokawa;Bandai Namco Arts;Simplicity,Adventure;Fantasy,PG-13 - Teens 13 or older,6.95,92093.0,4838.0,1464,186667,984,18214,123292,3205,8108,33848,2022-01-05,2022-03-23,Wednesdays,23:30,"The previously bedridden Keina Kagami finds herself in the world of her favorite VRMMORPG—titled Leadale—after the life support keeping her alive fails. Reincarnated in the body of her high-level character, ""Cayna,"" she notices that the world of Leadale is different from what she remembers playing.  As she comes to learn, two hundred years have passed since she last interacted with the world. However, this does not sadden Cayna—as it means that a new journey awaits her, filled with exciting prospects and unfamiliar faces all waiting to be discovered.  [Written by MAL Rewrite]",,https://myanimelist.net/images/anime/1099/122005l.jpg,True,,Isekai;Reincarnation,
42072,Kenja no Deshi wo Nanoru Kenja,She Professed Herself Pupil of the Wise Man,賢者の弟子を名乗る賢者,TV,12.0,23,Finished Airing,Light novel,winter 2022,Studio A-CAT,DAX Production;MAGES.;Kadokawa;Micro Magazine Publishing;MAGNET;Micro House,Adventure;Fantasy,PG-13 - Teens 13 or older,6.33,58471.0,8575.0,1829,0,655,0,0,0,0,0,2022-01-12,2022-03-30,Wednesdays,00:30,"With a dignified veteran's body and a long white beard, summoner mage Dunbalf was one of the strongest player characters in the virtual reality online multiplayer roleplaying game Ark Earth Online, even heralded as a one-man army. Together with the ""Nine Wise Mages"" and King Solomon, they formed the mage player Kingdom of Alcait. But one day, Dunbalf and the other Nine Wise Mages suddenly go missing, leaving no trace behind.  In an effort to spend his expiring credits, Dunbalf had purchased a cosmetic kit and tinkered with his character; however, he accidentally fell asleep during the customization process. Upon waking up, Dunbalf not only notices that the world of Ark Earth Online has become more realistic, but also discovers that he has turned into a cute girl! After reaching Alcait, he learns it has been 30 years since he supposedly disappeared.  Now tasked with finding the other missing mages by King Solomon, the avid role player proclaims his new identity as Mira—the Pupil of the Wise Man Dunbalf—and ventures forth to prove his legacy.  [Written by MAL Rewrite]",,https://myanimelist.net/images/anime/1583/119223l.jpg,True,,Isekai;Magical Sex Shift,
42670,Princess Connect! Re:Dive Season 2,,プリンセスコネクト! Re:Dive Season 2,TV,12.0,23,Finished Airing,Game,winter 2022,CygamesPictures,WOWOW;Nippon Columbia;Tokyo MX;BS11;Cygames,Adventure;Comedy;Fantasy;Gourmet,PG-13 - Teens 13 or older,7.72,52335.0,1323.0,1839,141049,828,14088,66233,4495,4647,51586,2022-01-11,2022-03-29,Tuesdays,00:00,"The members of the Gourmet Guild—Yuuki, Kokkoro, Pecorine, and Karyl—continue to scour the world in pursuit of their goal to seek out all delicious food in existence. However, as their adventures progress, the mysteries behind Yuuki's memories, Karyl's allegiance, and Pecorine's heritage begin to come together—seemingly forming the truth that makes up the world's very foundation.  [Written by MAL Rewrite]",,https://myanimelist.net/images/anime/1906/117145l.jpg,True,,,
45560,Orient,Orient,オリエント,TV,12.0,23,Finished Airing,Manga,winter 2022,A.C.G.T.,TV Tokyo;Kodansha;AT-X;Avex Pictures;bilibili;Crunchyroll,Action;Adventure;Fantasy,PG-13 - Teens 13 or older,6.61,45982.0,6830.0,1964,0,527,0,0,0,0,0,2022-01-06,2022-03-24,Thursdays,00:00,"Freed from the rule of samurai 150 years ago, the people of Hinomoto live peaceful lives and revere their liberators—demons whose true forms remain elusive—as gods. Fated to mine rocks for the demons to feast on, Musashi knows the grim truth: humanity is enslaved by these otherworldly beings and the samurai are the last bastion fighting for freedom. Hiding his true opinion from his peers and growing distant from his childhood friend Kojirou Kanemaki, Musashi lives in angst until the day of his graduation.  When the fresh graduates arrive at the mine, they are horrified to see the inhumane treatment of miners and the uncanny physical appearance of their overseers. However, Musashi manages to endure thanks to Kojirou's help. As the demon leader wreaks havoc on the quarry, Musashi is saved once more from certain death by the Takeda samurai clan. Recovering from humiliation and yearning for adventure, Musashi embarks on a journey to become a samurai and form his own clan!  [Written by MAL Rewrite]",,https://myanimelist.net/images/anime/1576/119361l.jpg,True,,Historical;Samurai,Shounen
49310,Fruits Basket: Prelude,,フルーツバスケット -prelude-,Movie,1.0,1,Finished Airing,Manga,None None,TMS Entertainment,TV Tokyo;TV Osaka;Funimation;Nihon Ad Systems;Hakusensha;Avex Pictures;8PAN,Drama;Romance,PG-13 - Teens 13 or older,8.36,49720.0,255.0,1969,129319,874,3896,66906,1362,632,56523,2022-02-18,,,,"Despite Kyouko Honda's tragic death, her vivid memory lives on, providing guidance through times of hardship to her close ones. However, Kyouko was not always the wise and radiant person that she is fondly remembered as in the present day.  Feeling deserted by her own family and rejected by society, a young Kyouko abandons stability for a life of delinquency, jeopardizing her education and future. Fortunately, her descent into despair is interrupted by a fateful encounter with her husband-to-be Katsuya, who has recently started his teaching internship at her school.   With a composure surprisingly unaffected by Kyouko's tantrums, Katsuya quickly wins her over through his gentleness and attention toward her—sincere gestures that she has never received before. As the two grow closer together, Kyouko opens her tormented heart to him and, along with it, a door to new horizons.  [Written by MAL Rewrite]",,https://myanimelist.net/images/anime/1034/120096l.jpg,True,,,Shoujo
49738,Heike Monogatari,The Heike Story,平家物語,TV,11.0,23,Finished Airing,Book,winter 2022,Science SARU,Dentsu;Pony Canyon;Fuji TV;Asmik Ace;BS Fuji;bilibili,Drama;Supernatural,PG-13 - Teens 13 or older,7.8,28880.0,1118.0,2492,92480,853,9652,31226,4188,4688,42726,2022-01-13,2022-03-24,Thursdays,01:05,"The Taira clan, also known as the Heike, holds immense authority over Japan. When a young girl, gifted with an odd eye that allows her to see the future, foolishly disrespects the clan, her father pays the price of her crime with his life. Soon after, as fate would have it, Taira no Shigemori—the eldest son of the clan leader—stumbles upon the same unfortunate girl, who now calls herself ""Biwa."" Biwa informs him that the downfall of the Heike is imminent. After learning of the great injustice Biwa suffered at the Heike's hands, Shigemori vows to take her in and care for her rather than let her be killed.  In an era of rising military tension, the Heike are in the midst of a cunning struggle for power, and bloodstained war is on the horizon. Shigemori, whose eyes allow him to see spirits of the dead, is both anxious and hopeful to prevent his clan's demise. Biwa, however, is reluctant to reveal the future to him and must adapt to her new life filled with both happiness and sorrow in this pivotal chapter in Japanese history.  [Written by MAL Rewrite]",,https://myanimelist.net/images/anime/1282/119979l.jpg,True,,Historical;Samurai,
50185,Ryman's Club,Salaryman's Club,リーマンズクラブ,TV,12.0,23,Finished Airing,Original,winter 2022,LIDENFILMS,TV Asahi;Glovision,Sports,PG-13 - Teens 13 or older,7.34,32168.0,2794.0,2581,0,539,0,0,0,0,0,2022-01-30,2022-04-17,Sundays,01:30,"The world of corporate badminton is not as easy as it seems. Although considered a former child prodigy, Mikoto Shiratori has not been living up to his potential as a badminton player for Mitsuhoshi Bank. Due to a past incident, Mikoto tries to transition from playing doubles to singles; nevertheless, he fails to produce positive results, much to his employer's dismay.  After being fired from the bank, Mikoto is recruited by the Sunlight Beverage corporate badminton team. Surprisingly, not only do practices start in the evening, but he also has to work in the sales department of the company by day. While this is not a novel arrangement, Mikoto had thought he was invited solely to play sports. To make matters worse, he is forced to compete in doubles despite his reluctance.  Struggling to adjust to his new professional life, Mikoto begins to doubt his decision to join the company. However, as he learns more about his latest teammates, he might just find the strength necessary to advance his badminton career.  [Written by MAL Rewrite]",,https://myanimelist.net/images/anime/1140/120215l.jpg,True,,Adult Cast;Workplace,
49893,Kobayashi-san Chi no Maid Dragon S: Nippon no Omotenashi - Attend wa Dragon desu,Miss Kobayashi's Dragon Maid S: Japanese Hospitality (The Attendant is a Dragon),小林さんちのメイドラゴンＳ ニッポンのおもてなし（アテンドはドラゴンです）,Special,1.0,23,Finished Airing,Manga,None None,Kyoto Animation,Pony Canyon;ABC Animation;Bandai Namco Arts,Slice of Life;Supernatural,PG-13 - Teens 13 or older,7.78,35344.0,1163.0,2662,0,291,0,0,0,0,0,2022-01-19,,,,"After Kanna Kamui's escapade to New York leads her to make a new friend named Chloe, Kanna invites her to Japan to go sightseeing. Following their reunion at the airport, Kanna—accompanied by Kobayashi, Tooru, and other friends—takes Chloe around the attractions of Japan, starting with Akihabara. Expertly guided by Tooru, the group enjoys exploring the city before returning home to meet with Saikawa and continue their adventures.  As Chloe's final day in Japan draws near, Kobayashi helps set up a farewell party so everyone can enjoy one last event together before Chloe returns to the United States.  [Written by MAL Rewrite]",,https://myanimelist.net/images/anime/1557/137227l.jpg,True,,,
44511,Chainsaw Man,Chainsaw Man,チェンソーマン,TV,12.0,24,Finished Airing,Manga,fall 2022,MAPPA,dugout,Action;Fantasy,R - 17+ (violence & profanity),8.43,1114947.0,198.0,50,0,55090,0,0,0,0,0,2022-10-12,2022-12-28,Wednesdays,00:00,"Denji is robbed of a normal teenage life, left with nothing but his deadbeat father's overwhelming debt. His only companion is his pet, the chainsaw devil Pochita, with whom he slays devils for money that inevitably ends up in the yakuza's pockets. All Denji can do is dream of a good, simple life: one with delicious food and a beautiful girlfriend by his side. But an act of greedy betrayal by the yakuza leads to Denji's brutal, untimely death, crushing all hope of him ever achieving happiness.  Remarkably, an old contract allows Pochita to merge with the deceased Denji and bestow devil powers on him, changing him into a hybrid able to transform his body parts into chainsaws. Because Denji's new abilities pose a significant risk to society, the Public Safety Bureau's elite devil hunter Makima takes him in, letting him live as long as he obeys her command. Guided by the promise of a content life alongside an attractive woman, Denji devotes everything and fights with all his might to make his naive dreams a reality.  [Written by MAL Rewrite]",,https://myanimelist.net/images/anime/1806/126216l.jpg,True,,Gore;Urban Fantasy,Shounen
50602,Spy x Family Part 2,,SPY×FAMILY,TV,13.0,24,Finished Airing,Manga,fall 2022,Wit Studio;CloverWorks,TV Tokyo;Shogakukan-Shueisha Productions;TOHO animation;Shueisha,Action;Comedy,PG-13 - Teens 13 or older,8.2,608727.0,431.0,156,1116923,7661,146275,767804,26584,20975,155285,2022-10-01,2022-12-24,Saturdays,23:00,"With Anya Forger successfully enrolled at the renowned Eden Academy, Operation Strix advances to its second phase. To investigate Ostanian politician Donovan Desmond, Anya must either befriend his son Damian or collect eight Stella Stars to become an Imperial Scholar. Fortunately, Anya has already acquired her first star. In celebration, her adoptive father, Loid, decides to fulfill her wish to adopt a dog.  During their canine search, Loid receives new orders from his superiors, who have found that a band of Berlint University students is plotting to assassinate Westalis' Minister Brantz using bombs worn by trained dogs. While Loid tries to stop their plans, Anya stumbles upon the terrorists' base of operations. There, she befriends a kindhearted, clairvoyant dog who the family later names Bond.  Although the Forgers continue to lead their individual lives in secrecy, the family—with a new fluffy addition—remains united through all of the unusual obstacles thrown their way.  [Written by MAL Rewrite]",,https://myanimelist.net/images/anime/1111/127508l.jpg,True,,Childcare;Super Power,Shounen
49596,Blue Lock,Blue Lock,ブルーロック,TV,24.0,24,Finished Airing,Manga,fall 2022,8bit,TV Asahi;Lantis;Kodansha;Toy's Factory;Crunchyroll;Bandai Spirits;Bit grooove promotion;Bandai Namco Filmworks;Bandai Namco Music Live,Sports,PG-13 - Teens 13 or older,8.12,487520.0,540.0,240,0,14429,0,0,0,0,0,2022-10-09,2023-03-26,Sundays,01:30,"Yoichi Isagi was mere moments away from scoring a goal that would have sent his high school soccer team to the nationals, but a split-second decision to pass the ball to his teammate cost him that reality. Bitter, confused, and disappointed, Isagi wonders if the outcome would have been different had he not made the pass. When the young striker returns home, an invitation from the Japan Football Union awaits him. Through an arbitrary and biased decision-making process, Isagi is one of three hundred U-18 strikers selected for a controversial project named Blue Lock.   The project's ultimate goal is to turn one of the selected players into the star striker for the Japanese national team. To find the best participant, each diamond in the rough must compete against others through a series of solo and team competitions to rise to the top. Putting aside his ethical objections to the project, Isagi feels compelled to fight his way to the top, even if it means ruthlessly crushing the dreams of 299 aspiring young strikers.  [Written by MAL Rewrite]",,https://myanimelist.net/images/anime/1258/126929l.jpg,True,,Team Sports,Shounen
48316,Kage no Jitsuryokusha ni Naritakute!,The Eminence in Shadow,陰の実力者になりたくて！,TV,20.0,23,Finished Airing,Light novel,fall 2022,Nexus,AT-X;BS NTV;Kadokawa;NewGin;Aiming,Action;Comedy;Fantasy,R - 17+ (violence & profanity),8.22,460079.0,400.0,254,846817,18025,99201,571632,14388,23338,138258,2022-10-05,2023-02-15,Wednesdays,22:30,"For as long as he can remember, Minoru Kagenou has been fixated on becoming as strong as possible, which has led him to undertake all kinds of rigorous training. This wish, however, does not stem from a desire to be recognized by others; rather, Minoru does everything he can to blend in with the crowd. So, while pretending to be a completely average student during the day, he arms himself with a crowbar and ruthlessly thrashes local biker gangs at night. Yet when Minoru finds himself in a truck accident, his ambitions seemingly come to a sudden end. In his final moments, he laments his powerlessness—no matter how much he trained, there was nothing he could do to overcome his human limitations.  But instead of dying, Minoru reawakens as Cid, the second child of the noble Kagenou family, in another world—one where magic is commonplace. With the power he so desired finally within his grasp, he dons the moniker ""Shadow"" and establishes Shadow Garden: a group whose sole purpose is to combat the enigmatic Cult of Diablos, an organization born from Cid's imagination. However, as Shadow Garden grows in both membership and influence, it becomes increasingly apparent that the Cult of Diablos is not as fictional as Cid had intended.  [Written by MAL Rewrite]",,https://myanimelist.net/images/anime/1091/128729l.jpg,True,,Isekai;Reincarnation,
50172,Mob Psycho 100 III,Mob Psycho 100 III,モブサイコ100 III,TV,12.0,23,Finished Airing,Web manga,fall 2022,Bones,Shogakukan-Shueisha Productions;Warner Bros. Japan;KlockWorx;BS Fuji;Hakuhodo DY Music & Pictures;Shogakukan,Action;Comedy;Supernatural,PG-13 - Teens 13 or older,8.71,436398.0,60.0,257,845220,12477,81473,544458,16052,6167,197070,2022-10-06,2022-12-22,Thursdays,00:00,"After foiling a world-threatening plot, Shigeo ""Mob"" Kageyama returns to tackle the more exhausting aspects of his mundane life—starting with filling out his school's nerve-racking career form. Meanwhile, he continues to assist his mentor Arataka Reigen and the office's new recruit, Katsuya Serizawa, in solving paranormal cases of their clients. While continuing his duties, Mob also works on gaining more independence in his esper and human lives, as well as trying to integrate better with the people around him.  However, new supernatural and ordinary challenges test Mob’s emotional stability and force him to confront the realities around him. As he strives to continue forward on the path to maturity, Mob must resolve his emotional crises and reassess the naivety he has held on for so long.  [Written by MAL Rewrite]",,https://myanimelist.net/images/anime/1228/125011l.jpg,True,,,
49918,Boku no Hero Academia 6th Season,My Hero Academia Season 6,僕のヒーローアカデミア,TV,25.0,23,Finished Airing,Manga,fall 2022,Bones,Dentsu;Yomiuri Telecasting;Movic;Sony Music Entertainment;TOHO animation;Shueisha,Action,PG-13 - Teens 13 or older,8.22,414199.0,398.0,278,0,7354,0,0,0,0,0,2022-10-01,2023-03-25,Saturdays,17:30,"With Tomura Shigaraki at its helm, the former Liberation Army is now known as the Paranormal Liberation Front. This organized criminal group poses an immense threat to the Hero Association, not only because of its sheer size and strength, but also the overpowering quirks of Jin ""Twice"" Bubaigawara and Gigantomachia.  As new intel from the covert hero Keigo ""Hawks"" Takami confirms that Shigaraki is nowhere to be seen, the Hero Association decides to strike the enemy headquarters with a surprise attack using the entirety of its assets—and the UA students find themselves on the battlefield once again. As the fight rages on, the unsuspecting villains must regroup and push back, but the brave heroes are determined to eradicate every last one of them.  [Written by MAL Rewrite]",,https://myanimelist.net/images/anime/1483/126005l.jpg,True,,School;Super Power,Shounen
47917,Bocchi the Rock!,Bocchi the Rock!,ぼっち・ざ・ろっく！,TV,12.0,23,Finished Airing,4-koma manga,fall 2022,CloverWorks,Aniplex;Houbunsha,Comedy,PG-13 - Teens 13 or older,8.73,467756.0,48.0,294,0,36129,0,0,0,0,0,2022-10-09,2022-12-25,Sundays,00:00,"Yearning to make friends and perform live with a band, lonely and socially anxious Hitori ""Bocchi"" Gotou devotes her time to playing the guitar. On a fateful day, Bocchi meets the outgoing drummer Nijika Ijichi, who invites her to join Kessoku Band when their guitarist, Ikuyo Kita, flees before their first show. Soon after, Bocchi meets her final bandmate—the cool bassist Ryou Yamada.   Although their first performance together is subpar, the girls feel empowered by their shared love for music, and they are soon rejoined by Kita. Finding happiness in performing, Bocchi and her bandmates put their hearts into improving as musicians while making the most of their fleeting high school days.  [Written by MAL Rewrite]",,https://myanimelist.net/images/anime/1448/127956l.jpg,True,,CGDCT;Music,
