anime_id,title,english_title,japanese_title,type,episodes,duration,status,source,season,studios,producers,genres,rating,score,scored_by,rank,popularity,members,favorites,watching,completed,on_hold,dropped,plan_to_watch,start_date,end_date,broadcast_day,broadcast_time,synopsis,trailer_url,image_url,approved,explicit_genres,themes,demographics
53889,Ao no Exorcist: Shimane Illuminati-hen,Blue Exorcist: Shimane Illuminati Saga,青の祓魔師 島根啓明結社篇,TV,12,23,Finished Airing,Manga,winter 2024,Studio VOLN,Aniplex;Dentsu;Mainichi Broadcasting System;Movic;Rakuonsha;Shueisha,Action;Supernatural,PG-13 - Teens 13 or older,7.12,60279,4331,1498,0,623,0,0,0,0,0,2024-01-07,2024-03-24,Sundays,00:30,"At True Cross Academy, Rin Okumura unknowingly comes across the first signs that something is amiss; ordinary people have been gaining the ability to perceive the invisible creatures that roam the human realm, Assiah. While Rin sees this as an opportunity to make a new friend, his twin brother, Yukio, is more burdened than ever. Swamped with his education, exorcist duties, and teaching position, Yukio has remained silent about his awakened powers, unable to understand their scale or significance.  While Rin and his friends prepare for the annual Exorcist Certification Exam, the True Cross Order has uncovered the first artificial gate to the demonic realm of Gehenna. Witnessing its size and the advanced technology that made it possible, the exorcists realize they are now dealing with the Illuminati, an extremely wealthy and powerful organization. Moreover, the inscrutable Illuminati have planted three spies in the True Cross Order—and one may be hiding among the aspiring exorcists sworn to protect mankind from the demonic threat.  [Written by MAL Rewrite]",,https://myanimelist.net/images/anime/1239/140803l.jpg,True,,Mythology;School,Shounen
53488,"Shin no Nakama ja Nai to Yuusha no Party wo Oidasareta node, Henkyou de Slow Life suru Koto ni Shimashita 2nd","Banished From The Hero's Party, I Decided To Live A Quiet Life In The Countryside Season 2",真の仲間じゃないと勇者のパーティーを追い出されたので、辺境でスローライフすることにしました 2nd,TV,12,23,Finished Airing,Light novel,winter 2024,Studio Flad,AT-X;Magic Capsule;Nippon Columbia;BS NTV;Kadokawa;Kyoto Broadcasting System,Fantasy;Romance,PG-13 - Teens 13 or older,6.77,60200,6397,1714,0,393,0,0,0,0,0,2024-01-07,2024-03-24,Sundays,22:30,"Finally free of her Blessing's impulses, former Hero Ruti has settled into her idyllic slow life with assassin housemate Tisse in the border town of Zoltan. She's happy to once again be close to her apothecary brother Red, the former Guide of her previous Hero's Party, while he's living his best loved-up life with his partner (and soon-to-be fiancee) Princess Rit. Unfortunately, there's a new Hero on the scene whose fundamentalist interpretation of his Blessing's urges will bring conflict and despair to sleepy Zoltan…  (Source: ANN)",,https://myanimelist.net/images/anime/1873/139792l.jpg,True,,,
50803,Jaku-Chara Tomozaki-kun 2nd Stage,Bottom-Tier Character Tomozaki 2nd Stage,弱キャラ友崎くん 2nd STAGE,TV,13,23,Finished Airing,Light novel,winter 2024,Project No.9,Pony Canyon;AT-X;KlockWorx;Asmik Ace;Tokyo MX;BS11;APDREAM;arma bianca;Bit grooove promotion;Dream Shift;Happinet Phantom Studios;Bergamo,Drama;Romance,PG-13 - Teens 13 or older,7.05,63205,4754,1753,0,622,0,0,0,0,0,2024-01-03,2024-03-27,Wednesdays,21:00,"Fumiya Tomozaki is now cruising through the game of life—all thanks to the guidance of Aoi Hinami, his popular classmate and rival in the online game Attack Families, widely known as ""Tackfam."" As the summer holiday draws to a close and a new term commences, Tomozaki reunites with Aoi, who reminds him of his ultimate goals: to become well-liked among his peers and find himself a girlfriend.  However, Tomozaki puts his ambitions on hold when his innocent friend, Hanabi Natsubayashi, starts being bullied. To make matters worse, Aoi is characteristically out of touch with the situation. But Tomozaki is not alone in resolving this issue—he now has a group of loyal friends who are all determined to help Hanabi and ensure they enjoy their youths together to the fullest.  [Written by MAL Rewrite]",,https://myanimelist.net/images/anime/1143/140807l.jpg,True,,School,
55129,Oroka na Tenshi wa Akuma to Odoru,The Foolish Angel Dances with the Devil,愚かな天使は悪魔と踊る,TV,12,23,Finished Airing,Manga,winter 2024,Children's Playground Entertainment,TV Tokyo;Pony Canyon;Movic;AT-X;Gaina;Docomo Anime Store;Crunchyroll;Kadokawa;Aoni Production;Nihon Keizai Koukokusha;ANLA,Comedy;Romance;Supernatural,PG-13 - Teens 13 or older,6.91,56933,5530,1786,0,451,0,0,0,0,0,2024-01-09,2024-03-26,Tuesdays,01:30,"Losing their war against Heaven's angel army, the demons of Hell are on the cusp of collapse. As a last ditch attempt to turn the tides of the war, the demons send Akutsu Masatora to the mortal plane on Earth to save their homeland from the angels. Disguising himself as a high school student, Akutsu seeks to recruit someone with the capability to lead the demons to victory.  Akutsu does not have to look far: among his classmates is the magnificent Lily Amane, a transfer student who seems like the perfect candidate for Akutsu's plans. But as luck would have it, Lily is one of the very angels that Akutsu is meant to be fighting against, and his attempt to recruit her might end up being the biggest blunder in the failing war. Worse yet, Akutsu may fall in love with his own worst enemy.  [Written by MAL Rewrite]",,https://myanimelist.net/images/anime/1902/139271l.jpg,True,,Mythology;School,Seinen
54265,Kekkon Yubiwa Monogatari,Tales of Wedding Rings,結婚指輪物語,TV,12,23,Finished Airing,Manga,winter 2024,Staple Entertainment,Square Enix;Toei Video;Pony Canyon;AT-X;KlockWorx;Studio Mausu;Hakuhodo DY Music & Pictures;BS11;APDREAM;Bushiroad Move,Action;Fantasy;Romance;Ecchi,R+ - Mild Nudity,6.07,57377,10572,1833,0,399,0,0,0,0,0,2024-01-06,2024-03-23,Saturdays,21:30,"A decade ago, princess Krystal Novaty “Hime” Nokanatika traveled from another world to escape assassination attempts by an evil force. When she arrives in modern-day Japan, she encounters Haruto Satou. With him she shares a promise: he must forget what he has just witnessed, and the two will become friends. Now heading back to the Nokanatika Kingdom to fulfill her royal duties, Hime bids farewell to Haruto. However, when the young man suddenly remembers his first meeting with Hime, he rushes to the location where she first appeared and crosses the dimensional portal to be reunited with her.  His arrival disrupts the marriage ceremony between Hime and prince Marmarugias Gisaras. The wedding is brutally interrupted by the attack of an abyss monster who threatens the princess' life. Acting impulsively, Hime decides to exchange rings with Haruto, which grants her new husband light powers that permit him to slay the monster. Now dubbed as the Ring King, Haruto must marry four other princesses to acquire new magical powers and have a chance to prevail in his fight against the enemy of the world: the Abyss King.  [Written by MAL Rewrite]",,https://myanimelist.net/images/anime/1452/139991l.jpg,True,,Harem;Isekai,Seinen
53590,Saijaku Tamer wa Gomi Hiroi no Tabi wo Hajimemashita.,The Weakest Tamer Began a Journey to Pick Up Trash,最弱テイマーはゴミ拾いの旅を始めました。,TV,12,23,Finished Airing,Light novel,winter 2024,Studio Massket,Lantis;Movic;KlockWorx;Tokyo MX;ABC Animation;TO Books;NetEase;BS Asahi;Bandai Namco Music Live;ABC Frontier,Adventure;Fantasy,PG-13 - Teens 13 or older,7.57,68376,1905,1852,0,768,0,0,0,0,0,2024-01-12,2024-03-29,Fridays,23:00,"Born into a loving family, Femicia appears to have a bright future ahead of her. When she finally turns five, the time comes to go to the church to have her skills appraised. However, while she does receive a monster tamer skill, it turns out that Femicia has zero stars for that ability. To make matters worse, society considers those who have zero stars to be harbingers of misfortune; as a result, Femicia is shunned by everyone—including her family.  Soon enough, Femicia is chased out of her village and is constantly on the run. Fearing for her life, she decides to masquerade as a boy and change her name to Ivy. With a goal given to her by a fortune teller to reach the royal capital, Ivy meets and successfully tames a slime, starting an unlikely friendship that may provide a means to get the destiny she deserves.  [Written by MAL Rewrite]",,https://myanimelist.net/images/anime/1280/138474l.jpg,True,,Crossdressing;Isekai;Reincarnation,
54449,Ishura,Ishura,異修羅,TV,12,23,Finished Airing,Light novel,winter 2024,Passione,Magic Capsule;Tencent Japan;Kadokawa;Aiming,Action;Adventure;Fantasy,R - 17+ (violence & profanity),6.75,42594,6488,1940,0,476,0,0,0,0,0,2024-01-03,2024-03-20,Wednesdays,23:00,"After the demise of the demon king, the resulting power vacuum has broken the balance of the world. Eager to claim this power for themselves, self-proclaimed demon kings from various worlds assemble in the New Principality of Lithia to fight for it. Among them, master swordsman Soujirou Yagyuu seeks to take this coveted position for himself. Joined by Tooi Kagizume no Yuno, a young girl he saved from an army of golems that destroyed her city, Soujirou enters Lithia to battle his way to the title.  At the same time, the leaders of the Aureatia Kingdom seek to destabilize Lithia by launching bandits after the convoys of merchandise transiting through the principality. Enraged, Imashime of Taren, the founder of Lithia and defector from Aureatia, sends vicious thief Kasasagi no Dakai to investigate the origin of these attacks. With war on the brink of eruption, no one can predict what influence the contenders for the demon king's throne will have on the coming conflict.  [Written by MAL Rewrite]",,https://myanimelist.net/images/anime/1364/140875l.jpg,True,,Gore;Isekai,
