anime_id,title,english_title,japanese_title,type,episodes,duration,status,source,season,studios,producers,genres,rating,score,scored_by,rank,popularity,members,favorites,watching,completed,on_hold,dropped,plan_to_watch,start_date,end_date,broadcast_day,broadcast_time,synopsis,trailer_url,image_url,approved,explicit_genres,themes,demographics
53889,Ao no Exorcist: Shimane Illuminati-hen,Blue Exorcist: Shimane Illuminati Saga,青の祓魔師 島根啓明結社篇,TV,12.0,23,Finished Airing,Manga,winter 2024,Studio VOLN,Aniplex;Dentsu;Mainichi Broadcasting System;Movic;Rakuonsha;Shueisha,Action;Supernatural,PG-13 - Teens 13 or older,7.12,61475.0,4182.0,1499,0,626,0,0,0,0,0,2024-01-07,2024-03-24,Sundays,00:30,"At True Cross Academy, Rin Okumura unknowingly comes across the first signs that something is amiss; ordinary people have been gaining the ability to perceive the invisible creatures that roam the human realm, Assiah. While Rin sees this as an opportunity to make a new friend, his twin brother, Yukio, is more burdened than ever. Swamped with his education, exorcist duties, and teaching position, Yukio has remained silent about his awakened powers, unable to understand their scale or significance.  While Rin and his friends prepare for the annual Exorcist Certification Exam, the True Cross Order has uncovered the first artificial gate to the demonic realm of Gehenna. Witnessing its size and the advanced technology that made it possible, the exorcists realize they are now dealing with the Illuminati, an extremely wealthy and powerful organization. Moreover, the inscrutable Illuminati have planted three spies in the True Cross Order—and one may be hiding among the aspiring exorcists sworn to protect mankind from the demonic threat.  [Written by MAL Rewrite]",,https://cdn.myanimelist.net/images/anime/1239/140803l.jpg,True,,Mythology;School,Shounen
53488,"Shin no Nakama ja Nai to Yuusha no Party wo Oidasareta node, Henkyou de Slow Life suru Koto ni Shimashita 2nd","Banished From The Hero's Party, I Decided To Live A Quiet Life In The Countryside Season 2",真の仲間じゃないと勇者のパーティーを追い出されたので、辺境でスローライフすることにしました 2nd,TV,12.0,23,Finished Airing,Light novel,winter 2024,Studio Flad,AT-X;Magic Capsule;Nippon Columbia;BS NTV;Kadokawa;Kyoto Broadcasting System,Fantasy;Romance,PG-13 - Teens 13 or older,6.76,61648.0,6232.0,1700,0,397,0,0,0,0,0,2024-01-07,2024-03-24,Sundays,22:30,"Finally free of her Blessing's impulses, former Hero Ruti has settled into her idyllic slow life with assassin housemate Tisse in the border town of Zoltan. She's happy to once again be close to her apothecary brother Red, the former Guide of her previous Hero's Party, while he's living his best loved-up life with his partner (and soon-to-be fiancee) Princess Rit. Unfortunately, there's a new Hero on the scene whose fundamentalist interpretation of his Blessing's urges will bring conflict and despair to sleepy Zoltan…  (Source: ANN)",,https://cdn.myanimelist.net/images/anime/1873/139792l.jpg,True,,,
50803,Jaku-Chara Tomozaki-kun 2nd Stage,Bottom-Tier Character Tomozaki 2nd Stage,弱キャラ友崎くん 2nd STAGE,TV,13.0,23,Finished Airing,Light novel,winter 2024,Project No.9,Pony Canyon;AT-X;KlockWorx;Asmik Ace;Tokyo MX;BS11;APDREAM;arma bianca;Bit grooove promotion;Dream Shift;Happinet Phantom Studios;Bergamo,Drama;Romance,PG-13 - Teens 13 or older,7.04,64358.0,4643.0,1750,0,619,0,0,0,0,0,2024-01-03,2024-03-27,Wednesdays,21:00,"Fumiya Tomozaki is now cruising through the game of life—all thanks to the guidance of Aoi Hinami, his popular classmate and rival in the online game Attack Families, widely known as ""Tackfam."" As the summer holiday draws to a close and a new term commences, Tomozaki reunites with Aoi, who reminds him of his ultimate goals: to become well-liked among his peers and find himself a girlfriend.  However, Tomozaki puts his ambitions on hold when his innocent friend, Hanabi Natsubayashi, starts being bullied. To make matters worse, Aoi is characteristically out of touch with the situation. But Tomozaki is not alone in resolving this issue—he now has a group of loyal friends who are all determined to help Hanabi and ensure they enjoy their youths together to the fullest.  [Written by MAL Rewrite]",,https://cdn.myanimelist.net/images/anime/1143/140807l.jpg,True,,School,
55129,Oroka na Tenshi wa Akuma to Odoru,The Foolish Angel Dances with the Devil,愚かな天使は悪魔と踊る,TV,12.0,23,Finished Airing,Manga,winter 2024,Children's Playground Entertainment,TV Tokyo;Pony Canyon;Movic;AT-X;Gaina;Docomo Anime Store;Crunchyroll;Kadokawa;Aoni Production;Nihon Keizai Koukokusha;ANLA,Comedy;Romance;Supernatural,PG-13 - Teens 13 or older,6.9,58003.0,5359.0,1765,0,450,0,0,0,0,0,2024-01-09,2024-03-26,Tuesdays,01:30,"Losing their war against Heaven's angel army, the demons of Hell are on the cusp of collapse. As a last ditch attempt to turn the tides of the war, the demons send Akutsu Masatora to the mortal plane on Earth to save their homeland from the angels. Disguising himself as a high school student, Akutsu seeks to recruit someone with the capability to lead the demons to victory.  Akutsu does not have to look far: among his classmates is the magnificent Lily Amane, a transfer student who seems like the perfect candidate for Akutsu's plans. But as luck would have it, Lily is one of the very angels that Akutsu is meant to be fighting against, and his attempt to recruit her might end up being the biggest blunder in the failing war. Worse yet, Akutsu may fall in love with his own worst enemy.  [Written by MAL Rewrite]",,https://cdn.myanimelist.net/images/anime/1902/139271l.jpg,True,,Mythology;School,Seinen
54265,Kekkon Yubiwa Monogatari,Tales of Wedding Rings,結婚指輪物語,TV,12.0,23,Finished Airing,Manga,winter 2024,Staple Entertainment,Square Enix;Toei Video;Pony Canyon;AT-X;KlockWorx;Studio Mausu;Hakuhodo DY Music & Pictures;BS11;APDREAM;Bushiroad Move,Action;Fantasy;Romance;Ecchi,R+ - Mild Nudity,6.07,58767.0,10522.0,1812,0,403,0,0,0,0,0,2024-01-06,2024-03-23,Saturdays,21:30,"A decade ago, princess Krystal Novaty “Hime” Nokanatika traveled from another world to escape assassination attempts by an evil force. When she arrives in modern-day Japan, she encounters Haruto Satou. With him she shares a promise: he must forget what he has just witnessed, and the two will become friends. Now heading back to the Nokanatika Kingdom to fulfill her royal duties, Hime bids farewell to Haruto. However, when the young man suddenly remembers his first meeting with Hime, he rushes to the location where she first appeared and crosses the dimensional portal to be reunited with her.  His arrival disrupts the marriage ceremony between Hime and prince Marmarugias Gisaras. The wedding is brutally interrupted by the attack of an abyss monster who threatens the princess' life. Acting impulsively, Hime decides to exchange rings with Haruto, which grants her new husband light powers that permit him to slay the monster. Now dubbed as the Ring King, Haruto must marry four other princesses to acquire new magical powers and have a chance to prevail in his fight against the enemy of the world: the Abyss King.  [Written by MAL Rewrite]",,https://cdn.myanimelist.net/images/anime/1452/139991l.jpg,True,,Harem;Isekai,Seinen
53590,Saijaku Tamer wa Gomi Hiroi no Tabi wo Hajimemashita.,The Weakest Tamer Began a Journey to Pick Up Trash,最弱テイマーはゴミ拾いの旅を始めました。,TV,12.0,23,Finished Airing,Light novel,winter 2024,Studio Massket,Lantis;Movic;KlockWorx;Tokyo MX;ABC Animation;TO Books;NetEase;BS Asahi;Bandai Namco Music Live;ABC Frontier,Adventure;Fantasy,PG-13 - Teens 13 or older,7.57,69865.0,1894.0,1837,0,790,0,0,0,0,0,2024-01-12,2024-03-29,Fridays,23:00,"Born into a loving family, Femicia appears to have a bright future ahead of her. When she finally turns five, the time comes to go to the church to have her skills appraised. However, while she does receive a monster tamer skill, it turns out that Femicia has zero stars for that ability. To make matters worse, society considers those who have zero stars to be harbingers of misfortune; as a result, Femicia is shunned by everyone—including her family.  Soon enough, Femicia is chased out of her village and is constantly on the run. Fearing for her life, she decides to masquerade as a boy and change her name to Ivy. With a goal given to her by a fortune teller to reach the royal capital, Ivy meets and successfully tames a slime, starting an unlikely friendship that may provide a means to get the destiny she deserves.  [Written by MAL Rewrite]",,https://cdn.myanimelist.net/images/anime/1280/138474l.jpg,True,,Crossdressing;Isekai;Reincarnation,
54449,Ishura,Ishura,異修羅,TV,12.0,23,Finished Airing,Light novel,winter 2024,Passione,Magic Capsule;Tencent Japan;Kadokawa;Aiming,Action;Adventure;Fantasy,R - 17+ (violence & profanity),6.74,43166.0,6326.0,1925,0,475,0,0,0,0,0,2024-01-03,2024-03-20,Wednesdays,23:00,"After the demise of the demon king, the resulting power vacuum has broken the balance of the world. Eager to claim this power for themselves, self-proclaimed demon kings from various worlds assemble in the New Principality of Lithia to fight for it. Among them, master swordsman Soujirou Yagyuu seeks to take this coveted position for himself. Joined by Tooi Kagizume no Yuno, a young girl he saved from an army of golems that destroyed her city, Soujirou enters Lithia to battle his way to the title.  At the same time, the leaders of the Aureatia Kingdom seek to destabilize Lithia by launching bandits after the convoys of merchandise transiting through the principality. Enraged, Imashime of Taren, the founder of Lithia and defector from Aureatia, sends vicious thief Kasasagi no Dakai to investigate the origin of these attacks. With war on the brink of eruption, no one can predict what influence the contenders for the demon king's throne will have on the coming conflict.  [Written by MAL Rewrite]",,https://cdn.myanimelist.net/images/anime/1364/140875l.jpg,True,,Gore;Isekai,
58567,Ore dake Level Up na Ken Season 2: Arise from the Shadow,Solo Leveling Season 2: Arise from the Shadow,俺だけレベルアップな件 Season 2 -Arise from the Shadow-,TV,13.0,23,Finished Airing,Web manga,winter 2025,A-1 Pictures,Aniplex;Crunchyroll;Sonilude;Netmarble;Kakao piccoma;D&C Media,Action;Adventure;Fantasy,R - 17+ (violence & profanity),8.52,516692.0,154.0,287,0,11596,0,0,0,0,0,2025-01-05,2025-03-30,Sundays,00:00,"Sung Jin-Woo, dubbed the weakest hunter of all mankind, grows stronger by the day with the supernatural powers he has gained. However, keeping his skills hidden becomes more difficult as dungeon-related incidents pile up around him.  When Jin-Woo and a few other low-ranked hunters are the only survivors of a dungeon that turns out to be a bigger challenge than initially expected, he draws attention once again, and hunter guilds take an increased interest in him. Meanwhile, a strange hunter who has been lost for ten years returns with a dire warning about an upcoming catastrophic event. As the calamity looms closer, Jin-Woo must continue leveling up to make sure nothing stops him from reaching his ultimate goal—saving the life of his mother.  [Written by MAL Rewrite]",,https://cdn.myanimelist.net/images/anime/1448/147351l.jpg,True,,Adult Cast;Urban Fantasy,
58514,Kusuriya no Hitorigoto 2nd Season,The Apothecary Diaries Season 2,薬屋のひとりごと 第2期,TV,24.0,24,Finished Airing,Light novel,winter 2025,OLM;TOHO animation STUDIO,Dentsu;Square Enix;Nippon Television Network;TOHO animation;Sound Team Don Juan;Shogakukan;Imagica Infos,Drama;Mystery,PG-13 - Teens 13 or older,8.91,277139.0,24.0,489,0,8162,0,0,0,0,0,2025-01-10,2025-07-04,Fridays,23:00,"Using her wit and vast knowledge of medicines and poisons alike, Maomao played a pivotal role in solving a series of mysteries and conspiracies that plagued the imperial court. Having recently come to terms with the secrets of her parents, she returns to fulfill her normal duties on behalf of the emperor's highest-ranking consorts. Maomao also works alongside the eunuch Jinshi to better the consorts' many ladies-in-waiting, including helping them learn to read.  However, with the arrival of a merchant caravan comes a new wave of intrigue. A pattern of strange coincidences involving the visitors and their wares unsettles Maomao, driving her to investigate the puzzling circumstances behind the convoy. As dangers from both outside and within threaten the balance between the imperial concubines, Maomao continues to utilize her cunning and medical expertise to keep the women safe from harm.  [Written by MAL Rewrite]",,https://cdn.myanimelist.net/images/anime/1025/147458l.jpg,True,,Historical;Medical,
58939,Sakamoto Days,Sakamoto Days,SAKAMOTO DAYS,TV,11.0,23,Finished Airing,Manga,winter 2025,TMS Entertainment,TV Tokyo;Shueisha,Action;Comedy,R - 17+ (violence & profanity),7.59,245366.0,1820.0,500,0,2787,0,0,0,0,0,2025-01-11,2025-03-22,Saturdays,23:00,"The name Tarou Sakamoto once instilled fear in every villain. No other professional hitman matched his prowess, and fellow assassins revered him. However, Sakamoto fell in love. In five short years, he married, became a father, put on some weight, and traded his weapons for an apron as he became the owner of a humble convenience store.  Although Sakamoto is decidedly retired, he finds his old life of crime hard to shake off. His former partner, Shin Asakura, reappears and resolves to stay with Sakamoto's family under their strict no-kill rule. To make matters worse, a large bounty is placed on Sakamoto's head. Numerous assassins now pursue him—but they are in for a surprise. Sakamoto has not lost his edge, and no matter what tricks his enemies pull, he will fight off every last one to protect his dear family.  [Written by MAL Rewrite]",,https://cdn.myanimelist.net/images/anime/1026/146459l.jpg,True,,Adult Cast;Organized Crime,Shounen
57592,Dr. Stone: Science Future,Dr. Stone: Science Future,Dr.STONE SCIENCE FUTURE,TV,12.0,24,Finished Airing,Manga,winter 2025,TMS Entertainment,TOHO animation;Shueisha,Adventure;Comedy,PG-13 - Teens 13 or older,8.26,158571.0,373.0,890,0,1328,0,0,0,0,0,2025-01-09,2025-03-27,Thursdays,22:00,"Having resolved the crisis in the Petrification Kingdom, Senkuu and his companions gear up to deal directly with the mastermind behind the petrification phenomenon—who supposedly resides on the moon. The ambitious spaceship project, however, requires immense manpower and critical resources scattered across the world. Thus, the Kingdom of Science exploration team kick-starts its transcontinental journey on the ship Perseus to gather them all.  Equipped with modern technology and bolstered by the new, capable members in their ranks, the exploration team feels confident about setting sail to their first destination: America. They soon realize that the region now hosts adversaries controlling the resources they need, doing so with scientific technology which rivals and even exceeds their own. In a battle of science versus science, Senkuu and his team must outsmart their rivals if they are to have any chance of ensuring the continued survival and rejuvenation of humanity.  [Written by MAL Rewrite]",,https://cdn.myanimelist.net/images/anime/1403/146479l.jpg,True,,,Shounen
57616,Kimi no Koto ga Daidaidaidaidaisuki na 100-nin no Kanojo 2nd Season,"The 100 Girlfriends Who Really, Really, Really, Really, Really Love You Season 2",君のことが大大大大大好きな100人の彼女 2期,TV,12.0,23,Finished Airing,Manga,winter 2025,Bibury Animation Studios,Lantis;Movic;Bushiroad;Tokyo MX;Shueisha;Bandai Namco Filmworks;Bandai Namco Music Live;Anici,Comedy;Romance,PG-13 - Teens 13 or older,7.87,89626.0,1001.0,1512,0,1371,0,0,0,0,0,2025-01-12,2025-03-30,Sundays,22:30,"Ever since Rentarou Aijou found out that he would meet a total of one hundred soulmates in high school, his life has been anything but boring. Now with six girlfriends—each with their own unique quirks—Rentarou has never been happier.  The group expands once again when Rentarou meets Kurumi Haraga, a girl with a never-ending appetite; and Mei Meido, the maid of the Hanazono family. As he encounters more of his soulmates, Rentarou has to juggle ways to date them all, since failure results in a grim fate. Fortunately, Rentarou has no shortage of love to give to each of his girlfriends!  [Written by MAL Rewrite]",,https://cdn.myanimelist.net/images/anime/1093/145470l.jpg,True,,Harem;Parody;School,Seinen
58502,Zenshuu.,Zenshu,全修。,TV,12.0,23,Finished Airing,Original,winter 2025,MAPPA,TV Tokyo;Movic;Bushiroad;Twin Engine;Rakuten;dugout,Action;Fantasy,PG-13 - Teens 13 or older,7.57,73852.0,1909.0,1568,0,971,0,0,0,0,0,2025-01-05,2025-03-23,Sundays,23:45,"Since Natsuko Hirose became a professional animator, she has quickly risen to stardom and even debuted as the director of her own anime series. Everyone expects her next project to be another masterpiece; but Natsuko struggles to meet deadlines, micromanaging every aspect of the work until one day, she collapses from food poisoning.  When Natsuko wakes up, she finds herself in an unfamiliar place, immediately pursued by a monster called a Void. However, she is saved just in time by the members of the honored Nine Soldiers: Luke Braveheart, Memmeln, QJ, and Unio. Natsuko is suspicious at first, but soon realizes that she has been summoned to the world of her favorite childhood movie—A Tale of Perishing. As familiar events begin to line up, she seeks to avert the tragic outcome of the upcoming Void invasion.  Much to her surprise, Natsuko gains the power to turn her drawings into reality when her animation peg bar lights up. She begins eliminating the Voids as they come, changing the story and joining the Nine Soldiers. Using her new ability and vast knowledge of the movie, Natsuko wants to change the events to her desire and find a way back home.  [Written by MAL Rewrite]",,https://cdn.myanimelist.net/images/anime/1003/146841l.jpg,True,,Isekai,
59135,Class no Daikirai na Joshi to Kekkon suru Koto ni Natta.,I'm Getting Married to a Girl I Hate in My Class,クラスの大嫌いな女子と結婚することになった。,TV,12.0,23,Finished Airing,Light novel,winter 2025,Studio Gokumi;AXsiZ,Aniplex;Movic;Magic Capsule;Tokyo MX;BS11;Egg Firm;Kadokawa,Comedy;Romance,PG-13 - Teens 13 or older,6.74,83693.0,6311.0,1608,0,900,0,0,0,0,0,2025-01-03,2025-03-21,Fridays,23:30,"There is only one person that high school student Saito Houjou truly cannot stand—and that is his temperamental classmate, Akane Sakuramori. The two have always been on bad terms; their contrasting views and personalities only lead to endless fighting. However, everything changes when Saito's grandfather and Akane's grandmother arrange a sudden meeting and insist that the two get married!  Walking down the aisle is the last thing Saito and Akane want, but they are quickly coerced into accepting the ridiculous plan and soon move into a shared house as husband and wife. Although Saito and Akane despise each other, navigating life together under the same roof may just turn their bitter hatred into everlasting love.  [Written by MAL Rewrite]",,https://cdn.myanimelist.net/images/anime/1775/147330l.jpg,True,,,
56701,Watashi no Shiawase na Kekkon 2nd Season,My Happy Marriage Season 2,わたしの幸せな結婚,TV,13.0,23,Finished Airing,Novel,winter 2025,Kinema Citrus,Square Enix;Glovision;Toy's Factory;Miracle Bus;Kadokawa;Bandai Namco Music Live,Drama;Fantasy;Romance,PG-13 - Teens 13 or older,7.42,54820.0,2560.0,1723,0,691,0,0,0,0,0,2025-01-06,2025-04-09,Mondays,22:30,"Following the awakening of her Dream-Sight ability, Miyo Saimori reunites with her fiancé, Kiyoka Kudou, the captain of the special forces protecting the country against ill-intended individuals gifted with exceptional powers. However, the couple's blissful life is suddenly interrupted when Takaihito, the top contender for the imperial throne, sends Kiyoka on a dangerous mission.  Traveling with Miyo to the remote household of his parents, Kiyoka must investigate unusual reports of demons in the region. Meanwhile, Miyo tries to gain the approbation of her callous mother-in-law, Fuyu, who refuses to recognize her as a family member.  After Kiyoka repels an attack by the Gifted Communion, a subversive sect of special abilities wielders, he returns to the capital alongside his fiancée. As the looming threat against the imperial authority intensifies, Kiyoka must thwart the Gifted Communion's plans to protect Miyo and everyone he holds dear.  [Written by MAL Rewrite]",,https://cdn.myanimelist.net/images/anime/1946/146770l.jpg,True,,Adult Cast;Historical,
55997,"Guild no Uketsukejou desu ga, Zangyou wa Iya nanode Boss wo Solo Toubatsu Shiyou to Omoimasu","I May Be a Guild Receptionist, but I'll Solo Any Boss to Clock Out on Time",ギルドの受付嬢ですが、残業は嫌なのでボスをソロ討伐しようと思います,TV,12.0,24,Finished Airing,Light novel,winter 2025,CloverWorks,Aniplex;Movic;Half H.P Studio;Good Smile Company;BS11;Kadokawa,Action;Adventure;Comedy;Fantasy,PG-13 - Teens 13 or older,6.64,68090.0,7023.0,1768,0,418,0,0,0,0,0,2025-01-11,2025-03-29,Saturdays,00:00,"Alina Clover becomes an adventurers' guild receptionist, believing that—unlike the adventurers who risk their lives every day to conquer dungeons—she will enjoy a safe and comfortable career with plenty of benefits. She hates overtime work more than anything, longing for the day when she can finally clock out on time. Sadly, that day has yet to come, as she must constantly trudge through piles upon piles of paperwork.  To make matters worse, when adventurers take too long to subjugate a dungeon boss, the backlog only grows, forcing Alina into even more overtime. Whenever her patience runs thin, she dons a disguise and takes care of the boss herself, soon gaining infamy as the enigmatic ""Executioner."" Alina has managed to keep this secret for two years—until she finishes off a boss assigned to the high-ranking party Silver Sword. Unfortunately for her, the party's eagle-eyed leader, Jade Scrade, deduces her identity, jeopardizing the receptionist's dream of a carefree life.  [Written by MAL Rewrite]",,https://cdn.myanimelist.net/images/anime/1904/144608l.jpg,True,,,
59361,Kono Kaisha ni Suki na Hito ga Imasu,I Have a Crush at Work,この会社に好きな人がいます,TV,12.0,23,Finished Airing,Manga,winter 2025,Blade,VAP;Imagin;Nippon Columbia;KlockWorx;BS Fuji;Tokyo MX;bilibili;INSPION Edge,Comedy;Romance,PG-13 - Teens 13 or older,7.49,46780.0,2226.0,1874,0,573,0,0,0,0,0,2025-01-06,2025-03-24,Mondays,23:00,"Coworkers Yui Mitsuya and Masugu Tateishi are the last people anyone would expect to get along—especially with their constant office quarrels. However, looks can be deceiving: they are actually dating! Afraid to lose the peace of their professional lives, Yui and Masugu play up their discord even more to ensure nobody discovers their secret.  As awkward situations and close calls pile up, the risk of Yui and Masugu's coworkers catching on increases. Keeping up the pretense is not easy, but with each new day, their relationship only grows stronger.  [Written by MAL Rewrite]",,https://cdn.myanimelist.net/images/anime/1123/146384l.jpg,True,,Adult Cast;Workplace,Seinen
59144,"Fuguushoku ""Kanteishi"" ga Jitsu wa Saikyou Datta","Even Given the Worthless ""Appraiser"" Class, I’m Actually the Strongest",不遇職【鑑定士】が実は最強だった,TV,12.0,23,Finished Airing,Light novel,winter 2025,Okuruto Noboru,Sotsu;Kodansha;Movic;Tokyo MX;BS11;Crunchyroll;Exa International;AQUA ARIS;Bit grooove promotion;Kotowari;West Japan Marketing Communications,Action;Adventure;Fantasy,R - 17+ (violence & profanity),6.33,64507.0,8980.0,1918,0,334,0,0,0,0,0,2025-01-09,2025-03-27,Thursdays,23:30,"In a world where strong classes are preferred, Ein has always been treated with disdain due to his mere Appraiser job, which allows him to appraise anything. During a dungeon expedition—where Ein usually only watches from the sidelines—a dangerous enemy appears, and Ein's allies use him as bait to escape the dire situation.  Prepared to die, Ein falls into the abyss, where he is miraculously saved by Yuri, the spirit of the long-lost World Tree, and Ursula, her fierce guardian. The two utilize their marvelous abilities to heal Ein's grave injuries and bestow him with the prosthetic ""Spirit Eye,"" which lets him predict his opponents' moves and receive an infinite number of skills.  To help Ein leave the dungeon depths, Ursula decides to train him. After weeks of hard training, Ein's body is enchanted even further, and he takes Yuri and Ursula back to the surface with him. As the trio begins their journey together, Ein aims to reunite Yuri with her family and become a hero who will never be forgotten.  [Written by MAL Rewrite]",,https://cdn.myanimelist.net/images/anime/1683/146293l.jpg,True,,,
